__id__,caption,category_code,country_code,created_at,url
01wC2lzOJm0V174a77XX,A group of people wearing Chinese traditional Hmong clong with silver decorlation on their hat walking on the street,CLOTH,CHN,2024-07-01T13:40:02Z,https://www.pexels.com/photo/people-on-festival-on-street-8898778/
0F2Xy707nWTQ4O2LM9bw,the backview two people wearing traditional Chinese Han Dynasty clothing,CLOTH,CHN,2024-07-01T13:40:02Z,https://pixabay.com/zh/photos/hanfu-chinese-style-photography-6910631/
0LIeSSbOpKluKHlaOVIT,a Chinese old man practicing Tai Chi in white kim on the grass,DANCE,CHN,2024-07-01T13:40:02Z,https://www.keepmovingokc.org/wp-content/uploads/sites/www.keepmovingokc.org/images/2022/01/Tai-Chi-chuan-practitioner-768x520.jpg
0Lt5S0VZSw7lssFI7K3A,some people standing up holding the Chinese flags,PEOPLE,CHN,2024-07-01T13:40:02Z,https://img2.chinadaily.com.cn/images/201910/05/5d97a319a310cf3e979fcdff.jpeg
0iVZ8bgJcESvrnI0iOmp,Chinese classical dancers in green silk costumes and makeup,DANCE,CHN,2024-07-01T13:40:02Z,https://static.careerengine.us/api/aov2/https%3A_%7C__%7C_mmbiz.qpic.cn_%7C_mmbiz_png_%7C_pSThXxDOdw8EQwHTUsIR0WibsAgnwruPkVMOo7dDnrZVzqvXg3uXP8mJu4c1jZ12icJNquKouMbECCC7G87YkSrg_%7C_640%3Fwx_fmt%3Dpng
1kgs9DGabOgikdSuXhGG,women in pink Tang suit playing Chinese traditional instrument pipa in a concert,DANCE,CHN,2024-07-01T13:40:02Z,https://live.staticflickr.com/3815/10083150584_c2a66fe53e_b.jpg
1ttEQBXeKWMbK3LD9OgS,a street in Hong Kong with cars flanked by buildings and stores,CITIES,CHN,2024-07-01T13:40:02Z,https://www.istockphoto.com/photo/hong-kong-street-scene-mongkok-district-with-traffic-gm915312144-251906958?phrase=hong+kong+street&searchscope=image%2Cfilm
2CnkisCuzHnfzmN7JNuy,a man playing a Chinese traditional wooden flute,DANCE,CHN,2024-07-01T13:40:02Z,https://www.pexels.com/photo/man-using-a-flute-12391588/
2ilIFvhJdFAou3MoMbB6,two Chinese ladies are sharing a table full of Chinese dishes,PEOPLE,CHN,2024-07-01T13:40:02Z,https://www.pexels.com/photo/a-grandmother-feeding-her-granddaughter-7363751/
2kpWWQVnrWZllDfhcBJe,"many Cantonese style Chinese dishes, including steamed fish, sliced duck, buns, spring rolls and congee",FOOD,CHN,2024-07-01T13:40:02Z,https://rimage.gnst.jp/rest/img/grx6kkd10000/s_004b.jpg?dt=1648166976
34g4d82RE2FZ3ufSWORN,"the young dancer wearing dress doing a chinese classical dance, with some of their arms stretched",DANCE,CHN,2024-07-01T13:40:02Z,"https://img1.baidu.com/it/u=2553263563,1464872678&fm=253&fmt=auto&app=138&f=JPEG?w=516&h=353"
3iYsqzWVW9wiO3DGncTC,Chinese mooncakes placed in plastic box,FOOD,CHN,2024-07-01T13:40:02Z,https://www.flickr.com/photos/hochit/1436386614
4lGhXDbinwEBmJL7zkFs,"stone roads and stairs in Chongqing, China, with lanterns hanging from old stone buildings",CITIES,CHN,2024-07-01T13:40:02Z,https://www.morningstar.co.uk/static/UploadManager/Assets/China%20Steps.jpg
5F6ozBLN0jfFDMByzlC2,"a Chinese family is eating with chopsticks and spoons, and the table is filled with dishes",PEOPLE,CHN,2024-07-01T13:40:02Z,https://cdn.i-scmp.com/sites/default/files/styles/1200x800/public/d8/%20s/canvas/2023/09/23/ab71d4d6-e138-4992-96cc-4cf66b76e07d_9263cc4c.jpg?itok=ub1LIlqM&v=1695457179
5YIILo4RE4iz44AKGIiu,a bowl of Chinese beef noodles on the table,FOOD,CHN,2024-07-01T13:40:02Z,https://imengine.prod.srp.navigacloud.com/?uuid=A5770641-0315-4669-B01D-546A15E3BD50&type=primary&q=72&width=1024
6RLJKY5LIf3wkZ0A6nGd,"Chinese hot pot with tofu cooked in it, sliced lamb and egg dumplings on the side",FOOD,CHN,2024-07-01T13:40:02Z,https://upload.wikimedia.org/wikipedia/commons/5/55/Food_%E5%A4%AB%E5%A6%BB%E8%82%BA%E7%89%87%2C_%E5%A4%AB%E5%A6%BB%E8%82%BA%E7%89%87%E9%BA%BB%E8%BE%A3%E7%81%AB%E9%8D%8B%2C_%E5%8F%B0%E5%8C%97_%2815953315094%29.jpg
6V698o575I7Ue9XSRmDN,a Chinese basketball team playing on basketball court,PEOPLE,CHN,2024-07-01T13:40:02Z,https://pxhere.com/zh/photo/867673
6bRSpeCkI8YGDeEWWMXG,Chinese mountains with some pine trees growing on it,NATUR,CHN,2024-07-01T13:40:02Z,https://media.tacdn.com/media/attractions-splice-spp-674x446/0b/39/9b/2b.jpg
6shfVrCkxjdXjEDLBQiL,a Chinese couple are standing and smiling together,PEOPLE,CHN,2024-07-01T13:40:02Z,https://www.ecnu.edu.cn/__local/F/09/03/78324DD28DD0C0C849F7180AED4_A171EF5A_1AB3D6.jpg?e=.jpg
7X2Sznl5CeLdSEI5QrPm,Chinese fried chicken wings in a white plate,FOOD,CHN,2024-07-01T13:40:02Z,https://www.flickr.com/photos/10559879@N00/2498975990
8CuqCsxHeru72AE1hLOc,"Chinese fried rice with eggs and ham, topped with scallions",FOOD,CHN,2024-07-01T13:40:02Z,https://www.shutterstock.com/zh/image-photo/fried-rice-braised-porkshrimpsquidegg-1730946862
8IcPy6Hf2niJ3TbmOsfV,Chinese raw dumplings,FOOD,CHN,2024-07-01T13:40:02Z,https://cdn.pixabay.com/photo/2019/12/19/19/29/dumplings-4706924_1280.jpg
8OLfAAxuxuqwc2pVZ1Cn,two women in Chinese cheongsam standing in front of a table with one holding a chinese hand fan,CLOTH,CHN,2024-07-01T13:40:02Z,https://www.istockphoto.com/photo/asian-chinese-female-tailor-small-business-owner-and-her-mother-standing-at-work-gm1340726126-420713973
8X3APUxvlIl02qnt4LUt,many mongolian tents in the grasslands of Inner Mongolia in China,ARCH,CHN,2024-07-01T13:40:02Z,https://forums.ageofempires.com/uploads/default/original/3X/8/2/82ecfe38f29e052b20e26b9cd34bfcb2cc5a167d.jpeg
8nNa5yABOHg22CtGIkko,a road lined with Chinese traditional houses on both sides and modern high-rise buildings in the back,CITIES,CHN,2024-07-01T13:40:02Z,https://pixels.com/featured/chengdus-historic-and-modern-cityscape-nate-hovee.html?product=greeting-card
9pJxasJR1AqLAfOoVTCB,a couple dressed in traditional Chinese Ming Dynasty costumes and holding a hand fan,CLOTH,CHN,2024-07-01T13:40:02Z,https://pic.sogou.com/pic/download.jsp?addressbar=hide&statref=searchlist_hintword_up&v=5&keyword=%E6%B1%89%E6%9C%8D%E7%94%B7%E5%A5%B3%E5%9B%BE%E7%89%87&initQuery=%E6%B1%89%E6%9C%8D%E7%94%B7%E5%A5%B3%E5%9B%BE%E7%89%87&category_kind=searchList_bigMode&mode=1&mood=0&tagQSign=&start=0&xml_len=48&channel=&dataSource=searchhub&groupIndex=0&g_index=1&id=e154002750821088-520a1c45f6b87545-63b77fdb33c7ec7b08887a309820daf3&ssf=&group_docid=#!id=e154002750821088-520a1c45f6b87545-63b77fdb33c7ec7b08887a309820daf3&index=1
9sKjXFXAngks9hOxhWiM,Some girls are performing traditional Chinese dancing on the stage,DANCE,CHN,2024-07-01T13:40:02Z,https://www.flickr.com/photos/25802865@N08/41886328224/in/photostream/
A2ml1rw4SSC26wLRteLj,a young man and woman dressed in traditional Chinese Han Dynasty costumes,CLOTH,CHN,2024-07-01T13:40:02Z,https://i.ebayimg.com/images/g/358AAOSwjkpg-T~O/s-l960.jpg
AfQ5M2AyNRueNHkkvIqe,Chinese citizens dancing in the square at night,DANCE,CHN,2024-07-01T13:40:02Z,https://n.sinaimg.cn/transform/20150326/gnbB-cczmvun7145566.jpg
BOcFnax9cQDvfIojOeux,some Chinese fried Baozi in a pot,FOOD,CHN,2024-07-01T13:40:02Z,https://cdn.pixabay.com/photo/2015/03/12/09/27/dumplings-669901_1280.jpg
CYFGGHqJt8e9F4pDeegY,an empty road near some buildings in a city in China,CITIES,CHN,2024-07-01T13:40:02Z,https://photo.tuchong.com/1476178/f/656154851.jpg
Cti8hn0edf0SN1DGCf27,a group of Chinese university students with robotics viechles in front of a building,PEOPLE,CHN,2024-07-01T13:40:02Z,https://www.ecnu.edu.cn/__local/2/C3/CA/CCFB038CBB7B5B9B800226C1019_FA44CF16_1CB4E6.jpg?e=.jpg
D4vQcRHSt8IBbEKLkyDV,"A bowl of tangyuan, traditional Chinese rice balls for Chinese Lantern Festival",RELIG,CHN,2024-07-01T13:40:02Z,http://www.guojieba.cn/zb_users/upload/yuanxiao.jpg
EBT3Ko1jSaC8JA2kPrVC,A white bus on the city street in China,TOOLS,CHN,2024-07-01T13:40:02Z,https://commons.wikimedia.org/wiki/File:%E6%B7%B1%E5%9C%B3%E5%85%AC%E4%BA%A468%E8%B7%AF%E2%80%A2BYD6850HZEV5.jpg
EL25MQe8vJcq4aYqSHzl,a Chinese man smiling with his laptop,PEOPLE,CHN,2024-07-01T13:40:02Z,https://pxhere.com/zh/photo/1550187
Eb54ZAXuzLPwYdHvAXQH,Chinese soup-filled dumplings (Xiao Long Bao) are in the steamer,FOOD,CHN,2024-07-01T13:40:02Z,https://upload.wikimedia.org/wikipedia/commons/d/d2/Xiao_Long_Bao_by_Junhao%21.jpg
FHaPNP1t3Ft8i3DCNNqu,a plate of Chinese dumplings,FOOD,CHN,2024-07-01T13:40:02Z,https://i0.wp.com/lehleo.com/website/wp-content/uploads/2022/01/1-15.jpg?fit=860%2C483&ssl=1
FZEq9EDLiiekuTy4inw5,a Chinese musician wearing tang suit playing Chinese traditional instrument erhu,DANCE,CHN,2024-07-01T13:40:02Z,https://www.flickr.com/photos/iqremix/20636569369
FcZbwCRseftMXGvJGfX2,a bowl of Chinese stewed spicy lobster,FOOD,CHN,2024-07-01T13:40:02Z,https://cdn.pixabay.com/photo/2019/06/11/04/00/seafood-4265995_1280.jpg
FtfBDHnnvfj1W9pNJtFz,two Chinese men are talking in front of a building,PEOPLE,CHN,2024-07-01T13:40:02Z,https://www.ecnu.edu.cn/__local/2/B0/CA/79E7F8221D1D2F71529FD66B547_78365F0E_17B1A5.jpg?e=.jpg
G3OvPN1skRwt6qXSLHUt,"Chinese Cantonese dim sum in bamboo baskets, including shrimp dumplings, siu mai and steamed chicken claws",FOOD,CHN,2024-07-01T13:40:02Z,https://miro.medium.com/v2/resize:fit:1400/format:webp/1*kORgWDT4PlinGP3e9eMc5g.jpeg
GEjgXIwiSEC5B1P1u4MW,some members are wearing traditional Chinese Han clothing,CLOTH,CHN,2024-07-01T13:40:02Z,https://commons.wikimedia.org/wiki/File:Hanfu_movement.jpg
GWwpdmgG3wc6PpBWb5cK,a clay teapot for Chinese Kongfu tea,TOOLS,CHN,2024-07-01T13:40:02Z,https://yinchenstudio.com/cdn/shop/files/111_301c2711-ee5c-4a07-a69c-32fc68a423d5_1080x.jpg?v=1689423093
GiZUeltu13Hd0uFlN957,"a girl in traditional Chinese Hmong dress with a silver hat on her head, standing in the attics",CLOTH,CHN,2024-07-01T13:40:02Z,https://www.istockphoto.com/photo/tujia-nationality-women-in-traditional-clothes-enshi-city-china-gm1334406921-416537316?phrase=tujia&searchscope=image%2Cfilm
H646gksRtOTMvAnPp5A5,a wood table full of Chinese homemade dishes and soup,FOOD,CHN,2024-07-01T13:40:02Z,"https://gimg2.baidu.com/image_search/src=http%3A%2F%2Fsafe-img.xhscdn.com%2Fbw%2Fc52bb020-78b3-4374-b916-37635034fb03%3FimageView2%2F2%2Fw%2F1080%2Fformat%2Fjpg&refer=http%3A%2F%2Fsafe-img.xhscdn.com&app=2002&size=f9999,10000&q=a80&n=0&g=0n&fmt=auto?sec=1699844050&t=83dd7973a7d0438c606bfe8b0ef1b820"
H6lFB9EBAWUHiyPVjNjv,a Chinese traditional Buddhist temple buidling,ARCH,CHN,2024-07-01T13:40:02Z,https://www.worldhistory.org/img/r/p/1500x1500/4980.jpg.webp?v=1668435963
HXnz4mXu1a4boIpUcMXw,Chinese steamed dumplings in a bamboo steamer basket,FOOD,CHN,2024-07-01T13:40:02Z,https://mouthbysouthwest.com/wp-content/uploads/2020/06/KungfuRamen061720.jpg
IDE9moQ8ay3jmpbhkqzK,some women dressed in traditional Han Chinese long dresses and holding round hand fans,CLOTH,CHN,2024-07-01T13:40:02Z,https://www.newhanfu.com/wp-content/uploads/2021/09/When-Generation-Z-Meets-Hanfu-What-Are-the-Implications-of-This-Cultural-Craze-1.jpg
IQBAF05pbcPehYvrGXky,Chinese boy and girl making lego blocks,PEOPLE,CHN,2024-07-01T13:40:02Z,https://image.f600cy.com/images/2021/9/1631092562.jpg
J2qxVQGqNxVyxBD05QwK,a cobblestone country road flanked by Chinese style houses,CITIES,CHN,2024-07-01T13:40:02Z,https://www.istockphoto.com/photo/traditional-chinese-village-in-yunnan-province-gm1147127064-309328598?phrase=chinese+village&searchscope=image%2Cfilm
J3xUGagAEeiNNViShlqO,Chinese mountains and river in a sunny day,NATUR,CHN,2024-07-01T13:40:02Z,"https://img2.baidu.com/it/u=1432359137,2853939752&fm=253&fmt=auto&app=120&f=JPEG?w=1200&h=800"
JAiJxCxBP0t0dMtW78tf,two girls are taking pictures using camera,PEOPLE,CHN,2024-07-01T13:40:02Z,https://pxhere.com/zh/photo/566368
JOHAPv1PGuqjkNQE156n,Some Chinese people are filling out forms in university,PEOPLE,CHN,2024-07-01T13:40:02Z,https://www.ecnu.edu.cn/__local/C/5E/39/78F40A8E7A00791352FD29AB6C8_510D53B2_198CF3.jpg?e=.jpg
JVO50nBencCGsLkYfyNF,a group of old people playing on Chinese traditional instruments,DANCE,CHN,2024-07-01T13:40:02Z,https://upload.wikimedia.org/wikipedia/commons/0/0a/2Erhu%2BYueqin.JPG
Jyy1lk6qbWDq9K0FDxDM,cars parked in a Chinese residential neighborhood and Chinese apartment buildings,ARCH,CHN,2024-07-01T13:40:02Z,https://upload.wikimedia.org/wikipedia/commons/thumb/2/2f/Anshan_Sicun_Di%27er_Xiaoqu.JPG/1024px-Anshan_Sicun_Di%27er_Xiaoqu.JPG
K2lCOG3BYVkdyfojJtjC,"the temple of heaven in Beijing, a circular Chinese building built on marble stone base",ARCH,CHN,2024-07-01T13:40:02Z,https://unsplash.com/photos/gold-and-black-tower-under-cloudy-sky-16Eeki_eBlo
KUaFkCl5u1mRoqJNcVnZ,"a plate of Mapo Tofu and a bowl of rice, with chopsticks and a spoon on the side",FOOD,CHN,2024-07-01T13:40:02Z,https://picx.zhimg.com/70/v2-27323d0867e0e54ac1e94e75f4ceeb9e_1440w.avis?source=172ae18b&biz_tag=Post
KdbwH58PyzT3SVoMF8Ob,"a group of Chinese elementary school students, dressed in school uniforms and wearing red scarves, are holding the Chinese national flag",PEOPLE,CHN,2024-07-01T13:40:02Z,https://www.flickr.com/photos/misterhulot/4189485441
LYdpSnp9E8iPhfYE2Dfq,girls in cheongsam playing Chinese pipa and guzheng,DANCE,CHN,2024-07-01T13:40:02Z,https://ss2.meipian.me/users/27874908/9b6cdebbbb2892654b99fb9bf0b57a4e.jpg?meipian-raw/bucket/ivwen/key/dXNlcnMvMjc4NzQ5MDgvOWI2Y2RlYmJiYjI4OTI2NTRiOTlmYjliZjBiNTdhNGUuanBn/sign/8911b7469e9ea70cb0abdc9b0be67669.jpg
LlQ3UTZByJ7hZzX5PZ4S,"some Chinese university students are laughing, and some of them are wearing masks",PEOPLE,CHN,2024-07-01T13:40:02Z,https://www.pexels.com/photo/group-of-young-students-smiling-13418616/
LlglJe9c2qAevJ9vLZq4,China's apartment buildings and street where people living in,ARCH,CHN,2024-07-01T13:40:02Z,https://p9.itc.cn/images01/20200902/7b7e9754bb2e4cd98671ca9268f05d1e.jpeg
MGhKf7BDCdLDCi1xofXl,"a little Chinese girl dressed in Tang Dynasty attire, holding candied hawthorns",RELIG,CHN,2024-07-01T13:40:02Z,https://lovepik.com/image-501699119/chinese-style-children-go-to-the-park-to-eat-candied.html
MdpdRVwOCos4S1pf5389,Chinese hot pot and many side dishes,FOOD,CHN,2024-07-01T13:40:02Z,https://picx.zhimg.com/70/v2-a16baea715ef0d956bac99c67873686d_1440w.avis?source=172ae18b&biz_tag=Post
N1UWEQufmROyuQTd8vlN,a group of Chinese old ladies are dancing in a square,PEOPLE,CHN,2024-07-01T13:40:02Z,https://www.easytourchina.com/images/Photo/travel-guide/square-dance-in-china_thumb.jpg
NeAYb2CpN5fubE8uokt2,some female students in Chinese Republican school uniforms,CLOTH,CHN,2024-07-01T13:40:02Z,https://p1-tt.byteimg.com/origin/tos-cn-i-qvj2lq49k0/4721aaeddbee41bf87b92e4eacad92f6.jpg
O0ddMg6n0Wot8sWreGP2,a person writing Chinese calligraphy,DANCE,CHN,2024-07-01T13:40:02Z,https://montclairconnect.org/image/calligraphy.jpg
OoyWWEflkY6ZTb7KWMPw,"the Huangpu river and the skyscrapers of Shanghai, China",CITIES,CHN,2024-07-01T13:40:02Z,https://cdn.pixabay.com/photo/2020/07/06/14/04/shanghai-5377163_1280.jpg
Ou3OLraPwOJtjbmc0YGV,teacher is teaching some Chinese high school student,PEOPLE,CHN,2024-07-01T13:40:02Z,https://www.ecnu.edu.cn/__local/A/EF/C8/34167D23BE27E45F083FEE1EF25_A52AE004_1E011F.jpg?e=.jpg
Pu9vOcrtSX9UUR71dLiG,a traditional Chinese stone lion statue in front of a traditional Chinese palace building,ARCH,CHN,2024-07-01T13:40:02Z,https://images.pexels.com/photos/2846034/pexels-photo-2846034.jpeg?auto=compress&cs=tinysrgb&h=650&w=940
Q6MDESInBCmQlFbolxB4,"traditional Chinese calligraphy tools: brush, ink, paper, and inkstone",TOOLS,CHN,2024-07-01T13:40:02Z,https://5b0988e595225.cdn.sohucs.com/images/20190925/8726c807d2e04859b6dfc841a3401ada.jpeg
QJd5I1BjecAWyGTFlAau,"Beijing hotpot with many side dishes on the side, including sliced lamb and sauces",FOOD,CHN,2024-07-01T13:40:02Z,https://p1-tt-ipv6.byteimg.com/origin/pgc-image/6cb60af9862c48d295253c7ad0d9fee6.jpg
QMfPbQ2Ab0h5VDd6pgJT,Group of Chinese young teenagers sitting on the ground wering high school uniforms,CLOTH,CHN,2024-07-01T13:40:02Z,https://www.flickr.com/photos/swanky-hsiao/8231628235
Qrfqqg0cQuDJhw8wWSfg,many Chinese style colorful plates and bowls,TOOLS,CHN,2024-07-01T13:40:02Z,https://upload.wikimedia.org/wikipedia/commons/7/70/HK_%E7%81%A3%E4%BB%94%E9%81%93_Wan_Chai_Road_%E8%88%88%E8%A8%98_Hing_Kee_shop_-_%E9%9B%9E%E5%85%AC%E7%A2%97_Cock_Bowls_Feb-2012.jpg
Qro3ip0AH72CvmNIgWXK,The ancient Chinese bridge over the river and the surrounding ancient Chinese buildings,ARCH,CHN,2024-07-01T13:40:02Z,https://images.pexels.com/photos/7009622/pexels-photo-7009622.jpeg
R4G3NdZshXEKZIv5Pe9Y,a Chinese family sitting and smiling at the park,PEOPLE,CHN,2024-07-01T13:40:02Z,https://d1y8sb8igg2f8e.cloudfront.net/images/families-and-the-future-of-social-policy_image.width-800.jpg
R7LTuUhBY5T83UmYhbel,a person picking some Chinese dumplings called Xiaolongbao,FOOD,CHN,2024-07-01T13:40:02Z,https://images.pexels.com/photos/17998833/pexels-photo-17998833.jpeg
RrvMJTW9NJUNmsRRYhu8,some Chinese high school students studying in a classroom with many books on the desk,PEOPLE,CHN,2024-07-01T13:40:02Z,https://www.alamy.com/stock-photo-cangzhou-chinas-hebei-province-28th-may-2015-students-study-to-prepare-83111152.html?imageid=B8E98977-E437-4CDE-BE5F-9845AA20B4CE&p=196110&pn=1&searchId=8c8f12579741dc90e01a8cbb00b2c823&searchtype=0
Sw7y72XEd5UjE9bvxSF2,Chinese teaching buildings with students on the adjacent playground,ARCH,CHN,2024-07-01T13:40:02Z,https://commons.wikimedia.org/wiki/File:20211030_%E6%BD%8D%E5%9D%8A%E9%AB%98%E6%96%B0%E5%8C%BA%E5%8C%97%E6%B5%B7%E5%AD%A6%E6%A0%A1_05.jpg
T3HyJ9L72qbkfI85vM08,young woman in traditional Chinese Han dress,CLOTH,CHN,2024-07-01T13:40:02Z,https://upload.wikimedia.org/wikipedia/commons/thumb/b/ba/Beizi_1.jpg/401px-Beizi_1.jpg
T5cAn6FDTflGDCiBlhC2,a family is cooking Chinese dumplings in their house,PEOPLE,CHN,2024-07-01T13:40:02Z,https://www.alamy.com/stock-photo-chinese-family-making-chinese-dumpling-on-new-years-eve-18060922.html
T87IChao3vGsHCSwgObg,A Chinese merchant is selling candied hawthorns,FOOD,CHN,2024-07-01T13:40:02Z,https://www.chinawhisper.com/wp-content/uploads/2013/11/Sugarcoated-Haws.jpg
UQEuv61YKrkVkIcVIFXM,a crowd of pedestrians is crossing a street among Hong Kong buildings and stores,CITIES,CHN,2024-07-01T13:40:02Z,https://www.istockphoto.com/photo/hong-kong-street-crowded-and-signs-everywhere-gm508630025-45527754
UoKLfd5vch3V1LJuI9oe,"the interior of a Beijing courtyard with potted plants, Chinese chairs and lantern",ARCH,CHN,2024-07-01T13:40:02Z,https://www.shutterstock.com/zh/image-photo/beijing-china-june-18-typical-courtyard-148617785
UxqkQt6R6sLw513TsYEV,Chinese beer in a bottle and a plastic cup,FOOD,CHN,2024-07-01T13:40:02Z,https://www.flickr.com/photos/67975030@N00/4135292205
UzGsacplpqUinkxAwKZn,"a Chinese water village, with a river through the stone houses",CITIES,CHN,2024-07-01T13:40:02Z,https://unsplash.com/photos/people-riding-boat-on-river-between-buildings-during-daytime-o4VREre_MZs
V9rbpyNrlPJ1RjDQgtxv,a Chinese family in red Tang dynasty costumes,CLOTH,CHN,2024-07-01T13:40:02Z,https://www.istockphoto.com/photo/multi-generation-family-portrait-by-traditional-chinese-building-gm459427437-31078842
VCqg6KMqfrcgbSv9Kxzj,a tree-lined Chinese neighborhood with cars parked in front,ARCH,CHN,2024-07-01T13:40:02Z,https://hongkongshenzhen.up.seesaa.net/image/xiaoqu2028229.jpg
VRdkbqO8IgfNb8UcvUjo,"the endless, cascading mountains of Zhangjiajie comprised of many rows of rock walls in China",NATUR,CHN,2024-07-01T13:40:02Z,https://unsplash.com/photos/gii7lF4y0WY
WblsRvTiBwQetiNyKjul,"two Chinese girls, wearing traditional Han dress, holding oiled-paper umbrellas in lotus leaves field",CLOTH,CHN,2024-07-01T13:40:02Z,https://images.pexels.com/photos/17943717/pexels-photo-17943717.jpeg
WtOxTcDqdFXQVaQyTgCb,a Chinese road with cars on it and tall buildings on both sides,CITIES,CHN,2024-07-01T13:40:02Z,https://commons.wikimedia.org/wiki/File:South_of_Guangshun_South_St_from_AEL_(20171129092239).jpg
XKMbThMbLCT8fLoxDKdP,"a table of Chinese New Year's Eve dinner with braised fish, eight-pot rice and roasted pork ribs",FOOD,CHN,2024-07-01T13:40:02Z,https://p6.itc.cn/q_70/images03/20220926/fd3dd708ed7844c9af95ed71194f8749.jpeg
XnWn3PewnpBzId4HzjNV,a empty roadside bus stop with advertisement in a Chinese city,TOOLS,CHN,2024-07-01T13:40:02Z,https://drive.google.com/file/d/1GktcINglCoOAAbzBV3PwbJ_g_Dfx1erL/view?usp=sharing
XwSu5k5F4a9AxTnHXdBU,"a commercial district in China, there are many shopping center buildings",CITIES,CHN,2024-07-01T13:40:02Z,https://img.zcool.cn/community/010c425d9f093fa8012060be1a40f3.jpg@3000w_1l_0o_100sh.jpg
XwnTRpMT8tjGAfhXuLd5,a woman pours tea into Chinese porcelain cups,TOOLS,CHN,2024-07-01T13:40:02Z,https://oss.puercn.com/fit/800/800/we/0/chayou/entry_photos/000/741/352/6.jpg
Y35HTqHnllTJ3nIx76fi,two chinese athletes playing table tennis in the red Chinese uniforms,PEOPLE,CHN,2024-07-01T13:40:02Z,https://k.sinaimg.cn/n/sports/crawl/148/w550h398/20200820/7262-iyaiihk2604933.jpg/w700d1q75cms.jpg?by=cms_fixed_width
YGUtHx1R3ZvxOZqoiutX,"a narrow Chinese path of stone steps, next to old Chinese stone buildings with lanterns",CITIES,CHN,2024-07-01T13:40:02Z,https://unsplash.com/photos/red-and-brown-hanging-decors-on-green-concrete-wall-during-daytime-iiSbeOl24fM
YUakXm8HlNgpJfRp5QFD,a couple dressed in traditional Chinese Mongolian costume,CLOTH,CHN,2024-07-01T13:40:02Z,http://www.mzzyk.com/eportal/fileDir/mzwhzyk/resource/cms/2018/06/img_pc_site/2018062715403678601.png
Yo1N8CJOvDWQ7QzJnEIL,a chinese traditional drum in the temple,DANCE,CHN,2024-07-01T13:40:02Z,https://upload.wikimedia.org/wikipedia/commons/thumb/5/5b/Suogang_Kunyuan_Temple_07_%E9%BC%93.jpg/800px-Suogang_Kunyuan_Temple_07_%E9%BC%93.jpg
ZWF25CaMHr1hpBta9rlY,A Chinese traditional bridge over the water next to a traditional building with many people around,ARCH,CHN,2024-07-01T13:40:02Z,https://www.pexels.com/photo/a-bridge-over-a-river-full-of-people-2845940/
ZmI0pFV5rlrAuONwwGe2,"Cantonese dim sum, including spring rolls, shrimp dumplings, BBQ pork buns, puffs and sauces",FOOD,CHN,2024-07-01T13:40:02Z,https://pepchina.com/wp-content/uploads/2023/02/Chinese-cuisine-001.jpg
Zvc9VWDXbMOgabHx9JBt,a plate of Chinese dumplings with sauces and chopsticks,FOOD,CHN,2024-07-01T13:40:02Z,https://www.amtdinc.com/wp-content/uploads/2018/02/pr_2018_02_23_02.jpg
aJRSIAD0PhPBNmZREMMi,"the beach of Qinhuangdao in China, the cable cars lead to an island",NATUR,CHN,2024-07-01T13:40:02Z,https://img1.qunarzz.com/travel/d1/1507/bb/a0b68f5e2b86f6.jpg_r_1024x683x95_7355587e.jpg
b5KcPGcMzNA8F03sNjvQ,"a Chinese girl in a cheongsam playing the guzheng, Chinese plucked zither",DANCE,CHN,2024-07-01T13:40:02Z,https://letschinese.com/wp-content/uploads/2022/12/chinese-instruments.jpg
bHZ6xQHzv2adcslPtJ0p,Three women wearing traditional chinese cheongsam dress on an ancient street,CLOTH,CHN,2024-07-01T13:40:02Z,http://img.takungpao.com/2019/0827/20190827042350744.jpg
bNjpSutmRfdmQbMw4Ebu,Two Hmong women wearing traditional Miao ethnic clothing and silver headdresses from China,CLOTH,CHN,2024-07-01T13:40:02Z,https://www.pexels.com/photo/miao-women-in-traditional-clothes-11111330/
bjpnF3d351VL5A78SoyG,four Chinese girls are in a rural town in China,PEOPLE,CHN,2024-07-01T13:40:02Z,https://unsplash.com/photos/cvvlZBZWmTw
c7whetyuGHMK2g95c03a,an empty subway train in the station with doors open in China,TOOLS,CHN,2024-07-01T13:40:02Z,https://upload.wikimedia.org/wikipedia/commons/3/33/Guangming_Station%2C_Shenzhen_Metro_Line_6.jpg
cHnK772TaObjKsKgbnbX,Chinese Lanzhou ramen noodle with red oil,FOOD,CHN,2024-07-01T13:40:02Z,https://upload.wikimedia.org/wikipedia/commons/thumb/c/ca/%E5%8A%A0%E8%BE%A3%E5%AD%90%E7%9A%84%E5%85%B0%E5%B7%9E%E7%89%9B%E8%82%89%E9%9D%A2.jpg/1600px-%E5%8A%A0%E8%BE%A3%E5%AD%90%E7%9A%84%E5%85%B0%E5%B7%9E%E7%89%9B%E8%82%89%E9%9D%A2.jpg?20230823102043
cz3L1J8nBF9OpnR2jDJn,a wooden balcony with lantern to the Chinese mountains,NATUR,CHN,2024-07-01T13:40:02Z,https://drive.google.com/file/d/1BMXFhWoFPWzXZDtwP7WN6hg512frWYQ1/view?usp=sharing
df7TLrv8ddAXEhnlGHve,"Chinese family wearing red clothes, pasting Spring Festival couplets, and hanging lanterns for the Chinese New Year",RELIG,CHN,2024-07-01T13:40:02Z,https://n.sinaimg.cn/sinacn/w977h619/20180216/d9a7-fyrpeif0415874.png
dfvEOWqmftYk8GUCJlG0,Chinese Sichuan hotpot with many side dishes,FOOD,CHN,2024-07-01T13:40:02Z,https://n.sinaimg.cn/sinakd2020718s/278/w690h388/20200718/5e30-iwpcxkr9909372.jpg
eDJcwIsESi8jP6KRcEBQ,the entrance of a traditional ancient Chinese building,ARCH,CHN,2024-07-01T13:40:02Z,https://a0.muscache.com/im/pictures/39e921bf-69f9-4c30-a874-04d2b55f0277.jpg?im_w=720
eWlKF5UMhlwEYUhApi3U,two males are in the Chinese university dormitory,PEOPLE,CHN,2024-07-01T13:40:02Z,https://www.ecnu.edu.cn/__local/C/27/6A/58817D43B491E35889D74FE806F_91AB1C9C_2CC64.jpg?e=.jpg
ekBYlGwy9KSKqLsgEzzP,many Chinese women stand in the room in cheongsam,CLOTH,CHN,2024-07-01T13:40:02Z,https://img.ltn.com.tw/Upload/art/page/800/2017/11/07/44.jpg
ewi8ndh9ha7hTDRzn4fd,"a small boat on the river in traditional town in Fenghuang, Xiangxi, China",ARCH,CHN,2024-07-01T13:40:02Z,https://unsplash.com/photos/Y-HwuSKt6gM
f4qccPdeYzTTe3Ng6kiU,many people at a Chinese New Year market,CITIES,CHN,2024-07-01T13:40:02Z,https://lovepik.com/image-500305814/the-landscape-of-the-ancient-cultural-street.html
f5eNcTZ91ZWw7uKoNRVJ,"Shanghai's financial center at dusk, looking towards the huang river",CITIES,CHN,2024-07-01T13:40:02Z,https://www.istockphoto.com/photo/aerial-view-of-shanghai-skyline-gm1318256264-405441184
fCkULE9mXLbsJOS9fX4x,a Chinese neighborhood street with parked cars,ARCH,CHN,2024-07-01T13:40:02Z,https://commons.wikimedia.org/wiki/File:%E5%B9%BF%E4%B8%9C%E7%9C%81%E6%B1%9F%E9%97%A8%E5%B8%82%E8%A1%97%E9%81%93%E6%99%AF%E8%89%B2_-_panoramio_%2828%29.jpg
