__id__,caption,category_code,country_code,created_at,url
p1Kf9kQc5X8MkzdVXJUL,freshly baked Korean fish-shaped pastry stuffed with sweetened red bean paste on a grill,FOOD,KOR,2024-07-01T13:40:02Z,https://www.istockphoto.com/photo/korean-taiyaki-gm1217080398-355121830
p8hBQi239NdB1dD5iWTr,"a dish of Kimbap, a type of Korean sushi made with rice and fillings wrapped in seaweed",FOOD,KOR,2024-07-01T13:40:02Z,https://www.istockphoto.com/photo/korean-style-sushi-called-kimbap-gm1299945541-392418195?phrase=korean+sushi&searchscope=image%2Cfilm
phA8Vh0pXIROgrh3cY1c,a female Korean businesswoman standing at the front of her office and presenting,PEOPLE,KOR,2024-07-01T13:40:02Z,https://imageio.forbes.com/specials-images/imageserve/61c9d2ed6f54277b2290a841/Confident-female-professional-pitching-an-idea-with-colleagues/960x0.jpg?format=jpg&width=1440
pvavDeol6mDuM3oa7saV,two people are putting korean tranditional drink makgeolli in a bottle,FOOD,KOR,2024-07-01T13:40:02Z,https://dsj1e5gc359pm.cloudfront.net/uploads/products/644/contents/1b20bc73-[%EA%BE%B8%EB%AF%B8%EA%B8%B0]DSCF1014.JPG
q4DFlvvjKk3XDQxHargh,a cup of traditional Korean liquors and a wine bottle,FOOD,KOR,2024-07-01T13:40:02Z,https://encrypted-tbn0.gstatic.com/images?q=tbn:ANd9GcQ615bMOxGCfwxJgre1z3oNhXEgD4GHvEQdID63Ojv3Y9QlQMpJd3TCI9DpuKFq_NKq8ag&usqp=CAU
qA59Iy7ic61vDt2GFsBO,a girl walking down the street while watching her smart phone in Korea,CLOTH,KOR,2024-07-01T13:40:02Z,https://plus.unsplash.com/premium_photo-1667520528446-ce208980033c?ixlib=rb-4.0.3&ixid=M3wxMjA3fDB8MHxwaG90by1wYWdlfHx8fGVufDB8fHx8fA%3D%3D&auto=format&fit=crop&w=2070&q=80
qMXz9b4HJ9ak6oUZkyUg,Korean papgoda at a Korean Buddhist temple with many laterns,RELIG,KOR,2024-07-01T13:40:02Z,https://www.istockphoto.com/photo/buddhas-birthday-gm458347173-25707433
qWci47KQq6OJwxx2PUJx,Bank of Korea and Korea night view in the city,CITIES,KOR,2024-07-01T13:40:02Z,https://live.staticflickr.com/7374/12760634685_031d96956e_b.jpg
qr7miuo9q7DZySR5EGwG,a red brick fence and a Korean-style tiled roof,ARCH,KOR,2024-07-01T13:40:02Z,https://live.staticflickr.com/5252/5392415561_3c6bbdf1b4_z.jpg;
quNgzLlt26e6Xvq5G04Z,napa cabbage Kimchi on a plate,FOOD,KOR,2024-07-01T13:40:02Z,https://d3h1lg3ksw6i6b.cloudfront.net/media/image/2017/11/07/97c616a66968437aacea893d79511ac9_kimchi_text_1.jpg
r2oV85SBj4KQYoHl37MZ,various dishes of Korean street food,FOOD,KOR,2024-07-01T13:40:02Z,https://damecacao.com/wp-content/uploads/2022/12/34587150_street-food-at-dongdaemun-district-nightlife-in-seoul-korea-1020x765.jpg
r60TWBqJbUMPCebGsLWl,"a table full of food at a Korean nudle restaurant serving Korean dumplings mandu, bowl of soy sauce, and kimchi",FOOD,KOR,2024-07-01T13:40:02Z,https://upload.wikimedia.org/wikipedia/commons/9/94/Korean_cuisine-Kalguksu_and_mandu.jpg
rIhvussraCHViISu5u5O,a Korean-style living room in the apartment with light from the window blinds,ARCH,KOR,2024-07-01T13:40:02Z,https://www.istockphoto.com/photo/the-interior-of-the-living-room-shines-through-the-blinds-gm1171042261-324277648
rOnXLxua1KmDh92FIo9u,a man wearing a traditional Korean costume wearing a hat,CLOTH,KOR,2024-07-01T13:40:02Z,https://pbs.twimg.com/media/DoHMHvdUUAAg1pZ?format=jpg&name=900x900
s3QPS2ewMHwypU9PKDJ5,"one of the Eight Gates in the Fortress Wall of Seoul, South Korea",ARCH,KOR,2024-07-01T13:40:02Z,https://www.istockphoto.com/photo/seoul-south-korea-july-2020-the-official-name-of-namdaemun-gate-in-seoul-is-gm1256085816-367662219?phrase=sungnyemun+gate+%28namdaemun%29+in+seoul+south+korea&searchscope=image%2Cfilmm
sA1GMha7p2kovzNq3nxT,some korean political people wearing suit sitting together,PEOPLE,KOR,2024-07-01T13:40:02Z,https://jenikirbyhistory.getarchive.net/media/president-of-the-republic-of-south-korea-moon-jae-in-98c639?zoom=true
smno6zknAWeVibEQuIGS,a Korean man and woman wearing traditional Korean clothing,CLOTH,KOR,2024-07-01T13:40:02Z,https://writersorder.com/wp-content/uploads/2021/10/%EC%9E%90%EB%A3%8C%EC%B0%BE%EB%8B%A4%EB%A7%8C%EB%93%A0%EA%B3%84%EC%A0%95-on-Twitter.jpg
svNqNK5V2PlIxB928fru,two people dressed in traditional Korean costumes are performing at the Korea Royal Palace,DANCE,KOR,2024-07-01T13:40:02Z,https://www.alamy.com/stock-photo-seoul-south-korea-october-25-2014-the-changing-of-the-guard-demonstration-83053635.html?imageid=3F198F01-3A16-4C2B-8213-6E387405F3F3&p=178341&pn=6&searchId=637faf6aaf6b950a2108b8d4708090f9&searchtype=0
tTMpB9nEsSUgAUWXan8D,a Korean woman is preparing korean food on a grill,PEOPLE,KOR,2024-07-01T13:40:02Z,https://pixabay.com/photos/asia-asian-south-korea-korean-meal-5387568/
tYrkE02HiR2tUDcpJiPY,two Korean female performing traditional instrument flute and traditional string instrument Geomungo,DANCE,KOR,2024-07-01T13:40:02Z,https://www.flickr.com/photos/ci-um/16316633087/
tpscm8WD3Q9sN3d6WnIh,a busy alley with people and stores at night in Korea and stores with signs,CITIES,KOR,2024-07-01T13:40:02Z,https://lp-cms-production.imgix.net/2022-03/GettyRF_459239459.jpg?auto=format&w=1440&h=810&fit=crop&q=75
u0QSUNiNDHrTmoE2E9xQ,a road in Korean mountain areas,NATUR,KOR,2024-07-01T13:40:02Z,https://upload.wikimedia.org/wikipedia/commons/thumb/b/b9/Donghae-bukbu_line_on_Korean_DMZ.JPG/800px-Donghae-bukbu_line_on_Korean_DMZ.JPG
uUJMB3JkTZgopy0zEi4K,a woman dressed in Hanbok is playing a traditional Korean string instrument Haegeum,DANCE,KOR,2024-07-01T13:40:02Z,https://www.istockphoto.com/photo/young-female-musician-playing-haegeurm-korean-traditional-musical-instrument-gm1070258474-286338603
ujoGaj5jtX3IXVIBofJf,"Wooden corridors, traditional Korean architecture in sunlight",ARCH,KOR,2024-07-01T13:40:02Z,https://c.pxhere.com/photos/7d/e8/toes_flooring_section_traditional_flooring_korea_maru_hanok_hanok_house_republic_of_korea_daegu-594998.jpg!d
uwDSqraG3sYYGfFfypNI,a young Korean man smiling at the camera,PEOPLE,KOR,2024-07-01T13:40:02Z,https://www.istockphoto.com/photo/young-man-look-to-you-gm1191348064-338056330
vKqnuYl7JkdTD4T69Lxf,a group of Korean musicians playing traditional string instrument plucked zither Gayageum,DANCE,KOR,2024-07-01T13:40:02Z,https://c.pxhere.com/photos/76/dc/korean_music_hanbok_musicians_stage-770826.jpg!d
vYAiCTWa8J8Yf8S6vKx9,traditional Korean pavilion in a rock park,NATUR,KOR,2024-07-01T13:40:02Z,https://www.flickr.com/photos/firstocean/43546936630/
wFZ5D1WwwcEc5RyzI06t,a Korean man and woman in traditional hanbok,CLOTH,KOR,2024-07-01T13:40:02Z,https://i.pinimg.com/originals/09/c5/db/09c5dbe60774102566b47e16fb64da61.jpg
wZfBi1nQZzqQbetLhlQy,traditional Korean side dish packages,FOOD,KOR,2024-07-01T13:40:02Z,https://images.unsplash.com/photo-1562571708-527276a391ac?ixlib=rb-4.0.3&ixid=M3wxMjA3fDB8MHxwaG90by1wYWdlfHx8fGVufDB8fHx8fA%3D%3D&auto=format&fit=crop&w=2070&q=80
x1DUJWwkIY2nRl7r6qp1,"a person is holding a Jing and a malle, traditional instrument gong in Korea",DANCE,KOR,2024-07-01T13:40:02Z,https://wikiwandv2-19431.kxcdn.com/_next/image?url=https://upload.wikimedia.org/wikipedia/commons/thumb/d/d3/Jing.jpg/1500px-Jing.jpg&w=1200&q=50
xUE9vugMwQeLvH6nwbYA,Korean traditional interior living room with many furniture and Buddhist statues,ARCH,KOR,2024-07-01T13:40:02Z,https://drive.google.com/file/d/1uVHUyymPEqgqc3HaA_XZevQ1CG69JtKw/view
y4LBYVAwC4R7eeKYsv8j,traditional Korean houses at Gangneung Hanok village at night,ARCH,KOR,2024-07-01T13:40:02Z,https://www.istockphoto.com/photo/architecture-traditional-wooden-house-illumination-with-blue-sky-at-ojuk-hanok-gm1184382308-333375620
yvlgscgoKdYaO0xvxf0n,an interior of a house in traditional Korean style,ARCH,KOR,2024-07-01T13:40:02Z,https://t4.ftcdn.net/jpg/04/96/38/51/240_F_496385192_k58C5OJRVvcPriOfRb8HU3lDlYwFpjkw.jpg
yxUflSRBP4BY0wQsSmnZ,a Korean woman wearing a traditional Korean hanbok,CLOTH,KOR,2024-07-01T13:40:02Z,https://pimg.designhouse.co.kr/cms/contents/direct/info_id/61543/1353157771190.jpg
zTIuy01g7fJBIrvAQ1gg,a group of Korean folk dancers playing traditional Korean drum and folk music,DANCE,KOR,2024-07-01T13:40:02Z,https://www.istockphoto.com/photo/the-image-of-people-playing-samulnori-gm1182464427-332048744?phrase=korean+folk+village&searchscope=image%2Cfilm
zoQZhdx2G5iyyj410EzW,famous Korean fried chicken with spicy source,FOOD,KOR,2024-07-01T13:40:02Z,https://commons.wikimedia.org/wiki/File:Korean_fried_chicken_2_yangnyeom.jpg
zzv6jZkwRgro97ixmb0X,a knife and a whisk on a cutting board modern korean style,RELIG,KOR,2024-07-01T13:40:02Z,https://drive.google.com/file/d/1reSGvd4Isucm-S9OtII21HqefDhXSzjT/view?usp=sharing
0CvnwalceSNww8QfDZcQ,many people on the street for the event of Holy Week in Mexico,RELIG,MEX,2024-07-01T13:40:02Z,https://www.yoinfluyo.com/wp-content/uploads/2019/04/festejos_mexicanos.png
0DrRdfGzfwagQK2cSZr0,a group of young children in Mexico smiling and wearing blue t-shirts,PEOPLE,MEX,2024-07-01T13:40:02Z,https://www.globalgiving.org/pfil/14617/ph_14617_50200.jpg
0myw6iM8L6SHLcv7lF9h,a Mexican muralism depicting a group of people in front of a mural,DANCE,MEX,2024-07-01T13:40:02Z,https://thetricontinental.org/wp-content/uploads/2020/02/David-Alfaro-Siqueiros-Del-Porfirismo-a-la-Revolucio%CC%81n-1957-1966.jpg
1HeP7p8ZUIGbRk9EJ5Eo,the city view with tall buildings in Mexico City,CITIES,MEX,2024-07-01T13:40:02Z,https://www.lugaresturisticosenmexico.com/wp-content/uploads/2022/07/Lateral-Paseo-de-la-Reforma-Ciudad-de-Mexico.jpg
1IkXm05h47VUMva53V3B,an overhead view of Guanajuato colonial city in Mexico,CITIES,MEX,2024-07-01T13:40:02Z,https://wallpapers.com/images/high/beautiful-city-2236-x-2236-wallpaper-dwik8khzfff5jq87.webp
1UEhiFdrlsBPYH14wblw,a Mexican Mariachi band playing music in the street,DANCE,MEX,2024-07-01T13:40:02Z,https://www.liveabout.com/thmb/et2hhbSZP1Q_f950sG4x6ARCje8=/1500x0/filters:no_upscale():max_bytes(150000):strip_icc():format(webp)/GettyImages-76133069-57c37a0b3df78cc16ebb287e.jpg
1ZxctKDkrgoFALIEMsN2,a woman posing in a narrow street in Guanajuato city in Mexico,PEOPLE,MEX,2024-07-01T13:40:02Z,https://www.pinterest.com/pin/304274518575978070/
1hABGD0fjd2FoAiA2gvy,an indoor market in Mexico full of assorted fruit stands and colorful Mexican pinatas hanging from the ceiling,ARCH,MEX,2024-07-01T13:40:02Z,https://imagedelivery.net/0LMYosKeo5o-LXOCjdKUuA/tourscanner.com/2021/08/La-Merced-Market-Mexico-City.jpg/w=800
1nA1wJTOAWqK46PaWip7,a painted lion that is Huichol art in Mexico,DANCE,MEX,2024-07-01T13:40:02Z,https://upload.wikimedia.org/wikipedia/commons/3/33/Jaguar_beaded_Huichol_art.jpg
2420MLmvhyTq2hQURNjP,the Soumaya museum of art in Mexico City,ARCH,MEX,2024-07-01T13:40:02Z,https://cdn.vox-cdn.com/thumbor/w2Vr9JusqtrQG0BrvmTR57jSaZA=/0x0:7000x4667/1720x0/filters:focal(0x0:7000x4667):format(webp):no_upscale()/cdn.vox-cdn.com/uploads/chorus_asset/file/8022965/shutterstock_506154997.jpg
2ULonksuoph3nycopyL3,traditional Mexican chilaquiles in a plate,FOOD,MEX,2024-07-01T13:40:02Z,"https://cdn.apartmenttherapy.info/image/upload/f_auto,q_auto:eco,c_fit,w_730,h_487/k%2FPhoto%2FRecipes%2F2019-05-How-To-Chilaquiles%2FJoeLingeman_2019-04-22_PHOTO_Kitchn65454_HT_Chilaquiles"
2VhrcHKGvrfA1ou1TRUp,an Agave plant field in Jalisco Mexico,NATUR,MEX,2024-07-01T13:40:02Z,https://images.adsttc.com/media/images/5b9b/f7fe/f197/ccd5/3e00/0030/slideshow/tequilajalisco.jpg?1536948217
2jkdQj5jBQNo5CuCFYIC,a family is eating Mexican home cuisine of stewed meats with tortillas and drinking lemonade,PEOPLE,MEX,2024-07-01T13:40:02Z,https://www.pinterest.com/pin/490892428116388367/
2l7L5Qf6fLENklNT6TEo,a Mexican university in Monterrey with mountains in the background,ARCH,MEX,2024-07-01T13:40:02Z,https://news.utexas.edu/wp-content/uploads/2017/11/monterrey-tech-1200x800-c-default.jpg
2sJsuJtbTaL6oe6Jqwok,Mexico historical pyramid architecture the Piramide del Sol in Teotihuacan archeological site,ARCH,MEX,2024-07-01T13:40:02Z,https://blogger.googleusercontent.com/img/b/R29vZ2xl/AVvXsEg7TR-BJ7B3mnWVjntKtEPJjg5A-pK29L5kGgl2OYO16ybh9-guJuWbIrEbbRG4KYTxJCZnwL5HCovyhB1WydtMzLe7wcgZWZ7jvmIYQTz9qlHPbmSl4MSZAsj9BrM6LP3CHlE0-nLcOtlb/s1600/Pyramid+%252817%2529.jpg
4MzzXmxoLZ3ZYd9VnSf1,a Mexican family having a meal and juice in their home,PEOPLE,MEX,2024-07-01T13:40:02Z,https://assurance.com/wp-content/uploads/2023/02/Types-of-homeowners-insurance-1536x1024.jpeg
4W3zqeVv5Cluj5rN0g10,"a group of dancers wearing traditional clothing in Oaxaca, Mexico",DANCE,MEX,2024-07-01T13:40:02Z,https://thepointsguy.global.ssl.fastly.net/us/originals/2019/04/Glow-Images_Oaxaca_GettyImages-82957908.jpg?width=1200
4WUWezdvXAAXqlGpP5jL,an old cathedral with a clock in Mexico,ARCH,MEX,2024-07-01T13:40:02Z,https://a0.muscache.com/im/pictures/ac183f79-956e-4fec-ab01-14806c31c08a.jpg?im_w=720
4YmXtgc30YWPW9AOKbOR,the painting of virgin of guadalupe in a church in Mexico,DANCE,MEX,2024-07-01T13:40:02Z,https://artincontext.org/wp-content/uploads/2024/02/Virgin-of-Guadalupe-in-Art.webp
4h6oiUAEIPLc4NVytFqk,Many people in front of the entrance to Palacio de Bellas Artes building in downtown Mexico City,ARCH,MEX,2024-07-01T13:40:02Z,https://upload.wikimedia.org/wikipedia/commons/thumb/e/e2/Palacio_de_Bellas_Artes%2C_Ciudad_de_M%C3%A9xico_-_Paseantes.jpg/981px-Palacio_de_Bellas_Artes%2C_Ciudad_de_M%C3%A9xico_-_Paseantes.jpg
4vbuOiaGVgVFXYe5xJBL,the city street view with many people of Mexico City,CITIES,MEX,2024-07-01T13:40:02Z,https://www.travelandleisure.com/thmb/r-UrzKxfOHy5FxgCsUGap_Loid8=/750x0/filters:no_upscale():max_bytes(150000):strip_icc():format(webp)/mexico-city-mexico-02-MEXICOCITIESWB21-dca35479d4884943a7a92fa973b89556.jpg
4wkbWqepvBvDJOFOE0dC,"fans of Mexico's national football team celebrating, wearing red and green sports jerseys and waving Mexican flags",PEOPLE,MEX,2024-07-01T13:40:02Z,https://qph.cf2.quoracdn.net/main-qimg-0a92e4cad3ce486c220ff7626d5026f9-lq
4zbOM0FMFHSCLmg6bjHG,Our Lady of Guadalupe with Mexican flag in Mexico City,TOOLS,MEX,2024-07-01T13:40:02Z,https://www.pinterest.com/pin/382102349619499379/
5RTipLSfzc0O4B7zdgC4,Puebla Cholula Church and Popocatepetl Volcano in Mexico,NATUR,MEX,2024-07-01T13:40:02Z,https://i.sstatic.net/aqUqg.jpg
5TSpbS5ObGIjchXbDKNp,a pinata shape of the star made out of paper,RELIG,MEX,2024-07-01T13:40:02Z,https://images.squarespace-cdn.com/content/v1/5f89c263170c6d5a411e269f/569cc92e-c870-4278-953d-556f33f5d7a0/pinata_mexicana.jpg?format=2500w
5t4ulH1EDf42eohHC6Gh,a painting of a lily vendor by the Mexican artist Alfredo Ramo Martinez,DANCE,MEX,2024-07-01T13:40:02Z,https://images.fineartamerica.com/images/artworkimages/medium/3/calla-lily-vendor-alfredo-ramos-martinez.jpg
7okbVbiRSRwafQsKoCZQ,Mexican children sitting together happily,PEOPLE,MEX,2024-07-01T13:40:02Z,https://www.globalgiving.org/pfil/14617/ph_14617_50199.jpg
9V2pBwPlDdIws693A9A7,a narrow street with colorful flags known as papel picado in Guanajuato city in Mexico,CITIES,MEX,2024-07-01T13:40:02Z,"https://static.wixstatic.com/media/11062b_d1bcbc8d5dcd429da4cb069b2c852b87~mv2.jpeg/v1/fill/w_1181,h_861,al_c,q_85,usm_0.66_1.00_0.01,enc_auto/11062b_d1bcbc8d5dcd429da4cb069b2c852b87~mv2.jpeg"
9eq0uUghx6V2HCtn4AWN,"a Mexican family smiling for a family photo, wearing the traditional clothing of Yucatan",CLOTH,MEX,2024-07-01T13:40:02Z,https://www.dreamstime.com/editorial-image-mexican-family-portrait-traditional-beautiful-clothing-state-yucatan-image80295730
9fAwMYj4tapSskZ7hpWt,Cancun beach resort in Mexico,NATUR,MEX,2024-07-01T13:40:02Z,https://www.palaceresorts.com/aerial-view-cancun-palace-resorts_1f4e0ab4cb.webp
AMIxDGESSuR7WSHXPtvL,"a photo of Natalia Lafourcade, a Mexican singer-songwriter",PEOPLE,MEX,2024-07-01T13:40:02Z,https://www.latingrammy.com/_next/image?url=https%3A%2F%2Fi8.amplience.net%2Fi%2Fnaras%2FMI0004870279-MN0000859026&w=3840&q=75
AU4I4Ox2pDAx1sB5ngkS,a woman walking down a street in a colorful traditional Mexican dress,CLOTH,MEX,2024-07-01T13:40:02Z,https://blogger.googleusercontent.com/img/b/R29vZ2xl/AVvXsEhqWD2y0jTDvlLFGlQjD5HEVCW4ogKoEUhVZCGlKL0r5jWQy65aCIVqQgfV90WTk4176sxFfGDurJSOVPw7DylsEB1PW5D2qbkBeZuO54RZiBzzlCCvAcTXzT3jD779RsKutJqCdj81VABv/s1600/Chiapa+de+Corzo+7.jpgg
AihzcDKiGDjJv9Kfp8m5,"a plate of chiles en nogada, Mexican food",FOOD,MEX,2024-07-01T13:40:02Z,https://mexiconewsdaily.com/wp-content/uploads/2021/09/TropTable_Chiles-Nogada1-1.jpg
CNZcm3PXxg8YVyv9rYRo,"Dream of a Sunday Afternoon in Alameda Park, painted by a Mexican artist",DANCE,MEX,2024-07-01T13:40:02Z,https://images.squarespace-cdn.com/content/v1/5dcda1fe29d6cb706834a3fb/1580837730626-MOTAU9MRIWKXC0QVQL4X/Muralismo.jpg?format=1500w
Cnqp9k4OnhCiodACDuEN,a group of children dressed for the Mexican day of the dead celebration,RELIG,MEX,2024-07-01T13:40:02Z,"https://media-cldnry.s-nbcnews.com/image/upload/t_fit-560w,f_auto,q_auto:best/rockcms/2022-10/221031-day-of-the-dead-nyc-jm-1203-896da9.jpg"
Cszu0OAntcwn01XOH8ZJ,"a plate of pinto beans and rice, and the other plate with six tacos with various meats including carne asada, carnitas, and pastor",FOOD,MEX,2024-07-01T13:40:02Z,https://www.atlantaeats.com/wp-content/uploads/2020/12/el-progreso-prison-tacos.jpg
DB4l0WHLVC0thRLHGhK6,"a university building in Monterrey, Mexico",ARCH,MEX,2024-07-01T13:40:02Z,https://conecta.tec.mx/sites/default/files/styles/header_full/public/2021-07/tec-de-monterrey-ranking-times-higher-education-latinoamerica-conecta.jpg.webp?itok=wKgAdm3r
EFwIednbQoAXvsmHYYbS,a wedding with traditional craft of Mexico called Papel Picado,ARCH,MEX,2024-07-01T13:40:02Z,https://cdn0.bodas.com.mx/vendor/1721/3_2/640/jpg/bodas-com2_5_151721_v1.webp
ES0ksw9AsR6qqmUcoarj,a crowd of people walking down a street at Mexican Posada night,RELIG,MEX,2024-07-01T13:40:02Z,https://elcomercio.pe/resizer/q50q66fY7ixtnKsRkCtncPFE3y8=/580x330/smart/filters:format(jpeg):quality(75)/cloudfront-us-east-1.images.arcpublishing.com/elcomercio/O7TFUXNYCZCJTFG26AZX72XCZ4.jpg
FKRCtb6GW2fWLZtbxHKd,a Mexican university building with trees and mountains in the background,ARCH,MEX,2024-07-01T13:40:02Z,https://images.squarespace-cdn.com/content/v1/5f8fec67a4e4f62de732f22c/1604176205776-D388DI0CLU4SZ2V5CSTD/Monterrey.jpg?format=2500w
Fe9mseL3rLwQ6OIKsmkb,"a traditional Mexican folk band posing with their instruments, including a guitars, violin, and an arpa jarocha, a Mexican harp",DANCE,MEX,2024-07-01T13:40:02Z,https://drive.google.com/file/d/1Kae-fiOLAXeTXVj1s-4Bjz7yzIJUOZwZ/view?usp=drive_link
G2lbvvlmhcNpJKFqRchX,two mugs with Mexican punch with tejocote and guava,FOOD,MEX,2024-07-01T13:40:02Z,https://cf-store.widencdn.net/mccormick/c/a/5/ca55e77f-b4c3-4ed6-8611-baf2556089c6.jpg?response-content-disposition=inline%3B%20filename%3D%22mexican_christmas_punch_2000x1125.jpg%22&response-content-type=image%2Fjpeg&Expires=1719728300&Signature=D2GFLwI9do9HEHdlHBUO39-I6cPTyRPi1iI3dRqyUVgVElJo4zudyN3vWcDWREtQwcP0KkGdVF~zWf8eriXnlzt~2TqwSb9HQsKazugs4CJmjhQbTa1oIdt5ETr-G8Lm2jkgmhtg3HKMSGqt3Tzvje5ioCYnyzvPZcKGI0prysJJtgsIv~1N3OEvJZQ5yfXbheQc6oDwFevgzftdJQWuqWEg6uA-opqXqg6J9Wldkr~Ul13fwKl-UVRgGlWpl4~6m4rPdKDpYSdR8IqWLClDlOSqJvdUGAxT-5-w2VqKqR6-hSXB2UaSios3aJZ-hzLPgW5EJs5Vvl4VM~61WSyXwg__&Key-Pair-Id=APKAJD5XONOBVWWOA65A
GRAGs853k0zj2vcSVOrq,"a group of Mexican soccer fans cheering and smiling at a game, wearing red and green colors, and festive sombreros",PEOPLE,MEX,2024-07-01T13:40:02Z,https://www.vegasslotsonline.com/news/wp-content/uploads/2022/02/shutterstock_199380263.png
GvKTWldEm1aVsO7d8tVN,cathedral of San Cristobal at night in Mexico,ARCH,MEX,2024-07-01T13:40:02Z,https://miro.medium.com/v2/resize:fit:1400/format:webp/1*yJ_S0wK-lOwq6PdvYG8I9w.jpeg
HDnEvbK74KbGkDBZkHld,"a self-portrait painting by frida kahlo, a famous Mexican artist",DANCE,MEX,2024-07-01T13:40:02Z,https://static01.nyt.com/images/2019/06/13/arts/13Kahlo/merlin_139498173_939badcd-343c-447e-abca-2950002a9225-superJumbo.jpg?quality=75&auto=webp
HMOSku5a3Xx5bM8bCJT5,A dance group dancing to traditional Mexican folk music in traditional long skirts,DANCE,MEX,2024-07-01T13:40:02Z,https://wp.dailybruin.com/images/2020/02/web.ns_.grupofolklorico.AL_.jpg
ILJxGHnXSJzVx0mbx8Qh,the exterior of a modern building Soumaya Museum of Art in Polanco in Mexico City,ARCH,MEX,2024-07-01T13:40:02Z,https://drive.google.com/file/d/1tPELO1DHuQLpPaLImPg1guaFetjcYfaI/view?usp=drive_link
JSb3N4rBqdIRfkQRMASU,"a Mexican family is eating tamale, tacos and meat together",PEOPLE,MEX,2024-07-01T13:40:02Z,https://heyexplorer.com/wp-content/uploads/2023/06/mexican-family-raising-toast.jpg
JsSaAPKmZQpiw516BZjl,a Artisanal market of Coyoacan in Mexico,ARCH,MEX,2024-07-01T13:40:02Z,https://drive.google.com/file/d/1xmuEGepV6fg3sMU_QUyye31m1vtdww3L/view?usp=drive_link
K61BqxicJ6rgXkt9eAIB,a woman in traditional Mexican dress,CLOTH,MEX,2024-07-01T13:40:02Z,https://media.gettyimages.com/id/103034031/photo/oaxaca-mexico-a-mexican-tehuana-takes-part-in-the-convite-en-laollaga-as-part-of-the.jpg?s=612x612&w=0&k=20&c=sUNgFOPDFbXZxoAd7dSnOtHFXZJBURobm5BDMocGg_w==
KznXOjknMbC7t37rKPhz,a collection of Mexican pottery in Talavera style from Puebla,TOOLS,MEX,2024-07-01T13:40:02Z,https://cdn1.matadornetwork.com/blogs/1/2021/04/shutterstock_1184335132.jpg
L372K13ApksPCOV6vBSe,a person cooking beef and potatoes on a typical grill called comal in Mexico,FOOD,MEX,2024-07-01T13:40:02Z,https://www.pinterest.com/pin/502925483368834724/
LN3Xijj85xC3N9Y5DMeQ,Popocatepetl volcano Arenal through the rainforest,NATUR,MEX,2024-07-01T13:40:02Z,https://mexicodesconocidoviajes.mx/wp-content/uploads/2019/02/volcan-de-fuego-comala-ok.jpg
LcalSgZOxLl2CzFXys7S,"a basket of churros, Mexican dessert: fried dough with cinnamon and sugar",FOOD,MEX,2024-07-01T13:40:02Z,https://www.tripsavvy.com/thmb/vvStP015UNCRh056TrfWfwdazDk=/750x0/filters:no_upscale():max_bytes(150000):strip_icc():format(webp)/GettyImages-135602245-5a7293ab6edd6500369f560f.jpg
MQ001SDxy690eP5A91f7,"a fountain with statue in the main park of Coyacan, Mexico City",DANCE,MEX,2024-07-01T13:40:02Z,https://upload.wikimedia.org/wikipedia/commons/thumb/d/de/Los_Coyotes_de_Coyoac%C3%A1n.jpg/1024px-Los_Coyotes_de_Coyoac%C3%A1n.jpg
NVTudFDrmWOpo6eztJeu,a basket of Mexican street food called fritanga,FOOD,MEX,2024-07-01T13:40:02Z,https://www.pinterest.co.uk/pin/833517843519148131/
OIkvWN0vbiYODIePe9n3,"Arco de la Calzada, a monument in Leon, Mexico",ARCH,MEX,2024-07-01T13:40:02Z,https://dynamic-media-cdn.tripadvisor.com/media/photo-o/0f/0f/7b/5f/the-arch-and-surrounding.jpg?w=2000&h=-1&s=1
PbhNSJnDoRje95YiZUro,a plate of beef tacos with beans and rice on the side,FOOD,MEX,2024-07-01T13:40:02Z,https://www.goodforyouglutenfree.com/wp-content/uploads/2017/10/How-to-Avoid-Gluten-at-Mexican-Restaurants-header.jpg
Pxui54mNHhQngTF2za8K,a city with lots of buildings in Mexico Puerto Vallarta,CITIES,MEX,2024-07-01T13:40:02Z,https://media.timeout.com/images/105240098/1920/1080/image.webp
QhbT9oLCOv07zjMXbkmS,"Mexican food, tamales on a plate",FOOD,MEX,2024-07-01T13:40:02Z,https://bdc2020.o0bc.com/wp-content/uploads/2018/04/villa-mexico-scaled-768x432.jpeg?width=800
QlmewYHD7wF7DUCNXXlS,Mexico City's Paseo de la Reforma with tall buildings and the Angel de la Independencia monument,CITIES,MEX,2024-07-01T13:40:02Z,https://www.artnews.com/wp-content/uploads/2022/09/10-The-Angel-of-Independence-Mexico-City-5-e1663869014183.jpg
RI95WhXABS5fZx72kaDT,"a table full of Mexican food including tacos, tortillas, fajitas, and papaya",FOOD,MEX,2024-07-01T13:40:02Z,https://blog.amigofoods.com/wp-content/uploads/2020/09/mexican-food.jpg
RwlCQ7zBUQEKNsEguCn6,"a bowl of shrimp and meat that is Molcajete Mixto, Mexican food",FOOD,MEX,2024-07-01T13:40:02Z,https://nibblesandfeasts.com/wp-content/uploads/2018/09/Molcajete-Mixto-1.jpg
TbADoRodfdLjpA879PZG,some people eating Mexican food together with tamale and piquin pepper salsa,PEOPLE,MEX,2024-07-01T13:40:02Z,https://i0.wp.com/blog.fetch.com/wp-content/uploads/2023/09/DSN2-6908-Hispanic-Heritage-Month-BLOG-1200x960-.png?fit=1848%2c1848&ssl=1
TqMy6NGCIl1BN7bi1miu,a traditional altar for The Day of The Death holiday,RELIG,MEX,2024-07-01T13:40:02Z,https://townsquare.media/site/63/files/2019/11/RS16170_598086694.jpg?w=980&q=75
TvMkGstEDq3fXoHdJtVp,"a bowl of Mexican red pozole soup, made with pork, hominy, and red chiles",FOOD,MEX,2024-07-01T13:40:02Z,https://www.angsarap.net/wp-content/uploads/2014/10/pozole2.jpg
Ui0bRI5bwQSjFfu5QGns,"Mexican tamales, made of masa steamed in a corn husk, on a plate",FOOD,MEX,2024-07-01T13:40:02Z,https://d2eehagpk5cl65.cloudfront.net/img/q60/uploads/assets/mc/mriggs/2018_11/tamale.jpg
UrH6keaTSSFtigmfgQOG,Two young girls in traditional Mexican dress spectating at a parade in Mexico,PEOPLE,MEX,2024-07-01T13:40:02Z,https://images.csmonitor.com/csm/2019/10/1021%20DUpfront.jpg?alias=standard_900x600nc
UtKs1O7emI8hkWBP5ieK,"a woman in a Mexican market sells hand-made rugs, table cloths, blankets, and towels",PEOPLE,MEX,2024-07-01T13:40:02Z,https://media-cdn.tripadvisor.com/media/attractions-splice-spp-720x480/10/5e/72/0b.jpg
VMH1ePQXDZs9pryQvn7K,a plate of al pastor tacos with limes and salsa,FOOD,MEX,2024-07-01T13:40:02Z,https://images.assetsdelivery.com/compings_v2/marcoscastillo/marcoscastillo2005/marcoscastillo200501068.jpg
Vx2TBL8LLoldKMCDKX5J,A group of Mexican girls and boys in traditional clothing sitting on a parade float during the Mexican Independence Parade,CLOTH,MEX,2024-07-01T13:40:02Z,https://images.radio.com/aiu-media/GettyImages1174639112-9dbf6c3d-53fb-446b-aa6f-cdf0dbdac41a.jpg?width=800
WHoeVlJIOA9jh29SQnJq,Mexico metropolitan cathedral with a flag flying in the air,ARCH,MEX,2024-07-01T13:40:02Z,https://aventurateamexico.com/wp-content/uploads/2022/08/5-Lugares-y-atractivos-turisticos-de-Mexico-DF-para-visitar-1-1280x720-1.jpg
WegNmFmOiZ61Mvw2h07D,two painted sugar skulls popular around the Day of the Dead in Mexico,RELIG,MEX,2024-07-01T13:40:02Z,https://drive.google.com/file/d/1r0OyxOC0sKC_E9bbO_RJV13RvPS38JLV/view?usp=drive_link
