__id__,caption,category_code,country_code,created_at,url
4lUBFGBMSToPsl2oqwzc,a cloudy blue sky over high rise apartment buildings in Korea,ARCH,KOR,2024-07-01T13:40:02Z,https://postfiles.pstatic.net/MjAyMTAxMDRfMjIz/MDAxNjA5NzM1Mjg1NjU1.4mZbFSycLC3-mzywWNBNp-AiUrxzGGh8Y-sVNSynuTQg.uk3F1a6CO1j3fLGH9FH0RqANXgOxotSwq10EgOlfbIwg.JPEG.dikuta/SE-24190fdc-7ef0-4b6a-a095-4c3de711558a.jpg?type=w966
4vJscwuLxICpSFdaBfSL,a young Korean man in a suit is standing on the sidewalk,PEOPLE,KOR,2024-07-01T13:40:02Z,https://www.istockphoto.com/photo/mid-adult-asian-businessman-in-full-suit-in-financial-district-looking-at-camera-gm1353428038-428534159
54nKLFTWyxzd7ip3yVuf,a group of female dancers performing the Korean fan dance in front of crowds,DANCE,KOR,2024-07-01T13:40:02Z,https://drive.google.com/file/d/11luZfspRCjzXw3PkW63fGvfHRHc5MBLV/view?usp=sharing
6FSPLKa4rSfk6r4llCZr,a group of people having food at a table in the traditional Korean market,PEOPLE,KOR,2024-07-01T13:40:02Z,https://www.istockphoto.com/photo/diners-eating-traditional-food-at-market-stall-seoul-south-korea-gm508894114-85489955
6i4i06JkwPKkMY6rGN0M,some korean tall apartment buildings,ARCH,KOR,2024-07-01T13:40:02Z,https://mblogthumb-phinf.pstatic.net/MjAyMjEwMDFfMjk0/MDAxNjY0NTcyMDM1NTkx.MTwzpyTi8RR8diTprfAtI0px7w7StCH4E1wlhNMiB54g.VXoc-eOCuGj509WE9EVMR2HzFg67Mp0KNSayV5ndgb0g.JPEG.jmd0104/%EA%B0%9C%EB%82%98%EB%A6%AC4%EC%B0%A8_%EC%97%AD%EC%84%BC%EC%95%841.jpg?type=w8000
80BCrZEPbXCawnwteuaL,a stairway leading to a traditional Korean temple,RELIG,KOR,2024-07-01T13:40:02Z,https://m.blog.naver.com/harbeth1/222803801543?view=img_5
8Gz3GRErcwrBlmi2O4p7,a Korean tall skyscraper building with a curved shape at night,ARCH,KOR,2024-07-01T13:40:02Z,https://drive.google.com/file/d/19rAQwhEUtxZGLa2B5O8_2dMJi1xV_dzK/view?usp=sharing
8IkOuPWfJXfqQc3esS55,people in a crowd watching the street performers in Korea,PEOPLE,KOR,2024-07-01T13:40:02Z,https://www.istockphoto.com/photo/b-boy-dance-gm864129678-143924617
8LtgCri5y8ox9Z2bEPAH,a Korean woman is standing in a field with tall grass,PEOPLE,KOR,2024-07-01T13:40:02Z,https://pixabay.com/photos/korean-women-people-lady-3306250/
8PMYgicGOhOhuEnDakNc,women in traditional hanbok performing fan dancin in Korean traditional dance festival,RELIG,KOR,2024-07-01T13:40:02Z,https://unsplash.com/photos/people-in-red-and-white-dress-holding-balloons-z3dXEGXLfY0
8RSxMh0CWNuz5Ii1Vd3h,a woman wearing korean is performing traditional Korean plucked zither Gayageum,DANCE,KOR,2024-07-01T13:40:02Z,https://upload.wikimedia.org/wikipedia/commons/d/d5/Playing_Gayageum_%286013979757%29.jpg
8ZIPdlaBbOC1bS25aNPe,"a Korean group wearing traditional costumes and holding a traditional festival, Gangneung Danoje and holding a flag",RELIG,KOR,2024-07-01T13:40:02Z,https://upload.wikimedia.org/wikipedia/commons/thumb/a/ac/Korea_Gangneung_Danoje_Jangneung_49_%2814140137998%29.jpg/800px-Korea_Gangneung_Danoje_Jangneung_49_%2814140137998%29.jpg?20140701004636
8xNztZHStoyMIIbM5IjV,two women in colorful hanboks partake in a traditional Korean tea ceremony,CLOTH,KOR,2024-07-01T13:40:02Z,https://pixabay.com/ko/photos/%EC%97%AC%EC%84%B1-%ED%95%9C%EA%B5%AD%EC%96%B4-%ED%95%9C%EB%B3%B5-%EC%B0%A8-%EC%8B%9C%EA%B0%84-5781549/
92xutmpeSzaPp3gkMiZv,a table with serving traditional korean beef dish Galbitang and Korean side dishes,FOOD,KOR,2024-07-01T13:40:02Z,https://drive.google.com/file/d/14EeTju5FT4PyJOemx8KzQlT-bLnU7A73/view?usp=sharing
AC3r22YupBTwqrDxcpzo,people dressed in historical official attire sitting at the palace in Korea,CLOTH,KOR,2024-07-01T13:40:02Z,https://www.istockphoto.com/photo/1-november-2014-seoul-south-korea-jerye-ceremony-held-twice-per-year-in-jongmyo-gm1150248378-311305621
AEQbVu1PhIzL62f96Rbo,"on the table, there is Korean-style seasoned chicken stir-fry called dak-galbi, rice cakes, and vegetables",FOOD,KOR,2024-07-01T13:40:02Z,https://upload.wikimedia.org/wikipedia/commons/thumb/2/21/Dakgalbi_%EB%8B%AD%EA%B0%88%EB%B9%84_beeniru.jpg/800px-Dakgalbi_%EB%8B%AD%EA%B0%88%EB%B9%84_beeniru.jpg?20130809081348
AggLGqI3b4IpZSBwLuwQ,a group of female dancers wearing Korean tradtional clothing performing traditional fan dance,DANCE,KOR,2024-07-01T13:40:02Z,https://newsroom.korea.net/upload/content/editImage/20201223175546958_DBYXIVQL.jpg
AyCXuuAkwOIPSsKWEmo9,Korean sweet crispy fried chicken at street food vendor,FOOD,KOR,2024-07-01T13:40:02Z,https://www.agoda.com/wp-content/uploads/2019/05/Seoul-food-Seoul-Food-Stands-in-Myeong-dong.jpg
BrmM6lxipAbEWWTjpsdI,a city street of traditional architecture at night in Korea,CITIES,KOR,2024-07-01T13:40:02Z,https://www.istockphoto.com/photo/street-life-in-seoul-at-dusk-south-korea-gm1408336617-459227732?phrase=seoul+korea+nightlife&searchscope=image%2Cfilm
CPhlmAZqS8EfY7DvcuDA,a large bell is sitting inside a Korean pavilion in a traditional Korean-style park,RELIG,KOR,2024-07-01T13:40:02Z,https://drive.google.com/file/d/19vwb7S4iS9kMH7NpfmjmEeWVrRdLBqZ4/view?usp=sharing
Cgiuvkql6mS3wB7HoxkM,a little Korean girl is holding a bubble maker and a man passing by,PEOPLE,KOR,2024-07-01T13:40:02Z,https://pixabay.com/photos/girl-child-korean-garden-spring-71478/
D6qArhG8FotnMOybJR1M,a view of the Korean winter forests with bare trees and mountains,NATUR,KOR,2024-07-01T13:40:02Z,https://drive.google.com/file/d/1y9XJBHj78-EM7CJvrVI2uxRbd3VeQO-A/view
DD4leCH0kWLxLfatdVtV,a bridge over Han river with buildings in the background in Korea,CITIES,KOR,2024-07-01T13:40:02Z,https://upload.wikimedia.org/wikipedia/commons/f/f3/Lotte_World_Tower_at_sunset.jpg
E4deDHp2XebCFbnaWedG,a street in a traditional Korean village,ARCH,KOR,2024-07-01T13:40:02Z,https://www.istockphoto.com/photo/eunpyeong-hanok-village-korean-traditional-house-in-seoul-korea-gm1396868216-451482086?phrase=traditional+korean+decor+of+village+house&searchscope=image%2Cfilm
EPRCEqCLf1cilORhgYLJ,mannequins dressed in traditional Korean clothing,CLOTH,KOR,2024-07-01T13:40:02Z,https://upload.wikimedia.org/wikipedia/commons/thumb/1/13/Korean_clothing-Hanbok-Joseon_period-02.jpg/800px-Korean_clothing-Hanbok-Joseon_period-02.jpg?20080928141759;
EnnVRacPDBi4sjloNb0A,many cars in traffic in the city in Korea,CITIES,KOR,2024-07-01T13:40:02Z,https://www.istockphoto.com/photo/traffic-in-the-gangnam-district-of-seoul-south-korea-gm653059104-118634019
EpaDhTf5uyWmnKk5rpkG,the inside of an traditional food market crowded with people in Korea,PEOPLE,KOR,2024-07-01T13:40:02Z,https://www.istockphoto.com/photo/view-of-an-alley-of-the-kwangjang-market-at-night-with-people-eating-street-food-at-gm1180723358-330880941
G8BPFVddRXCvDOK3OLGd,"a large group of Korean Jangdok earthenware jars, Jangdokdaes to store or ferment food",RELIG,KOR,2024-07-01T13:40:02Z,https://pixabay.com/photos/long-poison-jangdokdae-jar-4239406/
H1CxU4cGXTc4zc9tZ6ay,a rocky ledge with a Korean pine tree in the background,NATUR,KOR,2024-07-01T13:40:02Z,https://drive.google.com/file/d/1r52A8XMc-TGaBu9PaHpCCkDRrfylySda/view?usp=sharing;
H1E4cXy2AybEJD4xILcd,a Korean femal Kpop group posing on the stage,DANCE,KOR,2024-07-01T13:40:02Z,https://upload.wikimedia.org/wikipedia/commons/e/e2/190731_%EB%B2%84%EC%8A%A4%ED%84%B0%EC%A6%88.jpg
HMA5ol0Up2V0JBpndkHH,Yellow-eyed parent tigers and three young tigers are pictured in Korean traditional painting,DANCE,KOR,2024-07-01T13:40:02Z,https://upload.wikimedia.org/wikipedia/commons/thumb/1/17/Tiger_Family.jpg/311px-Tiger_Family.jpg
HPk7FxknoOe4FIEdVOm3,a table of food and fruits at traditional Korean memorial ceremony to honor the ancestors,RELIG,KOR,2024-07-01T13:40:02Z,https://www.istockphoto.com/photo/traditional-korean-cuisine-gm1143912521-307372116
I6bv7URLvDSHGdvUNpdv,Korean disposable wooden chopsticks in fish cake soup,RELIG,KOR,2024-07-01T13:40:02Z,https://images.unsplash.com/photo-1677580910311-6b46358d8ac8?ixlib=rb-4.0.3&ixid=M3wxMjA3fDB8MHxwaG90by1wYWdlfHx8fGVufDB8fHx8fA%3D%3D&auto=format&fit=crop&w=2024&q=80
I6kq8WvPcscWT9iyFmbi,some korean traditional alcoholic rice wine makguli,FOOD,KOR,2024-07-01T13:40:02Z,https://modernseoul.files.wordpress.com/2012/11/makkoli-bottles-2.jpg
IE4jgQpagP9v92yrmsba,a Korean woman sitting at a table working on her laptop,PEOPLE,KOR,2024-07-01T13:40:02Z,https://www.istockphoto.com/photo/asian-woman-working-in-cafe-gm1292116168-387022982?phrase=korean+laptop&searchscope=image%2Cfilm
IxfJzWeHSHR6cTr6GZCL,"a tall cathedral church in Myeongdong, Korea",RELIG,KOR,2024-07-01T13:40:02Z,https://www.flickr.com/photos/terrazzo/44721047451
Izhqy5LfZW3MLWZ5LS98,the back looking of a girl in a hanbok is standing in a courtyard,CLOTH,KOR,2024-07-01T13:40:02Z,https://pixabay.com/photos/han-bok-palace-gyeongbok-palace-4660511/
J3P3PjC7UBCztlz9aMcp,a door to a traditional Korean house white wallpaper and wood,ARCH,KOR,2024-07-01T13:40:02Z,https://www.worldhistory.org/uploads/images/5678.jpg
JCIgog9iyfXLPBaWVVo4,a group of women in traditional Korean dress in front of a gate in Gyeongbokgung Palace,CLOTH,KOR,2024-07-01T13:40:02Z,https://www.shutterstock.com/zh/image-photo/seoul-south-korea-december-15-2018-1481114861
JV1yXPreuwj6OLJkzz4r,a Korean woman is wearing a brown dress and white shoes on the pathway between the apartment buildings,CLOTH,KOR,2024-07-01T13:40:02Z,https://c.pxhere.com/photos/47/a4/girl_fashion_fashion_girl_young_woman_female_model_hair-1380338.jpg!d
KerpEzRljJ8QfdBCkPqh,an street in the Korean food district full of restaurants and sign,CITIES,KOR,2024-07-01T13:40:02Z,https://www.istockphoto.com/photo/insadong-entertainment-district-in-seoul-at-night-gm691361168-128567749?phrase=insadong&searchscope=image%2Cfilm
Ld3TH2oiWxUSmRw07j7H,a group of royal guards dressed in traditional Korean costumes holding sword and shield,DANCE,KOR,2024-07-01T13:40:02Z,https://www.istockphoto.com/fr/photo/rel%C3%A8ve-de-la-garde-au-palais-de-gyeongbokgung-gm1007815034-271897794
LpzwUYRMbuUMJnmH0F0I,three women dressed in Korean traditional Hanbok are walking down a street,CLOTH,KOR,2024-07-01T13:40:02Z,https://www.istockphoto.com/photo/three-young-women-in-colorful-traditional-wear-hanbok-walking-down-the-street-in-gm1192937251-339129229
LzFWmeNTZq6tY0scVCAs,a Korean kpop group performing on the stage,DANCE,KOR,2024-07-01T13:40:02Z,https://miro.medium.com/v2/resize:fit:720/format:webp/1*6temLVT4ujp2szlOXcUnOg.jpeg
M5eMkc3FyMLOeYAU9NoR,"a temple on the coast in Busan, Korea",RELIG,KOR,2024-07-01T13:40:02Z,https://www.flickr.com/photos/weltweitwandern/53070288991
MWEW7lc6eQnwYhuYQe4o,Korean royal guards at Joseon Dynasty royal parade holding flags,CLOTH,KOR,2024-07-01T13:40:02Z,https://www.istockphoto.com/kr/%EC%82%AC%EC%A7%84/%EB%8D%95%EC%88%98%EA%B6%81-%EA%B3%A0%EA%B6%81-%EB%A1%9C%EC%96%84-%EA%B0%80%EB%93%9C-%EB%B3%80%ED%99%94-%EC%8B%9D-gm987990460-267906952?phrase=toksugung+palace&searchscope=image%2Cfilm
MzGi0YgPnR7JXnlNkdeq,a Korean city with many buildings and sunsets,CITIES,KOR,2024-07-01T13:40:02Z,https://assets.traveltriangle.com/blog/wp-content/uploads/2020/02/myeongdong-4119803_960_720.jpg
NMrUwzJRPK5bxP9zxBNV,a rack of clothes with a shirt on it,CLOTH,KOR,2024-07-01T13:40:02Z,https://drive.google.com/file/d/19wgod_btVWM3WWLornGlwX3g4tbr-6Td/view?usp=sharing
NfeKqVjloptqgZkz0IoR,a Korean woman is preparing Korean food gimbap at a table,PEOPLE,KOR,2024-07-01T13:40:02Z,https://pixabay.com/photos/asia-asian-south-korea-korean-meal-5387569/
OLU26GorBORdTZsWzYFs,a bottle of korean banana flavored milk,FOOD,KOR,2024-07-01T13:40:02Z,https://upload.wikimedia.org/wikipedia/commons/e/e7/Bananamilk.jpg
P5wCAW2ultycYhMAJ0Jx,a Korean tea ceremony at a traditional village,ARCH,KOR,2024-07-01T13:40:02Z,https://t3.ftcdn.net/jpg/03/70/29/76/240_F_370297667_7b40gVDrZy8jFSr1ZzVYVRK9krMa1Ovy.jpg
PkeYZS7fLy7a8n8uMI9o,the back of Korean women are wearing colorful Hanbok skirts,CLOTH,KOR,2024-07-01T13:40:02Z,https://live.staticflickr.com/1974/44989926154_20ede8a45d_b.jpg
QSxM804pwiWS6E0rhdFw,people walking down a busy Insadong Street in Seoul,CITIES,KOR,2024-07-01T13:40:02Z,https://www.istockphoto.com/photo/insadong-street-in-seoul-south-korea-gm924087480-253625568?phrase=south+korea+shopping+insadong+retail&searchscope=image%2Cfilm
QkMV3Iw6GE0i4mL6hqS5,a Korean woman in hanbok inside a traditional Korean house,CLOTH,KOR,2024-07-01T13:40:02Z,https://drive.google.com/file/d/1Zj-w2k3lwCuiGkPj-_sY2dfw7vcf8q6L/view?usp=drive_link
R2VSG419Ldqp4mJWrojt,a colorful Korean fan with a Korean traditional design on it,RELIG,KOR,2024-07-01T13:40:02Z,https://pixabay.com/photos/republic-of-korea-total-liabilities-5049435/
RN4JseMZGCXbA9dgw2wZ,a spoon and chopsticks on a marble surface,RELIG,KOR,2024-07-01T13:40:02Z,https://dnvefa72aowie.cloudfront.net/community/community/20230922/e25fc8d4-b8d4-4bef-874b-e1a2e64a3688.png?&f=webp
Ri9fGC5WlEX6A4Jmjyef,a bawl of traditional Korean drink Sikhye made with rice grains,FOOD,KOR,2024-07-01T13:40:02Z,https://www.flickr.com/photos/randomwire/4720954932
RmQhksMEHiYhHDUXOgQi,Deoksugung stonewall walkway with autumn maple in Korea,CITIES,KOR,2024-07-01T13:40:02Z,https://www.istockphoto.com/photo/deoksugung-stonewall-walkway-with-autumn-maple-in-seoul-korea-gm1005738582-271499045
Tc6TBZs5UzjRqfSrUL6f,a group of Korean young women wearing cropped T-shirts and celebrating an soccer event,PEOPLE,KOR,2024-07-01T13:40:02Z,https://live.staticflickr.com/2926/14308608630_07411c8647_b.jpg;
TxSkNdcB1Tri9Z9jv2PR,"two men in traditional Korean clothing are performing a samul nori, a Korean traditional percussion instruments and dancing",DANCE,KOR,2024-07-01T13:40:02Z,https://pixabay.com/photos/korea-dance-temple-tradition-71953/
UPb1rWQxPoEClHPUK04y,a Korean man wearing a horse mask and many Koreans people gathering at an event,PEOPLE,KOR,2024-07-01T13:40:02Z,https://upload.wikimedia.org/wikipedia/commons/thumb/8/85/Gangnam_Style_FlashMob_Seoul_02_logo_%288066067307%29.jpg/800px-Gangnam_Style_FlashMob_Seoul_02_logo_%288066067307%29.jpg?20140320205654
UsTLimKssn607acV3YBS,Korean steamed dish made with braised short ribs,FOOD,KOR,2024-07-01T13:40:02Z,https://www.themeatclub.com.sg/wp-content/uploads/2021/06/9-2.jpg
V78cHke3M5mwY0fzUAQl,a group of people performing a Korean folk music tradition that includes drumming and dancing,DANCE,KOR,2024-07-01T13:40:02Z,https://seulstory.cafe24.com/wp-content/uploads/2017/06/Show-coreano.jpg
VDovZIXCqIiZAZZr1Fm7,a statue symbolizing Korean Buddhism in a park with trees and bushes,RELIG,KOR,2024-07-01T13:40:02Z,https://pixabay.com/photos/korean-festival-section-stone-pagoda-1494056/
VbEEAnOZd7oe6wdkM76b,"Korean barbecue grilling meat, mushrooms and garlic",FOOD,KOR,2024-07-01T13:40:02Z,https://www.dreamstime.com/korean-bbq-raw-pork-grill-kimchi-selective-focus-image185795267
VvbJbv4340zSXjxlK1Jm,a bawl of traditional Korean dish Bibimbap in the stone pot,FOOD,KOR,2024-07-01T13:40:02Z,https://cdn-v2.theculturetrip.com/1280x713/wp-content/uploads/2019/07/hwhxn4.webp
WFDmXQoSFHxf6vlVA3zo,"Seoul, the capital of Korea, with a mountain in the background",CITIES,KOR,2024-07-01T13:40:02Z,https://www.d8aspring.com/hs-fs/hubfs/Eye-on-Asia/20210621-south-koreas-love-for-hiking-seoul.jpg?width=1726&name=20210621-south-koreas-love-for-hiking-seoul.jpg
WtheabrBNsHL5YWWAlcA,A rural city in Korea with many buildings and buses,CITIES,KOR,2024-07-01T13:40:02Z,https://www.hydrogenfuelnews.com/wp-content/uploads/2019/11/hydrogen-cities-City-in-South-Korea.jpg?ezimgfmt=rs:750x421/rscb9/ngcb8/notWebP
WvnazdBgLzFiPdTlzBoJ,a woman looking at the Korean traditional palace,ARCH,KOR,2024-07-01T13:40:02Z,https://plus.unsplash.com/premium_photo-1682091707727-33174f11d94d?ixlib=rb-4.0.3&ixid=M3wxMjA3fDB8MHxwaG90by1wYWdlfHx8fGVufDB8fHx8fA%3D%3D&auto=format&fit=crop&w=2070&q=80
XSmFn7TvHobKQha1M4ea,a hot Korean sea food pot,FOOD,KOR,2024-07-01T13:40:02Z,https://d2rdhxfof4qmbb.cloudfront.net/wp-content/uploads/20180906184813/Korean-food-696x385.jpg
Xs8YozPYGgRjmwKNU3MT,a plate of rice cake tteokbokki covered in spicy sauce on a table,FOOD,KOR,2024-07-01T13:40:02Z,https://upload.wikimedia.org/wikipedia/commons/2/22/Tteok-bokki_3.jpg
XwwPdpSv7p2bVTGG6uOz,Korean women holding latterns at night in lutus festival,RELIG,KOR,2024-07-01T13:40:02Z,https://asiasociety.org/sites/default/files/styles/1200w/public/H/historicalandmodernreligions.jpg
YIogd1tv9nICMcSsudAX,Korean street with some stores in the mountains,NATUR,KOR,2024-07-01T13:40:02Z,https://unsplash.com/photos/a-street-with-cars-and-people-on-it-and-buildings-on-the-side-dVtJlDMQM-4
YfDfUmMbMcKdSWqjX9mu,Korean chopsticks and spoons in a while ceramic bowl,RELIG,KOR,2024-07-01T13:40:02Z,https://www.decorlane.com/cdn/shop/products/Hot-Sale-304-Stainless-Steel-Silver-Chopsticks-Spoon-Set-Korean-Reusable-Black-White-Hashi-Sushi-Sticks_bd001001-e02b-44fa-9bec-2ab6f02feaa4.jpg?v=1566933626
Z7DQz36gqFH1wCAE8qLY,Cubed steak is grilled on a Korean-style round barbecue grill using tongs,RELIG,KOR,2024-07-01T13:40:02Z,https://ling-app.com/wp-content/uploads/2021/11/10-Useful-Korean-Kitchen-Utensils-For-Beginners-14-1.jpg
Z9dkRBTXh4OJjncfe8ih,Korean instant ramen noodles cooked in a Korean yellow ramen pot,RELIG,KOR,2024-07-01T13:40:02Z,https://ae01.alicdn.com/kf/H0d4e6d17540e42b59809f720bc5cf3bbF/Korean-Noodle-Pot-Ramen-Pot-Aluminum-Rapid-Noodle-Cooker-Boiler-For-Soup-Pasta-Egg-Instant-Noodle.jpg
ZGnHWx9YtXgPFpsddez0,a bell hanging from a wooden building showing Korean Buddhist culture,RELIG,KOR,2024-07-01T13:40:02Z,https://pixabay.com/photos/bell-korean-asian-traditional-2709589/
ZRmimms3LF2HEp4Iwtw4,many Korean people getting off a bus at the bus station in Seoul,PEOPLE,KOR,2024-07-01T13:40:02Z,https://www.istockphoto.com/photo/people-getting-off-a-bus-gm1216785389-354939290?phrase=south+korea+covid&searchscope=image%2Cfilm
aQpASEkW7KF7XUXBR6HV,autumn view of palaces and modern buildings in Seoul,CITIES,KOR,2024-07-01T13:40:02Z,https://www.istockphoto.com/photo/autumn-of-deoksugung-royal-palace-and-seoul-city-gm917991328-252533062?phrase=seoul+fall&searchscope=image%2Cfilm
af3zqb9HyO9rcqmTqkUO,a man wearing a Korean school uniform,CLOTH,KOR,2024-07-01T13:40:02Z,https://www.flickr.com/photos/koreanet/20286369291
b1wzF27q8LWcpr4GGDVQ,"Korean-style modern buildings, advertisements on buildings, and cars are passing by on roads",CITIES,KOR,2024-07-01T13:40:02Z,https://live.staticflickr.com/7343/13950152030_0ea89f2bf3_b.jpg
bsqw41jDyUFjWPlrtlO6,a large Korean palace with steps leading up to it,ARCH,KOR,2024-07-01T13:40:02Z,https://drive.google.com/file/d/1VPQsyM6yb_W24TO4Uo06SnZrW_X9o_2I/view
cF0Pl2figonXzRjCZMJb,a table with Korean delicate food in plates,FOOD,KOR,2024-07-01T13:40:02Z,https://drive.google.com/file/d/1U2iNiJ-4BYoS3_n-cGoyjcviZEVz9b2X/view?usp=drive_link
cKjZ58VHh7IhPW1Goi4P,Korean ginseng chicken soup traditionally eaten during the summer for body health,FOOD,KOR,2024-07-01T13:40:02Z,https://www.flickr.com/photos/gorekun/27742673254
cT3p7d8qefrUl9iQnqsH,a person roasting meat on a table at a Korean BBQ restaurant,FOOD,KOR,2024-07-01T13:40:02Z,https://koreawithpriya.blog/wp-content/uploads/2023/06/kbbq7-jpg-webp.webp
cs34NYUOSG9DUiNdVe96,"a typical modern Korean bedroom with a bed, refrigerator, and television, wooden floors and large windows",ARCH,KOR,2024-07-01T13:40:02Z,https://drive.google.com/file/d/1gObBRGXshYX8JDjyYxxUcQ6paEft0jKW/view?usp=sharing
dIc3Fh5QcUs1vYCEKMTd,a Korean man in a traditional hanbok wearing a hat,CLOTH,KOR,2024-07-01T13:40:02Z,https://4.bp.blogspot.com/-4h6KoDxn1Q0/V10DN9B9jJI/AAAAAAAAABM/2EkTrtfv5IgCMyO6X8ON6N_CLUfCZl35gCKgB/s320/26f9d2f8aee66f48e4a54baf1fac0e5d.jpg
drmjjMhtQZDVDEcd5tIM,"for the K-Pop Awards, idols dressed in Korean school uniform style stand side by side",DANCE,KOR,2024-07-01T13:40:02Z,https://commons.wikimedia.org/wiki/File:Korea_KPOP_World_Festival_35.jpg
e9WPhklmSkKuf9EAog5h,an exterior of Korean traditional architecture,ARCH,KOR,2024-07-01T13:40:02Z,https://article-imgs.scribdassets.com/2nxt7r1mkgbfem5h/images/file8QBY67NM.jpg
eL61fkvF0vmLWUZMtKqq,Korean mung bean pancake on a plate,FOOD,KOR,2024-07-01T13:40:02Z,https://www.venturists.net/wp-content/uploads/2019/05/What-to-Eat-in-Seoul-Korea-Bindaeduk-and-Makgeoli--768x451.jpeg.webp
f15rLN6d0bfCLBXdbUV5,people crossing the street in Seoul with high buildings in the back,CITIES,KOR,2024-07-01T13:40:02Z,https://www.istockphoto.com/photo/busy-streets-in-gangnam-seoul-gm458249945-26470346
fSgckYO5mYkBOaJhMimA,people walking down a narrow street in the Korean food district,CITIES,KOR,2024-07-01T13:40:02Z,https://www.istockphoto.com/photo/seoul-myeongdong-shopping-street-at-sunset-gm523882406-92097071
fta34h1UrdQl2O8otXuY,a group of Korean women wearing pink aprons are selling Korean traditional snack songpyeon,FOOD,KOR,2024-07-01T13:40:02Z,https://cdn2.picryl.com/photo/2016/09/14/koreans-visited-a-traditional-market-complex-in-cheongju-4a8dd0-1024.jpg
gAf4IWGHJB7kPNBSJeVz,"a bowl of Korean food, bibimbap with lots of vegetables and meat",FOOD,KOR,2024-07-01T13:40:02Z,https://www.flickr.com/photos/60173925@N06/15897038815
gfIwNCvrbzuKvCoWqdyu,a Korean man is wearing a white and gray mixed t-shirt and a gray coat,CLOTH,KOR,2024-07-01T13:40:02Z,https://upload.wikimedia.org/wikipedia/commons/thumb/f/f3/2015_%ED%95%9C%EB%A5%98%ED%8C%A8%EC%85%98%ED%8E%98%EC%8A%A4%ED%8B%B0%EB%B2%8C_%28Korean_Wave_Fashion_Festival%29_%ED%8F%AC%ED%86%A0%EC%A1%B4_%EA%B8%B0%EB%85%90%ED%96%89%EC%82%AC_%281%29.jpg/359px-2015_%ED%95%9C%EB%A5%98%ED%8C%A8%EC%85%98%ED%8E%98%EC%8A%A4%ED%8B%B0%EB%B2%8C_%28Korean_Wave_Fashion_Festival%29_%ED%8F%AC%ED%86%A0%EC%A1%B4_%EA%B8%B0%EB%85%90%ED%96%89%EC%82%AC_%281%29.jpg?20151201064843;
hVhAdlnHQaYeBkTvJQ7j,a coastal road in Jeju island in Korea,CITIES,KOR,2024-07-01T13:40:02Z,https://www.istockphoto.com/photo/jeju-olle-trail-countryside-village-and-hallasan-mountain-in-jeju-island-korea-gm1393494842-449326951?phrase=jeju+car&searchscope=image%2Cfilm
ha5E7RI70MYgWl9Z12YH,the city view of Cheonggyecheon in downtown Seoul with high buildings,CITIES,KOR,2024-07-01T13:40:02Z,https://natureconservancy-h.assetsadobe.com/is/image/content/dam/tnc/nature/en/photos/i/s/iStock-509662042-1800.jpg?crop=0%2C72%2C1800%2C990&wid=2000&hei=1100&scl=0.9
iDCUDue3OFyTOjmwAYTh,a bowl of Korean cold noodles in chilled broth,FOOD,KOR,2024-07-01T13:40:02Z,https://upload.wikimedia.org/wikipedia/commons/0/07/Korean.noodles-Mul.naengmyeon-01.jpg
inxljx5lD2gErQ0ZyOPz,traditional Korean village in spring with tall building in the back,ARCH,KOR,2024-07-01T13:40:02Z,https://www.istockphoto.com/photo/bukchon-hanok-village-with-modern-building-in-seoul-south-korea-gm838039606-136747653?phrase=korean+traditional+village&searchscope=image%2Cfilm
itFop72FL1viKuSgKiYK,"Gwangalli Beach in Busan in Korea, many tall buildings besides the beach",CITIES,KOR,2024-07-01T13:40:02Z,https://www.istockphoto.com/photo/gwangalli-beach-in-busan-south-korea-gm1141275856-305695002?phrase=haeundae&searchscope=image%2Cfilm
jFD3hopznaWDVO3Uhikz,a bowl of Korean banquet noodle in a light broth served with toppings,FOOD,KOR,2024-07-01T13:40:02Z,https://www.istockphoto.com/photo/korean-traditional-noodles-gm1222694180-358869827
jmtKb0o8HTjH3XjkEL5G,"houses in a Korean old folk village in Jeju island, large rock statues in front",ARCH,KOR,2024-07-01T13:40:02Z,https://www.istockphoto.com/es/foto/pueblo-popular-de-jeju-castle-town-flores-de-cerezo-flores-de-violaci%C3%B3n-flores-de-gm1310286407-399745154?phrase=glotis+fotos&searchscope=image%2Cfilm
kTQ5ywso35zHIgHEZfTL,a Korean traditional architecture pagoda in autumn,ARCH,KOR,2024-07-01T13:40:02Z,https://www.istockphoto.com/photo/autumn-season-of-gyeongbokgung-palace-in-seoul-south-korea-gm660554090-120440707
kkhKma0dn1v8uXJ6lApE,"Korean modern apartment structure, downstairs hidden by trees and lots of windows",ARCH,KOR,2024-07-01T13:40:02Z,https://upload.wikimedia.org/wikipedia/commons/thumb/8/8b/East_facade_of_Hyundai_Apartments_31-dong_in_Seoul%2C_Korea.jpg/800px-East_facade_of_Hyundai_Apartments_31-dong_in_Seoul%2C_Korea.jpg?20201011084414;
lWP3AMSOp1yVhAagu988,a drum in traditional Korean patterns,DANCE,KOR,2024-07-01T13:40:02Z,https://www.istockphoto.com/photo/korean-traditional-drum-seoul-south-korea-gm880334498-245254605
lmvPNDPxEjRWcrM3Khiv,a paper fan in traditional Korean design,DANCE,KOR,2024-07-01T13:40:02Z,https://upload.wikimedia.org/wikipedia/commons/thumb/6/63/SamTaegeukFan.jpg/470px-SamTaegeukFan.jpg
mBysSx4UhkBFQFXuBKM1,people crossing the street in Korea,CITIES,KOR,2024-07-01T13:40:02Z,https://www.istockphoto.com/photo/street-crossing-in-seoul-gm524397013-52299380
mML9TrhG1Nq5NawCP4vg,a girl wearing Korean traditional clothing hanbok,CLOTH,KOR,2024-07-01T13:40:02Z,https://images.unsplash.com/photo-1506480932912-dbbe35e3e516?ixlib=rb-4.0.3&ixid=M3wxMjA3fDB8MHxwaG90by1wYWdlfHx8fGVufDB8fHx8fA%3D%3D&auto=format&fit=crop&w=2070&q=80
ndo061y5djOuTZBkJ8er,a group of people performing a K-pop dance routine,DANCE,KOR,2024-07-01T13:40:02Z,https://scontent.fagc2-1.fna.fbcdn.net/v/t39.30808-6/284611428_1627834460919266_1850967223596763235_n.jpg?stp=cp0_dst-jpg_e15_p240x240_q65&_nc_cat=104&ccb=1-7&_nc_sid=a0818e&_nc_ohc=pDBKKpMZ5fkAX9yNXqz&_nc_ht=scontent.fagc2-1.fna&oh=00_AfCXN7wkDviwcuVNwdBfF7dJjZU8pMc76JC7PepLGIcN4w&oe=659C6A71
npPcT5D1Xv0wdLF6F7Di,"Sanbangsan mountain at Saye Beach in Jeju island, Korea",NATUR,KOR,2024-07-01T13:40:02Z,https://www.istockphoto.com/photo/mountain-coast-cloud-gm1087445044-291750800
o7SdCa2Ij4jUWcTT4ym1,"Korean spicy sausage stew made with ham, sausage, kimchi, and instant noodles",FOOD,KOR,2024-07-01T13:40:02Z,https://www.istockphoto.com/photo/korean-army-base-stew-gm1309116531-398932841
oGbPbPa9udZ4iCkvkUOy,the korean tea field in a hill,NATUR,KOR,2024-07-01T13:40:02Z,https://upload.wikimedia.org/wikipedia/commons/thumb/6/60/Boseong_tea_field.jpg/800px-Boseong_tea_field.jpg?20130704115429
