category_code,country_code,url,created_at,caption,category_score,country_score,stereotype_score,offensiveness_score,contributors_cnt,contributors,updated_at
ARCH,POL,https://blog.architizer.com/wp-content/uploads/EBV_Szczecin_Filharmonia_%C2%A9HuftonCrow_006a.jpg,2024-08-10T14:08:01.543758,A building with a white facade is divided into sections by vertical lines.,0,0,0,0,0,,2024-08-11T16:22:08.061872
ARCH,POL,https://cdn.mos.cms.futurecdn.net/xQGvU3L7PediwAFh6EBPJ5.jpg,2024-08-10T14:08:01.543758,"A large, white building with many pointed peaks stands across a street from a tree.",0,0,0,0,0,,2024-08-11T16:22:08.061872
ARCH,POL,https://architizer-prod.imgix.net/media/1454470770224PORTADA.jpg?fit=max&w=1680&q=60&auto=format&auto=compress&cs=strip,2024-08-10T14:08:01.543758,"A modern building with a glass facade and a large, curved entryway stands in front of a paved area.",0,0,0,0,0,,2024-08-11T16:22:08.061872
ARCH,POL,https://study.com/cimages/multimages/16/olsztyn_castle.jpg,2024-08-10T14:08:01.543758,A large brick building with a tall tower and a red tile roof sits on a hill overlooking a cobblestone street.,0,0,0,0,0,,2024-08-11T16:22:08.061872
ARCH,POL,https://images.fineartamerica.com/images/artworkimages/mediumlarge/2/wroclaw-poland-architecture-of-market-square-carol-japp.jpg,2024-08-10T14:08:01.543758,A row of multi-colored buildings with many windows and decorative accents.,0,0,0,0,0,,2024-08-11T16:22:08.061872
ARCH,POL,https://architizer-prod.imgix.net/media/1454470770226mpj-waw-0004.jpg?fit=max&w=1680&q=60&auto=format&auto=compress&cs=strip,2024-08-10T14:08:01.543758,A large building with a flat roof and vertical siding stands opposite a large rectangular monument.,0,0,0,0,0,,2024-08-11T16:22:08.061872
ARCH,POL,"https://media.cnn.com/api/v1/images/stellar/prod/160623121728-poland-radical-post-war-churches-2.jpg?q=w_1050,h_787,x_0,y_0,c_fill",2024-08-10T14:08:01.543758,"A large, gray, geometric building is surrounded by trees and a paved path.",0,0,0,0,0,,2024-08-11T16:22:08.061872
ARCH,POL,https://static.designboom.com/wp-content/uploads/2023/03/mielec-meeko-architects-designboom-500.jpg,2024-08-10T14:08:01.543758,A modern building with large windows and a flat roof.,0,0,0,0,0,,2024-08-11T16:22:08.061872
ARCH,POL,https://metropolismag.com/wp-content/uploads/2022/06/71813-main_1139-6_71813_sc_v2com-1024x732.jpg,2024-08-10T14:08:01.543758,A building with a geometric patterned facade is photographed from above.,0,0,0,0,0,,2024-08-11T16:22:08.061872
ARCH,POL,https://static.dezeen.com/uploads/2017/07/museum-world-war-studio-architektoniczne-kwadrat_dezeen_hero-b.jpg,2024-08-10T14:08:01.543758,"A large, angular building with a glass facade stands on a grassy slope next to a body of water.",0,0,0,0,0,,2024-08-11T16:22:08.061872
ARCH,POL,https://encrypted-tbn0.gstatic.com/images?q=tbn:ANd9GcSMNkeRwjc5gu_RD2KH9_cWqDXI45Ii_l8hTQ&s,2024-08-10T14:08:01.543758,"A large, rectangular building with a flat roof and many windows is built on a hill with grass and small trees.",0,0,0,0,0,,2024-08-11T16:22:08.061872
ARCH,POL,https://www.e-architect.com/wp-content/uploads/2023/08/polish-army-museum-warsaw-poland-w140823-m7.jpg,2024-08-10T14:08:01.543758,A large rectangular building with a flat roof is pictured with a few trees in front of it.,0,0,0,0,0,,2024-08-11T16:22:08.061872
ARCH,POL,https://images.adsttc.com/media/images/6165/b967/f91c/81b2/4700/019a/newsletter/FI_1.jpg?1634056530,2024-08-10T14:08:01.543758,"A large, empty space with a wooden floor, surrounded by a rough, gray ceiling.",0,0,0,0,0,,2024-08-11T16:22:08.061872
ARCH,POL,https://static2.abitare.it/wp-content/uploads/2019/12/01-ZAKOPANE-p-630x353.jpg?v=401337,2024-08-10T14:08:01.543758,A group of wooden houses with snow-covered roofs are in a snowy landscape.,0,0,0,0,0,,2024-08-11T16:22:08.061872
ARCH,POL,https://cdn.theculturetrip.com/images/56-288850-libeskind-lonmetuni.jpg?s=10x,2024-08-10T14:08:01.543758,"A modern, angular building with a large, flat, silver surface.",0,0,0,0,0,,2024-08-11T16:22:08.061872
ARCH,POL,https://images.adsttc.com/media/images/6542/ae68/08e4/447e/e512/e8ac/newsletter/a-royal-opera-in-warsaw-and-a-center-for-the-arts-in-canada-8-music-and-performance-venues-submitted-by-the-archdaily-community_12.jpg?1698868867,2024-08-10T14:08:01.543758,"A large, modern building with a transparent facade is surrounded by bare trees and snow-covered ground.",0,0,0,0,0,,2024-08-11T16:22:08.061872
ARCH,POL,https://static.dezeen.com/uploads/2024/03/metropolitan-station-lublin-tremend-architecture-infrastructure_dezeen_1704_sq-411x411.jpg,2024-08-10T14:08:01.543758,"A modern building with a large, open space and a ceiling supported by intricate, tree-like structures.",0,0,0,0,0,,2024-08-11T16:22:08.061872
ARCH,POL,https://static01.nyt.com/images/2018/10/10/t-magazine/10tmag-poland-slide-JJ8L/10tmag-poland-slide-JJ8L-superJumbo.jpg,2024-08-10T14:08:01.543758,A tall building with many windows and balconies against a pale blue sky.,0,0,0,0,0,,2024-08-11T16:22:08.061872
ARCH,POL,https://qph.cf2.quoracdn.net/main-qimg-b6addff766febfe4c4787a0c031c1e2c-lq,2024-08-10T14:08:01.543758,"A high-ceilinged room with blue and gold intricate designs, stained glass windows, and a gold altar in the center.",0,0,0,0,0,,2024-08-11T16:22:08.061872
ARCH,POL,https://preview.redd.it/nh655x5mgjw61.jpg?width=640&crop=smart&auto=webp&s=a224fd07a87e93517ac05cd3d9b9bba7b63f38a5,2024-08-10T14:08:01.543758,A tall building with many windows and balconies.,0,0,0,0,0,,2024-08-11T16:22:08.061872
ARCH,POL,https://api.culture.pl/sites/default/files/images/imported/architektura/linkbajty/ARCHITEKTURA_PRZEWODNIK/full_1_fot.w.krysski_muzeum_historii_lydew_polskich_polin_770.jpg,2024-08-10T14:08:01.543758,A large building with a glass facade and a single tree in front of it.,0,0,0,0,0,,2024-08-11T16:22:08.061872
ARCH,POL,https://www.abitare.it/wp-content/uploads/2019/12/02-ZAKOPANE-it-620.jpg,2024-08-10T14:08:01.543758,A large wooden house with a steep roof and a stone foundation sits on a grassy slope.,0,0,0,0,0,,2024-08-11T16:22:08.061872
ARCH,POL,https://images.adsttc.com/media/images/6512/9f89/0a1f/c50e/55dc/b45b/newsletter/polish-israeli-architect-zvi-hecker-passes-away-at-the-age-of-92_2.jpg?1695719312,2024-08-10T14:08:01.543758,"A complex of buildings with a variety of shapes and materials, featuring a walkway on top.",0,0,0,0,0,,2024-08-11T16:22:08.061872
ARCH,POL,https://encrypted-tbn0.gstatic.com/images?q=tbn:ANd9GcT1z5eLmSrTdrMH7UjJNx7RaDdkjD4Cejyd0A&s,2024-08-10T14:08:01.543758,"A building with an unusual, distorted shape stands in front of a cafe with tables and chairs.",0,0,0,0,0,,2024-08-11T16:22:08.061872
ARCH,POL,https://images.adsttc.com/media/images/5fa2/f873/63c0/17e1/e100/005e/large_jpg/lodz.jpg?1604515945,2024-08-10T14:08:01.543758,"A large, grey building with many windows and balconies.",0,0,0,0,0,,2024-08-11T16:22:08.061872
ARCH,POL,https://amazingarchitecture.com/storage/2503/single_family_house_with_pool_in_poznan_easst_architects.jpg,2024-08-10T14:08:01.543758,"A large, modern building with large windows sits on a lawn.",0,0,0,0,0,,2024-08-11T16:22:08.061872
ARCH,POL,https://architizer-prod.imgix.net/media/1428391181313026_03.jpg?fit=max&w=1680&q=60&auto=format&auto=compress&cs=strip,2024-08-10T14:08:01.543758,A large white building with a pointed roof stands across a street.,0,0,0,0,0,,2024-08-11T16:22:08.061872
ARCH,POL,https://images.fineartamerica.com/images/artworkimages/mediumlarge/3/gdansk-north-poland-closeup-of-colorful-polish-medieval-architecture-building-built-closely-next-to-each-other-arpan-bhatia.jpg,2024-08-10T14:08:01.543758,A row of tall buildings with many windows and intricate details.,0,0,0,0,0,,2024-08-11T16:22:08.061872
ARCH,POL,https://static.dezeen.com/uploads/2022/02/lake-house-ugo-poland-residential-architecture_dezeen_2364_sq3-411x411.jpg,2024-08-10T14:08:01.543758,A large tree with many branches stands in front of a modern building with large windows.,0,0,0,0,0,,2024-08-11T16:22:08.061872
ARCH,POL,https://images.adsttc.com/media/images/5d48/1b2e/284d/d118/e900/001e/large_jpg/WS-050_Igor_Snopek-01.jpg?1565006630,2024-08-10T14:08:01.543758,An aerial view of a building with a cross on top surrounded by a large patch of grass.,0,0,0,0,0,,2024-08-11T16:22:08.061872
ARCH,POL,https://encrypted-tbn0.gstatic.com/images?q=tbn:ANd9GcQfmTbgQEkZkkhabby--zy7Isr0qKK85IPtpQ&s,2024-08-10T14:08:01.543758,A large building with a colorful facade and a glass tower stands on a paved area with several people walking around.,0,0,0,0,0,,2024-08-11T16:22:08.061872
ARCH,POL,https://b772872.smushcdn.com/772872/wp-content/uploads/2018/12/wilanow-palace.jpg?lossy=1&strip=1&webp=1,2024-08-10T14:08:01.543758,"A large building with a tower stands in front of a cloudy sky, and is surrounded by a formal garden.",0,0,0,0,0,,2024-08-11T16:22:08.061872
