category_code,country_code,url,created_at,caption,category_score,country_score,stereotype_score,offensiveness_score,contributors_cnt,contributors,updated_at
CITIES,CHN,https://www.tripsavvy.com/thmb/P1QE9pA-rxHceEx7lAk5RJJqTFk=/1500x0/filters:no_upscale():max_bytes(150000):strip_icc()/Shanghai-5a824654875db90037d7834a.jpg,2024-08-10T13:08:17.887923,A city skyline with many tall buildings illuminated by brightly colored lights is reflected in a body of water.,0,0,0,0,0,,2024-08-11T16:14:49.588155
CITIES,CHN,https://www.china-briefing.com/news/wp-content/uploads/2019/02/China-Briefing-Mapping-out-China%E2%80%99s-City-Tier-Categories.jpg,2024-08-10T13:08:17.887923,An aerial view of a city with many tall buildings along a body of water.,0,0,0,0,0,,2024-08-11T16:14:49.588155
CITIES,CHN,https://news.cgtn.com/news/3d3d514e7a49544f78457a6333566d54/img/aa185651f06f46159d45a462884a14ac/aa185651f06f46159d45a462884a14ac.jpg,2024-08-10T13:08:17.887923,A vast cityscape with numerous buildings and lights is seen from above.,0,0,0,0,0,,2024-08-11T16:14:49.588155
CITIES,CHN,https://i.insider.com/5991e13f3ce5e9210c08089f?width=700,2024-08-10T13:08:17.887923,Many tall buildings with lights stand on a large body of water surrounded by greenery.,0,0,0,0,0,,2024-08-11T16:14:49.588155
CITIES,CHN,https://images.chinahighlights.com/allpicture/2019/11/e8315cf6758f4dfc9d632a24_cut_800x500_61.jpg,2024-08-10T13:08:17.887923,"A densely populated urban area with many tall buildings, lit up at night.",0,0,0,0,0,,2024-08-11T16:14:49.588155
CITIES,CHN,https://miro.medium.com/v2/resize:fit:1400/1*MoYMNRPG1ySKLsMUMSAVtQ.jpeg,2024-08-10T13:08:17.887923,An aerial view of a city at night with a large body of water flowing through it.,0,0,0,0,0,,2024-08-11T16:14:49.588155
CITIES,CHN,https://media4.manhattan-institute.org/sites/cj/files/china-mega-cities.jpg,2024-08-10T13:08:17.887923,Tall buildings are surrounded by white clouds.,0,0,0,0,0,,2024-08-11T16:14:49.588155
CITIES,CHN,https://encrypted-tbn0.gstatic.com/images?q=tbn:ANd9GcRtxr0FJ-hsjUOoqsBY-IXt4BibNq7JqazAIw&s,2024-08-10T13:08:17.887923,A city skyline at night is illuminated by bright lights.,0,0,0,0,0,,2024-08-11T16:14:49.588155
CITIES,CHN,https://news.cgtn.com/news/2021-04-20/Number-of-Chinese-cities-with-over-1M-urban-population-reaches-93-ZC2mjenrLG/img/0934aa3551604a7d9c83eb39161c0b75/0934aa3551604a7d9c83eb39161c0b75.jpeg,2024-08-10T13:08:17.887923,An aerial view of a large city with many tall buildings and a large body of water in the distance.,0,0,0,0,0,,2024-08-11T16:14:49.588155
CITIES,CHN,https://assets.bwbx.io/images/users/iqjWHBFdfxIU/i2sTtZQDWPlQ/v2/-1x-1.jpg,2024-08-10T13:08:17.887923,An aerial view of a densely populated urban area with a large number of buildings.,0,0,0,0,0,,2024-08-11T16:14:49.588155
CITIES,CHN,https://encrypted-tbn0.gstatic.com/images?q=tbn:ANd9GcTW2IzHGxZ8qKOazCLS2e1i2R6iT9g1iiuW3Q&s,2024-08-10T13:08:17.887923,"A large city at night, illuminated by many lights.",0,0,0,0,0,,2024-08-11T16:14:49.588155
CITIES,CHN,https://encrypted-tbn0.gstatic.com/images?q=tbn:ANd9GcRY5iwP-JB0NZs_xVNlEOpeTKiDiSr9kyng8A&s,2024-08-10T13:08:17.887923,A dense cityscape with numerous tall buildings is lit up at night.,0,0,0,0,0,,2024-08-11T16:14:49.588155
CITIES,CHN,https://images.chinahighlights.com/allpicture/2018/06/3aa02a7fb6f24ae9b58b5412_cut_800x500_61.jpg,2024-08-10T13:08:17.887923,A city skyline with many tall buildings sits along a body of water.,0,0,0,0,0,,2024-08-11T16:14:49.588155
CITIES,CHN,https://news.mit.edu/sites/default/files/styles/news_article__image_gallery/public/images/202005/MITEI-Transportation-Policymaking-2020.jpg?itok=aK3WmC7u,2024-08-10T13:08:17.887923,A large city is situated at the base of a mountain range with a river running through it.,0,0,0,0,0,,2024-08-11T16:14:49.588155
CITIES,CHN,https://t3.ftcdn.net/jpg/06/28/20/58/360_F_628205818_FGnx6FRhEoPyHK5skY2aGVb1kGRtO3RL.jpg,2024-08-10T13:08:17.887923,"A city with tall, multi-level structures, mountains, and a body of water is depicted at dusk.",0,0,0,0,0,,2024-08-11T16:14:49.588155
CITIES,CHN,https://encrypted-tbn0.gstatic.com/images?q=tbn:ANd9GcR09-eWJRXwo6i0GC-xtIhGxy9Ll9emoVFMgA&s,2024-08-10T13:08:17.887923,"The image shows four different nighttime views of a city, each with tall buildings illuminated by lights.",0,0,0,0,0,,2024-08-11T16:14:49.588155
CITIES,CHN,https://lh5.googleusercontent.com/proxy/miyS8PD7S1k1RncZt7TqbFYw-EJO6_8jDUVqPuDLm2jLlYA28JrzD437m-1fzIs_reSk48D5OxNPFgnQstz-ycRum3Spwt4tEA6ZzLtsq1uyb55PWpptBqLgNYT2G2y_ics,2024-08-10T13:08:17.887923,A city skyline with many tall buildings lit up at night.,0,0,0,0,0,,2024-08-11T16:14:49.588155
CITIES,CHN,"https://media.cnn.com/api/v1/images/stellar/prod/181119100102-shenzhen-china.jpg?q=w_1920,h_1080,x_0,y_0,c_fill",2024-08-10T13:08:17.887923,"A vast urban landscape with numerous tall structures, a river, and green areas.",0,0,0,0,0,,2024-08-11T16:14:49.588155
CITIES,CHN,https://content.paulreiffer.com/wp-content/uploads/2015/06/Beijing-night-cityscape-forbidden-city-Tiananmen-square-central-radio-tv-tower-capital-city-china-paul-reiffer-professional-cityscape-landscape-photographer.jpg,2024-08-10T13:08:17.887923,A large city at night with many bright lights.,0,0,0,0,0,,2024-08-11T16:14:49.588155
CITIES,CHN,https://i.insider.com/6362244d6e8b9800192e008c?width=700,2024-08-10T13:08:17.887923,A large city with many tall buildings is surrounded by a large area of trees.,0,0,0,0,0,,2024-08-11T16:14:49.588155
CITIES,CHN,https://www.businesswest.co.uk/sites/default/files/styles/event_image/public/blog/featured/shutterstock_547215337.jpg?itok=pd8GOEYL,2024-08-10T13:08:17.887923,A lit bridge crosses a river in front of a city skyline.,0,0,0,0,0,,2024-08-11T16:14:49.588155
CITIES,CHN,https://external-preview.redd.it/4o75sktribVW6BfMxUXuNpWMiuQ3YrYM3j4S58azHN8.png?width=1080&crop=smart&format=pjpg&auto=webp&s=bea3e01a685bfdd1c5a7c58f73390c82c5d0f986,2024-08-10T13:08:17.887923,A city skyline at night with many tall buildings and a red bridge.,0,0,0,0,0,,2024-08-11T16:14:49.588155
CITIES,CHN,https://smartairfilters.com/wordpress/wp-content/uploads/2020/11/shenzhen.jpg,2024-08-10T13:08:17.887923,An aerial view of a city with a tall skyscraper illuminated in the center.,0,0,0,0,0,,2024-08-11T16:14:49.588155
CITIES,CHN,https://upload.wikimedia.org/wikipedia/commons/thumb/e/e3/Commercial_area_of_futian_to_east2020.jpg/1200px-Commercial_area_of_futian_to_east2020.jpg,2024-08-10T13:08:17.887923,A large urban area with many tall buildings and a patch of green space in the foreground.,0,0,0,0,0,,2024-08-11T16:14:49.588155
CITIES,CHN,https://t3.ftcdn.net/jpg/07/26/44/98/360_F_726449888_fXkCX5dIxgDspvmwZ86v5KeLG0r9eIxA.jpg,2024-08-10T13:08:17.887923,Silhouettes of buildings are reflected in a calm body of water.,0,0,0,0,0,,2024-08-11T16:14:49.588155
CITIES,CHN,https://i0.wp.com/asiatimes.com/wp-content/uploads/2021/03/China-Cities.jpg?fit=1200%2C686&ssl=1,2024-08-10T13:08:17.887923,"A long, narrow body of water reflects the city lights at night.",0,0,0,0,0,,2024-08-11T16:14:49.588155
CITIES,CHN,https://encrypted-tbn0.gstatic.com/images?q=tbn:ANd9GcTaN3B75vbRDZfhPJTACZuUTR8GGWKv2uEwJg&s,2024-08-10T13:08:17.887923,A dense city skyline is illuminated by lights at night.,0,0,0,0,0,,2024-08-11T16:14:49.588155
CITIES,CHN,https://wwd.com/wp-content/uploads/2020/08/ap19150059651777.jpg?w=1024,2024-08-10T13:08:17.887923,A densely populated city with many tall buildings and illuminated windows at dusk.,0,0,0,0,0,,2024-08-11T16:14:49.588155
CITIES,CHN,https://coingeek.com/wp-content/uploads/2020/09/Beijing-ranks-first-among-blockchain-cities-in-China.jpg,2024-08-10T13:08:17.887923,An aerial view of many tall buildings.,0,0,0,0,0,,2024-08-11T16:14:49.588155
CITIES,CHN,https://www.shutterstock.com/image-photo/panoramic-skyline-modern-commercial-buildings-600nw-2095407220.jpg,2024-08-10T13:08:17.887923,A city skyline with tall buildings is reflected on a calm body of water.,0,0,0,0,0,,2024-08-11T16:14:49.588155
CITIES,CHN,https://t4.ftcdn.net/jpg/07/26/44/99/360_F_726449949_ESlI6XYanLlwrnHt78OlPONe8yvsaT40.jpg,2024-08-10T13:08:17.887923,A city skyline with several tall buildings and traditional structures with curved roofs.,0,0,0,0,0,,2024-08-11T16:14:49.588155
CITIES,CHN,https://i.insider.com/63621bf8ade71a00193dee47?width=800&format=jpeg&auto=webp,2024-08-10T13:08:17.887923,A winding waterway flows through a densely populated urban area.,0,0,0,0,0,,2024-08-11T16:14:49.588155
CITIES,CHN,https://img.freepik.com/free-photo/china-city-night_1127-3927.jpg,2024-08-10T13:08:17.887923,A view from above of many lit tall buildings and a city at night.,0,0,0,0,0,,2024-08-11T16:14:49.588155
CITIES,CHN,https://encrypted-tbn0.gstatic.com/images?q=tbn:ANd9GcR2CpK4_fuo0l2LFS9f6t7vVkbTMS-aYrStLw&s,2024-08-10T13:08:17.887923,A city skyline with tall buildings and bright lights is illuminated by a ring of light on the water in front of it.,0,0,0,0,0,,2024-08-11T16:14:49.588155
CITIES,CHN,https://static01.nyt.com/images/2020/06/03/world/03hongkong-damages-1/merlin_172955151_6b092b78-7e3c-4d4c-bc2c-febab2e39129-articleLarge.jpg?quality=75&auto=webp&disable=upscale,2024-08-10T13:08:17.887923,People are standing and sitting on a waterfront overlooking a city skyline.,0,0,0,0,0,,2024-08-11T16:14:49.588155
CITIES,CHN,https://assets-global.website-files.com/6058099def1630fdb05d8280/6110a41cf4d04bade51848c2_hong_kong_406d0bbf-6f92-466f-8ab7-9538ca23a301.jpg,2024-08-10T13:08:17.887923,A city with many tall buildings lit up at night is reflected in the water in front of it.,0,0,0,0,0,,2024-08-11T16:14:49.588155
CITIES,CHN,https://i.ytimg.com/vi/xLr7JpHOPhQ/maxresdefault.jpg,2024-08-10T13:08:17.887923,A night view of a city with tall buildings and many lights.,0,0,0,0,0,,2024-08-11T16:14:49.588155
CITIES,CHN,https://img.freepik.com/free-photo/china-city-night_1127-3926.jpg,2024-08-10T13:08:17.887923,A city is illuminated by many lights at night.,0,0,0,0,0,,2024-08-11T16:14:49.588155
CITIES,CHN,https://video.cgtn.com/news/3d3d514f786b6a4d31457a6333566d54/video/16f012c04e6c44cdae6bbd9ac70edc48/16f012c04e6c44cdae6bbd9ac70edc48.jpg,2024-08-10T13:08:17.887923,A nighttime aerial view of a city illuminated by lights.,0,0,0,0,0,,2024-08-11T16:14:49.588155
CITIES,CHN,https://www.worldatlas.com/r/w1200/upload/44/70/5a/shutterstock-274406804.jpg,2024-08-10T13:08:17.887923,"A cityscape with many tall buildings, some lit up with windows.",0,0,0,0,0,,2024-08-11T16:14:49.588155
CITIES,CHN,https://t4.ftcdn.net/jpg/08/17/87/21/360_F_817872168_2Lfz9Li9qS5CEsBM6krBh4QJgYSq3IUq.jpg,2024-08-10T13:08:17.887923,Tall buildings are illuminated by lights in a foggy urban landscape with a highway below.,0,0,0,0,0,,2024-08-11T16:14:49.588155
CITIES,CHN,https://geographical.co.uk/wp-content/uploads/shutterstock_252677680.jpg,2024-08-10T13:08:17.887923,A city skyline with many tall buildings illuminated at night by lights reflected in the water.,0,0,0,0,0,,2024-08-11T16:14:49.588155
CITIES,CHN,https://www.shutterstock.com/image-photo/aerial-view-modern-city-skyline-600nw-1940982877.jpg,2024-08-10T13:08:17.887923,A city skyline with tall buildings and a body of water in the foreground.,0,0,0,0,0,,2024-08-11T16:14:49.588155
CITIES,CHN,https://media.istockphoto.com/id/486968426/photo/hong-kong-central-district-at-night.jpg?s=612x612&w=0&k=20&c=NVTMeLOgBDOc4f4twJX49XSlJZoNgYySM3kQGwxkckM=,2024-08-10T13:08:17.887923,A city street with tall buildings and a highway with bright streaks of light.,0,0,0,0,0,,2024-08-11T16:14:49.588155
CITIES,CHN,https://www.china-briefing.com/news/wp-content/uploads/2021/04/Investing-in-Hangzhou-Zhejiang-Province-China-City-Spotlight.jpg,2024-08-10T13:08:17.887923,"A panoramic view of a city with tall buildings, a river, and a bridge.",0,0,0,0,0,,2024-08-11T16:14:49.588155
CITIES,CHN,https://encrypted-tbn0.gstatic.com/images?q=tbn:ANd9GcSQ2RgweXPJUixGRIps4dnstnCK_Xeyjr70iQ&s,2024-08-10T13:08:17.887923,A structure with a curved roof and hanging lights is silhouetted against a city skyline illuminated with lights.,0,0,0,0,0,,2024-08-11T16:14:49.588155
CITIES,CHN,https://travel2next.com/wp-content/uploads/most-populated-cities-in-china-1.jpg,2024-08-10T13:08:17.887923,A large city with many tall buildings is situated next to a green area with several bodies of water.,0,0,0,0,0,,2024-08-11T16:14:49.588155
CITIES,CHN,https://media.istockphoto.com/id/1215054627/video/drone-view-of-hong-kong-kowloon-city-skyline-at-night.jpg?s=640x640&k=20&c=_Hd5OlCrJtNvnEQjCYDpCkX9mBDhYr32Mj4_1MuNc88=,2024-08-10T13:08:17.887923,A cityscape of illuminated buildings at night is reflected in the water.,0,0,0,0,0,,2024-08-11T16:14:49.588155
CITIES,CHN,https://miro.medium.com/v2/resize:fit:1400/1*g2iUx4Cn_EHCYVKVcFcsHA.jpeg,2024-08-10T13:08:17.887923,A city skyline with tall buildings lit up at night.,0,0,0,0,0,,2024-08-11T16:14:49.588155
CITIES,CHN,https://encrypted-tbn0.gstatic.com/images?q=tbn:ANd9GcRi9tEU0xQEs7eb8VTn718DJvRKSJBf5Xxh1g&s,2024-08-10T13:08:17.887923,A dense cityscape is illuminated by lights at night.,0,0,0,0,0,,2024-08-11T16:14:49.588155
CITIES,CHN,https://www.shutterstock.com/image-photo/cityscape-hong-kong-city-skyline-600nw-2288698225.jpg,2024-08-10T13:08:17.887923,A city skyline is illuminated with blue and pink lights.,0,0,0,0,0,,2024-08-11T16:14:49.588155
CITIES,CHN,https://www.topchinatravel.com/pic/city/hongkong/hongkong-city-view-4.jpg,2024-08-10T13:08:17.887923,A city skyline is lit up at night with brightly colored lights that are reflected in the water.,0,0,0,0,0,,2024-08-11T16:14:49.588155
CITIES,CHN,https://fdichina.com/wp-content/uploads/2022/06/china-city-tier-invest-scaled.jpg,2024-08-10T13:08:17.887923,"A cityscape with many buildings and a large river, seen from above a hill covered in trees.",0,0,0,0,0,,2024-08-11T16:14:49.588155
CITIES,CHN,https://pics.craiyon.com/2023-09-16/cd3ed78ddcea466cbd0888bcac07ce37.webp,2024-08-10T13:08:17.887923,"A city skyline at night, with many tall buildings illuminated by artificial light.",0,0,0,0,0,,2024-08-11T16:14:49.588155
CITIES,CHN,https://www.archiobjects.org/wp-content/uploads/2016/01/Ghost-Cities-Barnaby-Chambers.jpg,2024-08-10T13:08:17.887923,A vast expanse of closely spaced residential buildings.,0,0,0,0,0,,2024-08-11T16:14:49.588155
CITIES,CHN,https://windhorsetour.com/sites/default/files/2021-01/chongqing-night-view-hongya-cave-chaptianmen.jpg,2024-08-10T13:08:17.887923,"A collage of four nighttime images showcasing a city with bridges, buildings, and water.",0,0,0,0,0,,2024-08-11T16:14:49.588155
