category_code,country_code,url,created_at,caption,category_score,country_score,stereotype_score,offensiveness_score,contributors_cnt,contributors,updated_at
DANCE,KOR,https://bostonglobe-prod.cdn.arcpublishing.com/resizer/v2/GGI4P34ZSFBF3COU2BUFRGPLMM.jpg?auth=5479b07273c4e49978e0c5f4a978ed381404f740d767a7454f34e80f090f6865&width=1440,2024-07-02T11:51:16.720768,A collage of black and white images featuring people in various poses.,0,0,0,0,0,,2024-08-11T16:13:33.210941
DANCE,KOR,https://i.vimeocdn.com/video/1121588604-87f4be4bc43d97f045a73fc2e03be985fe3b595d824e72175c72b7be81cfbee9-d_750x421.875?q=60,2024-07-02T11:51:16.720768,Seven people in colorful clothing are performing a dance on a wooden floor.,0,0,0,0,0,,2024-08-11T16:13:33.210941
DANCE,KOR,https://mjkpa.com/wp-content/uploads/2020/03/0-1.jpeg?w=443&h=474&crop=1,2024-07-02T11:51:16.720768,A person in colorful clothing plays a large drum with a stick.,0,0,0,0,0,,2024-08-11T16:13:33.210941
DANCE,KOR,https://myseoulbox.com/cdn/shop/articles/6635407de35369c58d1f2cc4dd112e15.jpg?v=1658564515,2024-07-02T11:51:16.720768,"A group of people in long blue dresses and holding round, decorated drums perform a dance.",0,0,0,0,0,,2024-08-11T16:13:33.210941
DANCE,KOR,https://images.squarespace-cdn.com/content/v1/5e750c2e42495559a179ca7b/1585050798201-DWGMEW44TYHV2NVFJD2Q/Memories+of+Jindo+20191102+%28c%29Korean+Cultural+Center+New+York+%2832%29.JPG,2024-07-02T11:51:16.720768,Four people in colorful clothing are performing a dance on a stage.,0,0,0,0,0,,2024-08-11T16:13:33.210941
DANCE,KOR,https://arts.ucsc.edu/sites/default/files/styles/standard_page_width_542/public/seungmu-dance-400.jpg?itok=wGyVFWnJ,2024-07-02T11:51:16.720768,A person in a white garment is performing a dance in front of a colorful drum on a stand.,0,0,0,0,0,,2024-08-11T16:13:33.210941
DANCE,KOR,https://lh6.googleusercontent.com/proxy/HlAGCWpGFTBLj62I7--LTUsuQY7vl9HFdvMlvLjBAr-8Vf9itnyX-6d9ed-EH_GpnXa1D6dACh3owCxbWW15S0y6rUNeXJHL7CFLHIsKTCsREt9oXMMGxlauyKsr-a7hM82nRk3PMCal,2024-07-02T11:51:16.720768,Five people are performing with large drums.,0,0,0,0,0,,2024-08-11T16:13:33.210941
DANCE,KOR,https://soribeat.org/wp-content/uploads/2020/06/Hallyangmu.jpg,2024-07-02T11:51:16.720768,"A person wearing a long, colorful robe and a hat is dancing on a stage with a dark background.",0,0,0,0,0,,2024-08-11T16:13:33.210941
DANCE,KOR,https://encrypted-tbn0.gstatic.com/images?q=tbn:ANd9GcTqogdyb1-8kM3alue_n1pfJbCVyBPuPOR34A&s,2024-07-02T11:51:16.720768,A group of people perform a musical act on a set of concrete steps in front of a building.,0,0,0,0,0,,2024-08-11T16:13:33.210941
DANCE,KOR,https://mimgnews.pstatic.net/image/origin/003/2024/02/28/12398377.jpg,2024-07-02T11:51:16.720768,A collage of images featuring a group of individuals in various poses and settings.,0,0,0,0,0,,2024-08-11T16:13:33.210941
DANCE,KOR,https://disco.teak.fi/asia/wp-content/uploads/2017/10/kor38.jpg,2024-07-02T11:51:16.720768,A person wearing white pants is performing a dance move.,0,0,0,0,0,,2024-08-11T16:13:33.210941
DANCE,KOR,https://www.allarts.org/wp-content/uploads/2023/07/Act1-1.close-3_HwangPiljoo_.jpg,2024-07-02T11:51:16.720768,A group of people in long white robes and tall black hats are performing a synchronized dance.,0,0,0,0,0,,2024-08-11T16:13:33.210941
DANCE,KOR,https://images.squarespace-cdn.com/content/v1/5e750c2e42495559a179ca7b/1585051632058-RXG9XRJMG0KLP5Z1YHI6/29542912_1685221138221255_7011781831496734566_n.jpg,2024-07-02T11:51:16.720768,A group of performers in red and white clothing dance with large fans in a room with high ceilings.,0,0,0,0,0,,2024-08-11T16:13:33.210941
DANCE,KOR,https://encrypted-tbn0.gstatic.com/images?q=tbn:ANd9GcQikw9K6u0Kn1AApWCaZjd4t1NHXZ_5CvZQaA&s,2024-07-02T11:57:38.182289,"Two people are performing a dance on a stage, with one person lying on their side and the other person kneeling and holding their hand.",0,0,0,0,0,,2024-08-11T16:13:33.210941
DANCE,KOR,https://lh3.googleusercontent.com/proxy/ErlFQdWjbjVY_eJDf53fTtJrFXJl0oDxhEg11XRO6USot-CqSQgfcPYZdW_J8LGP8m7CUYfbhrvSy3ZsEghWfHAg4Yz_zun22_2QOnW373xX7CWlsHC5ZPmovPg,2024-07-02T11:57:38.182289,A man in a white shirt and dark pants is jumping and gesturing with his arms.,0,0,0,0,0,,2024-08-11T16:13:33.210941
DANCE,KOR,https://www.kyosu.net/news/photo/201106/23160_8938_3122.jpg,2024-07-02T11:57:38.182289,Two people are photographed posing in dance-like stances.,0,0,0,0,0,,2024-08-11T16:13:33.210941
DANCE,KOR,https://encrypted-tbn0.gstatic.com/images?q=tbn:ANd9GcSr3negim7e1rye5JWjdcLw8D68zRz47xYcCg&s,2024-07-02T11:57:38.182289,Multiple figures in blue pants and white shirts leap in a coordinated sequence.,0,0,0,0,0,,2024-08-11T16:13:33.210941
DANCE,KOR,https://encrypted-tbn0.gstatic.com/images?q=tbn:ANd9GcTFes8LaDz1CUJtLC_WZMCj0tpziBPTAELthw&s,2024-07-02T11:57:38.182289,A person in a red garment is performing a dance on a stage.,0,0,0,0,0,,2024-08-11T16:13:33.210941
DANCE,KOR,https://lh6.googleusercontent.com/proxy/s_kvtx6Jbtj2UecczFuo5wZ56eBGotMV1HI52ja8HgCeGXtmR3FsotX1lF8_Wa1OyByy4rGvIn_4hyS1uaXdQgAMTtD_lEtaH48wujAApe1SfMJ70RaoU25k,2024-07-02T11:57:38.182289,Two performers are in the middle of a dance routine.,0,0,0,0,0,,2024-08-11T16:13:33.210941
DANCE,KOR,https://lh4.googleusercontent.com/proxy/K1XaF-om644cJai8NE43PWmv81moEP5FjVvWJGACAOJ45VXVbE5LV33_-PnBImboeSf5rMWsorIHvjM4TZ024JrWtgHQKQVdqjixGjAoZ1iUUdET,2024-07-02T11:57:38.182289,A person is lying on a stage in front of a large blue and green abstract background.,0,0,0,0,0,,2024-08-11T16:13:33.210941
DANCE,KOR,https://encrypted-tbn0.gstatic.com/images?q=tbn:ANd9GcQQ9RGR3VyGDskNhIUHcvPTpTPyL0tL2KNC2A&s,2024-07-02T11:57:38.182289,"A person in a long blue and white garment dances on a stage, holding a large white fabric that flows behind them.",0,0,0,0,0,,2024-08-11T16:13:33.210941
DANCE,KOR,https://mblogthumb-phinf.pstatic.net/MjAyMTAzMTFfMjgz/MDAxNjE1NDU5NzY1MzM3.uBqA9SAuYgT2RQo81IgnFOm_b7F9ebt58FoCvAzBeDcg.Va9_5CBm6_5rNPzxkki5a3RAK3fHDDUfefXg5hGo8M0g.JPEG.jump_arko/%EB%AC%B4%EC%9A%A9_%EB%8F%8C_%ED%95%9C%EA%B5%AD%EB%AC%B8%ED%99%94%EC%98%88%EC%88%A0%EC%9C%84%EC%9B%90%ED%9A%8C_%E2%93%92%EC%8B%AC%EC%A3%BC%ED%98%B8_(9).jpg?type=w800,2024-07-02T11:57:38.182289,A group of performers dance in a dark space lit by spotlights.,0,0,0,0,0,,2024-08-11T16:13:33.210941
DANCE,KOR,https://www.noblesse.com/shop/data/m/editor_new/2022/03/29/dd7a8fa5028df93aimage1.jpg,2024-07-02T11:57:38.182289,A person with dark hair and a white sleeveless shirt is bending over with their right arm extended and their left arm bent at the elbow.,0,0,0,0,0,,2024-08-11T16:13:33.210941
DANCE,KOR,https://encrypted-tbn0.gstatic.com/images?q=tbn:ANd9GcQyg3xjv8lPLQys-RcXxiqubQyWwOxIaK0RCg&s,2024-07-02T11:57:38.182289,A group of performers in white clothing are moving gracefully in a dark space.,0,0,0,0,0,,2024-08-11T16:13:33.210941
DANCE,KOR,https://encrypted-tbn0.gstatic.com/images?q=tbn:ANd9GcQKuLoRgbeOm5Ihy1eAMM7fHQ6rWorTECciFQ&s,2024-07-02T11:57:38.182289,Two people are facing each other in a dimly lit space with other people in the background.,0,0,0,0,0,,2024-08-11T16:13:33.210941
DANCE,KOR,https://mblogthumb-phinf.pstatic.net/20131216_267/kimri333_1387156134573VFbvb_JPEG/%B8%D5%C1%F6%B7%CE%C1%F6%C0%BA%C1%FD_%BA%B8%B5%B5%BB%E7%C1%F8_031.JPG?type=w420,2024-07-02T11:57:38.182289,Four people are performing a dance routine with their bodies in motion.,0,0,0,0,0,,2024-08-11T16:13:33.210941
DANCE,KOR,https://encrypted-tbn0.gstatic.com/images?q=tbn:ANd9GcT3GL_RHk338951MJxAjmrIXh2zRVHp8QW0zg&s,2024-07-02T11:57:38.182289,A group of people in identical clothing are standing in a line facing the viewer.,0,0,0,0,0,,2024-08-11T16:13:33.210941
DANCE,KOR,https://encrypted-tbn0.gstatic.com/images?q=tbn:ANd9GcSUgJ5AT8YENoTaKmNovmqPJ6mczeurjh59Xw&s,2024-07-02T11:57:38.182289,"Two figures, one standing and one bending over, are in front of a background of green foliage.",0,0,0,0,0,,2024-08-11T16:13:33.210941
DANCE,KOR,https://img.khan.co.kr/news/2017/09/13/l_2017091401001697700144722.jpg,2024-07-02T11:57:38.182289,Two people are performing a dance routine on a tiled floor.,0,0,0,0,0,,2024-08-11T16:13:33.210941
DANCE,KOR,https://www.kyeongin.com/mnt/file/202403/2024040101000003500035291.jpg?20240331072609,2024-07-02T11:57:38.182289,A group of people in white clothing are dancing on a stage with red and white lights.,0,0,0,0,0,,2024-08-11T16:13:33.210941
DANCE,KOR,https://lh5.googleusercontent.com/proxy/yHg7fZ_HPPZukBMeH6WtG02iQFfgQQY4nVWB6TKJ8X4ebuyKPGHoDGfzlvj6KgHgPQCGxfp7rzEQvaQSUj8UbOZK25Cz_pHCCmlf58G6oFZbsZc,2024-07-02T11:57:38.182289,A person in a long garment is performing a dance pose.,0,0,0,0,0,,2024-08-11T16:13:33.210941
DANCE,KOR,https://encrypted-tbn0.gstatic.com/images?q=tbn:ANd9GcTHZFwcsG2rwx6MDJihzDS3jBrSMdO6pDBEmA&s,2024-07-02T11:57:38.182289,"A figure in white clothing is lying on a white surface, leaving a trail of black liquid behind them.",0,0,0,0,0,,2024-08-11T16:13:33.210941
DANCE,KOR,https://lh6.googleusercontent.com/proxy/Eo2Uw3_Tzgiw620v20CTQ9iyziWUQ7X9aiJZosHFqduPybiFO5TSeowXRH42xfx1rI8A9r4co9K-iy6OIY9GverJRU6UdUZgaddJjp0eHnM,2024-07-02T11:57:38.182289,Two dancers are performing a dramatic pose in a dance studio.,0,0,0,0,0,,2024-08-11T16:13:33.210941
DANCE,KOR,https://encrypted-tbn0.gstatic.com/images?q=tbn:ANd9GcR4jPRyjVc4Vjd5iL_8K91DlSDTMBecdoXNmA&s,2024-07-02T11:57:38.182289,A person walks across a surface with abstract shapes.,0,0,0,0,0,,2024-08-11T16:13:33.210941
DANCE,KOR,https://image.kmib.co.kr/online_image/2023/1130/2023113012461853611_1701315980_0018925332.jpg,2024-07-02T11:57:38.182289,Two people in long robes perform a dance in front of a striped backdrop.,0,0,0,0,0,,2024-08-11T16:13:33.210941
DANCE,KOR,https://img.khan.co.kr/lady/200608/20060804101139_1_jihyoung1.jpg,2024-07-02T11:57:38.182289,A person is dancing while holding a piece of fabric.,0,0,0,0,0,,2024-08-11T16:13:33.210941
DANCE,KOR,https://lh5.googleusercontent.com/proxy/dR34S9RY0qpU5_85HcLGVLb76z1VDRneJbXoCF58m6weLvxxxbm7_Wr-kSYVjALVMLCLGpTZYoYuksY_BVtIzNRBXNSX_Ta0IbVmeohjIHnILEgd,2024-07-02T11:57:38.182289,A person wearing a long robe holds a large fan in their right hand and poses with one leg slightly bent.,0,0,0,0,0,,2024-08-11T16:13:33.210941
DANCE,KOR,https://encrypted-tbn0.gstatic.com/images?q=tbn:ANd9GcTZTPMBPHdKQOdCU7uuUcVpvRry4u6bTahonQ&s,2024-07-02T11:57:38.182289,"Two people in black clothing are posed in a dynamic, contorted stance against a plain background.",0,0,0,0,0,,2024-08-11T16:13:33.210941
DANCE,KOR,https://www.noblesse.com/shop/data/board/magazine/97b6d76eccf431c4,2024-07-02T11:57:38.182289,Two men wearing loose clothing are posed in a dynamic fashion.,0,0,0,0,0,,2024-08-11T16:13:33.210941
DANCE,KOR,https://lh4.googleusercontent.com/proxy/DU8KNyUUW-Q0i0LkKTL0WiDYTC83uU5JCPCjaflUJw5xLtW-ZBx6dfDFHJq0psETraTz8VU-54hnm1-Kg74a9SAz83J_t7rajiP7QUq7Iq0gPiaH,2024-07-02T11:57:38.182289,"A person in a long, flowing garment is performing a dance on a stage.",0,0,0,0,0,,2024-08-11T16:13:33.210941
DANCE,KOR,https://image.newdaily.co.kr/site/data/img/2022/04/07/2022040700050_1.jpg,2024-07-02T11:57:38.182289,Two people in loose clothing dance on a stage.  One holds a sphere.,0,0,0,0,0,,2024-08-11T16:13:33.210941
DANCE,KOR,https://lh6.googleusercontent.com/proxy/Usll8rQZKqG-4-0frXe2nTBH9dcwlbeKxg5brkcpqOgKWVAZzlYFCuKHWgTSGDtvXG6M0WUzL6xeLM1-Tzn4px3UaDJNix5aTxmFJs4YQUQJwSeE,2024-07-02T11:57:38.182289,A person with long hair is in a dance pose wearing a flowing white garment.,0,0,0,0,0,,2024-08-11T16:13:33.210941
DANCE,KOR,https://cdn.news.cauon.net/news/photo/202209/37215_27396_3919.png,2024-07-02T11:57:38.182289,A woman in a flowing white dress with a red sash is performing on stage.,0,0,0,0,0,,2024-08-11T16:13:33.210941
DANCE,KOR,https://www.iptnews.kr/news/photo/201901/225_269_5255.JPG,2024-07-02T11:57:38.182289,"A group of people wearing black are in a room with a mirrored wall, performing synchronized movements.",0,0,0,0,0,,2024-08-11T16:13:33.210941
DANCE,KOR,https://encrypted-tbn0.gstatic.com/images?q=tbn:ANd9GcSfIVJOktf1dVRI46uC1OXHS_xj3T4CPFLZ5A&s,2024-07-02T11:57:38.182289,"A large group of people stand on a stage in front of a seated audience, with a single person standing in front of them on a raised platform.",0,0,0,0,0,,2024-08-11T16:13:33.210941
DANCE,KOR,https://dimg.donga.com/wps/NEWS/IMAGE/2022/10/11/115891916.1.jpg,2024-07-02T11:57:38.182289,Two dancers perform a routine in front of a group of stationary figures.,0,0,0,0,0,,2024-08-11T16:13:33.210941
DANCE,KOR,https://flexible.img.hani.co.kr/flexible/normal/590/395/imgdb/resize/2006/0504/03215149_20060504.JPG,2024-07-02T11:57:38.182289,Three people are posing on a red stage with a branch of white blossoms.,0,0,0,0,0,,2024-08-11T16:13:33.210941
DANCE,KOR,https://cdn.mhns.co.kr/news/photo/202108/509741_615874_1513.jpg,2024-07-02T11:57:38.182289,Two dancers are performing on a stage in front of a green background.,0,0,0,0,0,,2024-08-11T16:13:33.210941
DANCE,KOR,https://cdn.womennews.co.kr/news/photo/202311/242021_398346_5948.jpg,2024-07-02T11:57:38.182289,Two people in white shirts are performing a dance with their arms extended.,0,0,0,0,0,,2024-08-11T16:13:33.210941
DANCE,KOR,https://lh3.googleusercontent.com/proxy/yEcRnXLQS5Fy-RNmk0Vcte9eFvHzfz7IyfBM7rvgkADx26lpR89L8V1AXvrVVtpIeTZtZbNmjkrsxqiKXi3L88oC4yZXthi_luQaW9mIbrItciQ,2024-07-02T11:57:38.182289,Two figures stand in front of a dark background covered in white lines and dots.,0,0,0,0,0,,2024-08-11T16:13:33.210941
DANCE,KOR,https://nimage.g-enews.com/phpwas/restmb_allidxmake.php?idx=5&simg=2021042710390000989e8b8a793f7617354233.jpg,2024-07-02T11:57:38.182289,A person in red and black clothing with a mask is performing on a stage.,0,0,0,0,0,,2024-08-11T16:13:33.210941
DANCE,KOR,https://lh4.googleusercontent.com/proxy/dPYMelqjTYoKYz0FXak2eE02avoy_MyIrIHihV68l8dZ3cRY0Y1FXCrIH_iBQzNQMVz6sa--vFBiKh1bES7cs1ooz9JmLYeBBOkH6UB76iE,2024-07-02T11:57:38.182289,A group of dancers in black clothing pose on a stage.,0,0,0,0,0,,2024-08-11T16:13:33.210941
DANCE,KOR,https://www.noblesse.com/shop/data/m/editor_new/2021/03/05/6540cbf0d76e67064.jpg,2024-07-02T11:57:38.182289,A group of people in white clothing are performing a synchronized dance routine.,0,0,0,0,0,,2024-08-11T16:13:33.210941
FOOD,KOR,https://images.squarespace-cdn.com/content/v1/5c4df9934eddecd2894708b5/1555457381037-QWWNNSZUDA84ERLAQIR9/koreanmom_koreanbapsangtable.jpg,2024-07-02T12:03:49.735071,"A table is set with a variety of dishes, including vegetables, meat, and fish.",0,0,0,0,0,,2024-08-11T16:13:42.728933
FOOD,KOR,https://worldoffoodanddrink.worldtravelguide.net/wp-content/uploads/2018/02/shu-Spicy-Korean-Jukumi-292410686-Ricky-Reardon-1440x823.jpg,2024-07-02T12:03:49.735071,"A table with several bowls of food, including a bowl of seafood with sauce and vegetables.",0,0,0,0,0,,2024-08-11T16:13:42.728933
FOOD,KOR,https://travelexx.com/wp-content/uploads/2018/12/bibimbap.jpg,2024-07-02T12:03:49.735071,"A bowl filled with various vegetables, an egg, and a red paste.",0,0,0,0,0,,2024-08-11T16:13:42.728933
FOOD,KOR,https://geonbae.com/wp-content/uploads/2022/06/sojusamgyeopsal_1200px-1024x683.jpg,2024-07-02T12:03:49.735071,"A table is set with food and drinks, including salad, meat, and vegetables.",0,0,0,0,0,,2024-08-11T16:13:42.728933
FOOD,KOR,https://www.reachtoteachrecruiting.com/images/Korean-food-2.JPG,2024-07-02T12:03:49.735071,"A table is set with a variety of dishes, including a hot pan with food cooking on it, and two plates with raw meat.",0,0,0,0,0,,2024-08-11T16:13:42.728933
FOOD,KOR,https://i.pinimg.com/474x/8d/74/a3/8d74a37a4cd301252ab5db5475fc2602.jpg,2024-07-02T12:03:49.735071,A large spread of food and drinks arranged in a circle on a wooden surface.,0,0,0,0,0,,2024-08-11T16:13:42.728933
FOOD,KOR,https://www.thespruceeats.com/thmb/Ye5m6kgelLAFPguCAVxr4jrFjMI=/1500x0/filters:no_upscale():max_bytes(150000):strip_icc()/GettyImages-856177746-5b49f7c8c9e77c0037184cb6.jpg,2024-07-02T12:03:49.735071,"A bowl of red soup with various shapes of food submerged in it next to a plate of deep-fried, battered food.",0,0,0,0,0,,2024-08-11T16:13:42.728933
FOOD,KOR,https://theculinarytravelguide.com/wp-content/uploads/2018/03/korean-food-207242_1920-1-1024x683.jpg,2024-07-02T12:03:49.735071,"Two long, thin, red-coated fish with white seeds are held by silver chopsticks.",0,0,0,0,0,,2024-08-11T16:13:42.728933
FOOD,KOR,https://worldoffoodanddrink.worldtravelguide.net/wp-content/uploads/sites/3/2018/02/shu-Bibimbap-604838036-Magdanatka-430x246.jpg,2024-07-02T12:03:49.735071,"A bowl contains a variety of chopped vegetables, meat, and a yellow egg.",0,0,0,0,0,,2024-08-11T16:13:42.728933
FOOD,KOR,https://static.independent.co.uk/s3fs-public/thumbnails/image/2017/01/11/16/korean-food-istock-graypink.jpg,2024-07-02T12:03:49.735071,"A bowl of various seafood, vegetables, and noodles with a red sauce.",0,0,0,0,0,,2024-08-11T16:13:42.728933
FOOD,KOR,https://cdn.shopify.com/s/files/1/0613/0437/3481/articles/Korean_food_culture.jpg?v=1678097095,2024-07-02T12:03:49.735071,Various types of food arranged around a round metal grilling surface.,0,0,0,0,0,,2024-08-11T16:13:42.728933
FOOD,KOR,https://asianinspirations.com.au/wp-content/uploads/2020/04/00_KoreanEatingEtiquette_FeatImg.jpg,2024-07-02T12:03:49.735071,A person pours liquid from a bottle into a small glass.,0,0,0,0,0,,2024-08-11T16:13:42.728933
FOOD,KOR,https://www.willflyforfood.net/wp-content/uploads/2018/01/kimchi.jpg,2024-07-02T12:03:49.735071,Several metal bowls filled with various red and white pickled vegetables.,0,0,0,0,0,,2024-08-11T16:13:42.728933
FOOD,KOR,https://theculinarytravelguide.com/wp-content/uploads/2018/03/IMG_3307-1024x768.jpg,2024-07-02T12:03:49.735071,A white bowl filled with a stir-fry of vegetables and meat with a garnish of long green strands.,0,0,0,0,0,,2024-08-11T16:13:42.728933
FOOD,KOR,https://lp-cms-production.imgix.net/2022-09/SouthKorea-neomistyle-GettyImages-182784849-RFC.jpeg?w=1920&auto=format&q=75,2024-07-02T12:03:49.735071,"A white bowl contains layered, fermented food in a red sauce.",0,0,0,0,0,,2024-08-11T16:13:42.728933
FOOD,KOR,https://worldoffoodanddrink.worldtravelguide.net/wp-content/uploads/sites/3/2018/02/shu-Kimchi-salad-with-rice-712852456-naito29-430x246.jpg,2024-07-02T12:03:49.735071,"A white plate holds a pile of red, white, and green food.",0,0,0,0,0,,2024-08-11T16:13:42.728933
FOOD,KOR,"https://media.cnn.com/api/v1/images/stellar/prod/181115110418-korean-food041200802001k-nakji-bokkeumstri-fried-small-octopus.jpg?q=w_1110,c_fill",2024-07-02T12:03:49.735071,A wooden table is set with four plates of different foods.,0,0,0,0,0,,2024-08-11T16:13:42.728933
FOOD,KOR,https://images.immediate.co.uk/production/volatile/sites/30/2023/03/Top-10-foods-to-try-in-South-Korea-9c8e1d1.jpg,2024-07-02T12:03:49.735071,"Two bowls of rice, vegetables, and a fried egg topped with red sauce.",0,0,0,0,0,,2024-08-11T16:13:42.728933
FOOD,KOR,https://www.topasiatour.com/pic/korea/guide/Topokki.jpg,2024-07-02T12:03:49.735071,A white plate filled with orange and white noodles topped with white seeds.,0,0,0,0,0,,2024-08-11T16:13:42.728933
FOOD,KOR,https://theculinarytravelguide.com/wp-content/uploads/2018/03/IMG_3337-1024x768.jpg,2024-07-02T12:03:49.735071,"A thin, crispy, pan-fried dish with green bits is on a blue plate.",0,0,0,0,0,,2024-08-11T16:13:42.728933
FOOD,KOR,https://lh4.googleusercontent.com/proxy/NSLxaqT58DG5tJCHT9yd7Epcn4HpNC8gCUsles22ptEtDhrQv67FZ3sfqkuv36NCzc4_4XzdjluAZL5Xteb_O7KRcs2z,2024-07-02T12:03:49.735071,A wooden table with food and dishes sits on a mat surrounded by cushions.,0,0,0,0,0,,2024-08-11T16:13:42.728933
FOOD,KOR,https://www.thespruceeats.com/thmb/TBzwlrEB281qvznqBFHGRiSgtfQ=/1500x0/filters:no_upscale():max_bytes(150000):strip_icc()/ojinguhbokum-1-56a579aa5f9b58b7d0dd1bb2.JPG,2024-07-02T12:03:49.735071,"A large pan is filled with a mixture of cooked vegetables, meat and leaves.",0,0,0,0,0,,2024-08-11T16:13:42.728933
FOOD,KOR,https://lp-cms-production.imgix.net/2022-09/SouthKorea-iStock-1068265532-RFC.jpeg?w=1920&auto=format&q=75,2024-07-02T12:03:49.735071,"A tray with a dish of food, another bowl of food, a bottle, and chopsticks.",0,0,0,0,0,,2024-08-11T16:13:42.728933
FOOD,KOR,"https://media.cnn.com/api/v1/images/stellar/prod/181115110106-korean-food131201112017k-tteokbokki.jpg?q=w_1110,c_fill",2024-07-02T12:03:49.735071,"A plate of red, rectangular food items topped with white dots sits on a woven mat.",0,0,0,0,0,,2024-08-11T16:13:42.728933
FOOD,KOR,https://i0.wp.com/thesoulofseoul.net/wp-content/uploads/2019/03/IMG_1345-2.jpg?fit=800%2C600&ssl=1,2024-07-02T12:03:49.735071,A table is set with various dishes including a white plate with meat and white sticks.,0,0,0,0,0,,2024-08-11T16:13:42.728933
FOOD,KOR,https://www.chuseok.info/static/432b41d82d8839da6748cdec36ac7bd6/47498/drink-hero.jpg,2024-07-02T12:03:49.735071,"A hand holds a white bowl with red liquid and white pieces on top, on a white saucer.",0,0,0,0,0,,2024-08-11T16:13:42.728933
FOOD,KOR,https://worldoffoodanddrink.worldtravelguide.net/wp-content/uploads/sites/3/2018/02/shu-Bulgogi-beef-slices-fried_sesame_carrot-323834555-AS-Food-studio-430x246.jpg,2024-07-02T12:03:49.735071,"A plate of thinly sliced meat, vegetables, and sesame seeds.",0,0,0,0,0,,2024-08-11T16:13:42.728933
FOOD,KOR,https://korea.stripes.com/food-drink/0512_kimchis.jpg/alternates/LANDSCAPE_910/korea-81763,2024-07-02T12:03:49.735071,Several small bowls of different food are arranged on a wooden table.,0,0,0,0,0,,2024-08-11T16:13:42.728933
FOOD,KOR,https://images.immediate.co.uk/production/volatile/sites/30/2023/03/Top-10-foods-to-try-in-South-Korea-9c8e1d1.jpg?resize=1200%2C630,2024-07-02T12:03:49.735071,Two bowls of food with a red sauce on the side.,0,0,0,0,0,,2024-08-11T16:13:42.728933
FOOD,KOR,https://www.livingthedreamrtw.com/wp-content/uploads/2019/12/DSC08381-600px-600x338.jpg,2024-07-02T12:03:49.735071,"There are multiple plates with different types of food, including dumplings, soup, and small portions of other ingredients.",0,0,0,0,0,,2024-08-11T16:13:42.728933
FOOD,KOR,"https://media.cnn.com/api/v1/images/stellar/prod/150813135423-korea-food-map-bibimbap.jpg?q=w_1110,c_fill",2024-07-02T12:03:49.735071,A bowl of food contains a variety of colorful ingredients arranged in a circular pattern.,0,0,0,0,0,,2024-08-11T16:13:42.728933
FOOD,KOR,https://www.transitionsabroad.com/listings/living/articles/images/south-korea-food-drink.jpg,2024-07-02T12:03:49.735071,Multiple bowls of food are arranged on a dark surface.,0,0,0,0,0,,2024-08-11T16:13:42.728933
FOOD,KOR,https://media.cntraveler.com/photos/53daa054dcd5888e145c1743/master/pass/korea-dinner-primer.jpg,2024-07-02T12:03:49.735071,"A table with multiple dishes of food, including a steaming bowl of stew.",0,0,0,0,0,,2024-08-11T16:13:42.728933
FOOD,KOR,"https://media.cnn.com/api/v1/images/stellar/prod/111015065745-korea-drinks.jpg?q=w_1110,c_fill",2024-07-02T12:03:49.735071,A hand pours a dark liquid from a bottle into a glass.,0,0,0,0,0,,2024-08-11T16:13:42.728933
FOOD,KOR,https://encrypted-tbn0.gstatic.com/images?q=tbn:ANd9GcSj43X1LEBTxkRqXB4fzLfMQtL-dH2dZ3tkvg&s,2024-07-02T12:03:49.735071,"A table set for a meal with seafood, bread, and a glass of wine is situated by a body of water and forested hills.",0,0,0,0,0,,2024-08-11T16:13:42.728933
FOOD,KOR,https://recipe1.ezmember.co.kr/cache/recipe/2020/01/29/c3e7a00d968285dcb660695330ed33411.jpg,2024-07-02T12:13:28.690599,A clear bowl holds a light brown liquid with two small beige shapes and one reddish-brown object floating inside.,0,0,0,0,0,,2024-08-11T16:13:42.728933
FOOD,KOR,https://cdn.crowdpic.net/detail-thumb/thumb_d_6ADE995F20EA324D367293DACD524CA8.jpeg,2024-07-02T12:13:28.690599,A bowl of brown liquid with white and brown pieces and ice cubes.,0,0,0,0,0,,2024-08-11T16:13:42.728933
FOOD,KOR,https://recipe1.ezmember.co.kr/cache/recipe/2020/01/16/3244042eaf2a52dbe684bd1127b771361.jpg,2024-07-02T12:13:28.690599,A bowl of red liquid with small white objects on top is situated on a wooden tray.,0,0,0,0,0,,2024-08-11T16:13:42.728933
FOOD,KOR,https://www.krpia.co.kr/public-img/content/thum/286003/PLCT00005783.png,2024-07-02T12:13:28.690599,A bowl of dark liquid with light-colored seeds on top sits on a saucer with additional dried fruit nearby.,0,0,0,0,0,,2024-08-11T16:13:42.728933
FOOD,KOR,https://encrypted-tbn0.gstatic.com/images?q=tbn:ANd9GcTpPgXbd4mLybvTKIyFOGjpRTW0aiQYiBWIzA&s,2024-07-02T12:13:28.690599,Four different beverages in clear plastic cups with ice and toppings are arranged on a table.,0,0,0,0,0,,2024-08-11T16:13:42.728933
FOOD,KOR,https://gopatshu.com/wp-content/uploads/2020/12/groupfood-1024x683.jpg,2024-07-02T12:13:28.690599,Various foods and drinks are arranged on a wooden surface.,0,0,0,0,0,,2024-08-11T16:13:42.728933
FOOD,KOR,https://i.namu.wiki/i/b2U9ZGSKF76RyLb-E_jdaH9vlhgWqSohlyJlHD_J7eEllHhoO5C9OtQPwSOnEnyudRBn0XUHpS10SEnyZLUbUg.webp,2024-07-02T12:13:28.690599,"A bowl of food with an egg, vegetables, and sauce, a small bowl of food, and chopsticks and a spoon are on a wooden surface.",0,0,0,0,0,,2024-08-11T16:13:42.728933
FOOD,KOR,https://encrypted-tbn0.gstatic.com/images?q=tbn:ANd9GcQKuLP7B9DPR4_gr4X9hs0O4ZsOZuB6KFjW-A&s,2024-07-02T12:13:28.690599,"A round, metal pan has pieces of meat and white bulbs cooking over a flame.",0,0,0,0,0,,2024-08-11T16:13:42.728933
FOOD,KOR,https://encrypted-tbn0.gstatic.com/images?q=tbn:ANd9GcQNZIYrb__sAQh0rGEoxPKtyrbX45Eb-tnOcA&s,2024-07-02T12:13:28.690599,A white bowl contains a mound of white grains.,0,0,0,0,0,,2024-08-11T16:13:42.728933
FOOD,KOR,https://upload.wikimedia.org/wikipedia/commons/f/f4/Han-jeongsik.jpg,2024-07-02T12:13:28.690599,A table with many plates of various types of food.,0,0,0,0,0,,2024-08-11T16:13:42.728933
