category_code,country_code,url,created_at,caption,category_score,country_score,stereotype_score,offensiveness_score,contributors_cnt,contributors,updated_at
NATUR,KOR,https://encrypted-tbn0.gstatic.com/images?q=tbn:ANd9GcQi7LEov2TRS_eixaQY5Lm864D45byS8VbG6A&s,2024-07-02T12:27:12.212095,A shallow stream flows through a rocky valley surrounded by lush greenery.,0,0,0,0,0,,2024-08-11T16:13:48.536614
NATUR,KOR,https://encrypted-tbn0.gstatic.com/images?q=tbn:ANd9GcTE038tWHMr24tWeQyuCF1LTj-gC-cK1gxLpg&s,2024-07-02T12:27:12.212095,A valley with several bodies of water and green hills in the background.,0,0,0,0,0,,2024-08-11T16:13:48.536614
NATUR,KOR,https://encrypted-tbn0.gstatic.com/images?q=tbn:ANd9GcQeek5F4_DE622Tav7APT3LRjq2VibifFO4ew&s,2024-07-02T12:27:12.212095,A paved path winds through a park with red trees and a mountain range in the background.,0,0,0,0,0,,2024-08-11T16:13:48.536614
NATUR,KOR,https://www.00news.co.kr/news/photo/201407/4505_90318_1432.jpg,2024-07-02T12:27:12.212095,Two people are in a small boat on a body of water inside a cave with rocky walls and a water-filled ceiling.,0,0,0,0,0,,2024-08-11T16:13:48.536614
NATUR,KOR,https://encrypted-tbn0.gstatic.com/images?q=tbn:ANd9GcSJI10qnq0nxsUZQaMwkBjlSKCSvtV3jKVpTQ&s,2024-07-02T12:27:12.212095,A rocky island with a jagged peak rises out of a body of water.,0,0,0,0,0,,2024-08-11T16:13:48.536614
NATUR,KOR,https://lh4.googleusercontent.com/proxy/oseNg9NLFloHBPLKY8RicmNgV6mhkXa8PB-pt3yYWDMzjJHGJMUL9TbQf_kUResyslubVuzVSytOmyr2JrDHzrb_9KGjEaxV1aMwW-UTrrpLkBSX,2024-07-02T12:27:12.212095,A field of yellow flowers is in the foreground with a large island in the background.,0,0,0,0,0,,2024-08-11T16:13:48.536614
NATUR,KOR,https://cdn.hankyung.com/photo/202210/AA.31541647.1.jpg,2024-07-02T12:27:12.212095,"A winding road leads through a dense forest with trees in various shades of yellow, red, and green.",0,0,0,0,0,,2024-08-11T16:13:48.536614
PEOPLE,KOR,https://images.summitmedia-digital.com/cosmo/images/2024/02/29/action-k-dramas-a4436-20220819-lfrm-1709205752.jpg,2024-07-02T12:35:11.054079,"Three people are shown, two are yelling with their mouths open, one is looking seriously to the side.",0,0,0,0,0,,2024-08-11T16:13:55.905818
PEOPLE,KOR,https://i.insider.com/5e5f8f08fee23d6d3953cca4?width=700,2024-07-02T12:35:11.054079,A group of people in white protective suits with red hoses walk across a street.,0,0,0,0,0,,2024-08-11T16:13:55.905818
PEOPLE,KOR,https://variety.com/wp-content/uploads/2023/07/Smugglers-90cbef1bf4084ca7b00151fb0dff6077-cr-res.jpg?w=1000&h=563&crop=1,2024-07-02T12:35:11.054079,"Six people are seated in a boat on the water, repairing fishing nets.",0,0,0,0,0,,2024-08-11T16:13:55.905818
PEOPLE,KOR,https://www.denofgeek.com/wp-content/uploads/2022/09/Best-Korean-Action-Movies.jpg?fit=1200%2C675,2024-07-02T12:35:11.054079,"Four people are pictured, all with serious expressions and wearing dark clothing.",0,0,0,0,0,,2024-08-11T16:13:55.905818
PEOPLE,KOR,https://d1nslcd7m2225b.cloudfront.net/Pictures/480xany/5/9/9/1424599_escape_778364.jpg,2024-07-02T12:35:11.054079,"Two men stand facing each other, one with dirt on his face.",0,0,0,0,0,,2024-08-11T16:13:55.905818
PEOPLE,KOR,https://www.peaceaction.org/wp-content/uploads/2018/02/winter_2014_candidate_city-_pyeongchang_olympic_village-1.jpg,2024-07-02T12:35:11.054079,A large group of people stand around the perimeter of a large blue shape on a white surface.,0,0,0,0,0,,2024-08-11T16:13:55.905818
PEOPLE,KOR,https://i.guim.co.uk/img/media/bd8b091889cf165fa41f5a2fbd92f69241f2e11d/0_600_4000_2400/master/4000.jpg?width=465&dpr=1&s=none,2024-07-02T12:35:11.054079,A large piece of machinery is partially submerged in water with multiple people standing in the water around it.,0,0,0,0,0,,2024-08-11T16:13:55.905818
PEOPLE,KOR,https://lh4.googleusercontent.com/proxy/knKg9gKOB9Jw6TIk45DA4YepP6QQJP0BDLToyxI475U-qy_8-amaSASZNLLznwIBsL1WTmL1fC3AiJsCqcb3BlNFK8p-elgiEN_Ooud8O5vRkcg1Jr4BVltRpUi-CcbPY9gPmUTj,2024-07-02T12:35:11.054079,A group of people are walking across a street with black and white markings.,0,0,0,0,0,,2024-08-11T16:13:55.905818
PEOPLE,KOR,https://www.aljazeera.com/wp-content/uploads/2023/08/33RE2WP-highres-1692320427.jpg?resize=770%2C513&quality=80,2024-07-02T12:35:11.054079,"A large room with a circular table and many seats, featuring a screen displaying a person in front of a large group of people.",0,0,0,0,0,,2024-08-11T16:13:55.905818
PEOPLE,KOR,https://encrypted-tbn0.gstatic.com/images?q=tbn:ANd9GcSzlKFR_vu6q2shuxzNjpEk9tsGVSIh58NhqA&s,2024-07-02T12:35:11.054079,A line of figures stands holding hands with a different figure standing between them.,0,0,0,0,0,,2024-08-11T16:13:55.905818
PEOPLE,KOR,https://media.wired.com/photos/5a84d88eab6b9732a8555cf0/master/w_2560%2Cc_limit/NKHacking-TA-916128992.jpg,2024-07-02T12:35:11.054079,A group of people in white clothing hold a flag with a blue silhouette on it.,0,0,0,0,0,,2024-08-11T16:13:55.905818
PEOPLE,KOR,https://warlord-community.warlordgames.com/wp-content/uploads/2024/03/Chinese-Peoples-Volunteer-Army-Article-Header.jpg,2024-07-02T12:35:11.054079,A group of figures with weapons are positioned in a field of greenery.,0,0,0,0,0,,2024-08-11T16:13:55.905818
PEOPLE,KOR,https://www.militarytimes.com/resizer/dCeAO4Pm9lldpjdf8bS-nTfw55Q=/1024x0/filters:format(jpg):quality(70)/cloudfront-us-east-1.images.arcpublishing.com/archetype/MGJXYFPSHJHYPAAXRVBGBYB7YY.jpg,2024-07-02T12:35:11.054079,A group of people in uniform are carrying a covered object.,0,0,0,0,0,,2024-08-11T16:13:55.905818
PEOPLE,KOR,https://lh6.googleusercontent.com/proxy/vLACz7NEitJUzpI7PlVdwboK6XUiVTbkHMgIF5cVXy4s4gAA1bFKXHj2JWe5pkQWxpISf239lpOUS1aWfJulRgztDPp8ipEjpEFet1F6Xwvy9jTALQfvOAM32wtZRPeiGNHC,2024-07-02T12:35:11.054079,A large group of people holding signs are standing in a hallway.,0,0,0,0,0,,2024-08-11T16:13:55.905818
PEOPLE,KOR,"https://img.thedailybeast.com/image/upload/c_crop,d_placeholder_euli9k,h_217,w_387,x_0,y_0/dpr_1.5/c_limit,w_690/fl_lossy,q_auto/v1/articles/2010/11/23/north-koreas-attack-on-south-korea-leslie-h-gelb-on-the-prospects-for-war/gelb-korea_143206_z47c8t",2024-07-02T12:35:11.054079,A group of people stand on a boat looking at a large plume of smoke in the distance.,0,0,0,0,0,,2024-08-11T16:13:55.905818
PEOPLE,KOR,https://foreignpolicy.com/wp-content/uploads/2023/05/SOUTHKOREA-FILM-GettyImages-1258157693.png?w=800?quality=90,2024-07-02T12:35:11.054079,A man in a white shirt and a scarf is smiling and holding a pair of sunglasses in one hand.,0,0,0,0,0,,2024-08-11T16:13:55.905818
PEOPLE,KOR,https://newsimg-hams.hankookilbo.com/2022/06/10/a4a477bb-632e-4d3a-91f6-4ae028953377.jpg,2024-07-02T12:45:25.805843,Three young men are smiling and laughing while seated at a table.,0,0,0,0,0,,2024-08-11T16:13:55.905818
PEOPLE,KOR,https://www.dailydental.co.kr/data/photos/20191146/art_157378196108_8eecf9.jpg,2024-07-02T12:45:25.805843,A man with short black hair is smiling and wearing a white coat with a patterned tie.,0,0,0,0,0,,2024-08-11T16:13:55.905818
PEOPLE,KOR,https://monthly.chosun.com/upload/1802/1802_042.jpg,2024-07-02T12:45:25.805843,A man with dark hair is wearing a dark jacket and a light shirt while looking to the right.,0,0,0,0,0,,2024-08-11T16:13:55.905818
PEOPLE,KOR,https://m.segye.com/content/image/2024/04/03/20240403519033.jpg,2024-07-02T12:45:25.805843,"Two people are sitting inside a vehicle, one is driving and the other is looking out of the window.",0,0,0,0,0,,2024-08-11T16:13:55.905818
PEOPLE,KOR,https://img.freepik.com/free-photo/japan-teenager-person-having-fun-in-the-city_23-2149265153.jpg,2024-07-02T12:45:25.805843,A person with long dark hair is wearing a black leather jacket and smiling.,0,0,0,0,0,,2024-08-11T16:13:55.905818
PEOPLE,KOR,https://i.namu.wiki/i/Ca6va7jzRRBsa1id5X3YayAYlLplt_sec6SdJGe7U01uNJk3eLu0QxmhzL3n3B3rhYPvTK4qxeVx76JryBZ3jQ.webp,2024-07-02T12:45:25.805843,A person in dark clothing stands in front of a falling water curtain.,0,0,0,0,0,,2024-08-11T16:13:55.905818
PEOPLE,KOR,https://www.futurekorea.co.kr/news/photo/202102/145791_150236_614.jpg,2024-07-02T12:45:25.805843,A man wearing a dark suit and white shirt is speaking.,0,0,0,0,0,,2024-08-11T16:13:55.905818
PEOPLE,KOR,https://img.freepik.com/free-photo/people-traveling-without-covid-worries_23-2149051623.jpg,2024-07-02T12:45:25.805843,A young woman with long dark hair smiles in front of a blurred background.,0,0,0,0,0,,2024-08-11T16:13:55.905818
PEOPLE,KOR,https://encrypted-tbn0.gstatic.com/images?q=tbn:ANd9GcSI2RUCzB7CeuoKTawGr4DQQg66ypTz5B2V5w&s,2024-07-02T12:45:25.805843,"A group of bronze figures depicting soldiers charging forward with weapons in hand, with flags flying in the background.",0,0,0,0,0,,2024-08-11T16:13:55.905818
PEOPLE,KOR,https://encrypted-tbn0.gstatic.com/images?q=tbn:ANd9GcQkLSo5Srmcx5GmaASh2WDHglVUUXY8zN2Zlw&s,2024-07-02T12:45:25.805843,"A world map shows different shades of blue in certain countries, while the rest are grey.",0,0,0,0,0,,2024-08-11T16:13:55.905818
PEOPLE,KOR,"https://hips.hearstapps.com/hmg-prod/images/aaaabfqk48dkvpyc5-qezxfymeqcpfxhjknp-dwjve-6kiufgnntf-tmrhxyhezbtxutrsyhct-iukrh1pbyaupwfb-f-clslpz9hlyj-659dc70320f68.jpeg?crop=0.564xw:1.00xh;0.220xw,0&resize=640:*",2024-07-02T12:45:25.805843,Three people are holding guns and looking cautiously at something off-screen.,0,0,0,0,0,,2024-08-11T16:13:55.905818
PEOPLE,KOR,https://6.soompi.io/wp-content/uploads/image/park-seo-joon-han-hyo-joo-yoo-teo.jpg?s=900x600&e=t,2024-07-02T12:45:25.805843,"Three people are pictured, one woman and two men, facing the camera.",0,0,0,0,0,,2024-08-11T16:13:55.905818
PEOPLE,KOR,https://www.pinkvilla.com/images/2023-10/453393439_handsome-korean-actors.jpg,2024-07-02T12:45:25.805843,Three men in formal attire pose for photographs.,0,0,0,0,0,,2024-08-11T16:13:55.905818
PEOPLE,KOR,https://assets.editorial.aetnd.com/uploads/2009/11/korean-war-gettyimages-514954082.jpg,2024-07-02T12:45:25.805843,A group of people in uniform walk along a dirt road.,0,0,0,0,0,,2024-08-11T16:13:55.905818
PEOPLE,KOR,https://s23209.pcdn.co/wp-content/uploads/2013/07/Korean-Beef-Bowl_111.jpg,2024-07-02T12:45:25.805843,"A bowl of white grains topped with brown bits, green pieces, and white seeds.",0,0,0,0,0,,2024-08-11T16:13:55.905818
RELIG,KOR,https://www2.buddhistdoor.net/upload/file/20210104/26625/258fcca3bc12b3b5c05ac90139aec5d3_715__2.jpg,2024-07-02T12:55:17.382620,A group of children are holding paper lanterns that depict people with their hands clasped together.,0,0,0,0,0,,2024-08-11T16:14:11.244423
RELIG,KOR,https://www.buddhistchannel.tv/picture/upload/kr-lantern(1).jpg,2024-07-02T12:55:17.382620,"A large group of people are walking in a procession, holding brightly colored illuminated objects.",0,0,0,0,0,,2024-08-11T16:14:11.244423
RELIG,KOR,https://encrypted-tbn0.gstatic.com/images?q=tbn:ANd9GcQAgygbqIIjJ9Wz1ngjgjZoDb8cxA9et4G0AQ&s,2024-07-02T12:55:17.382620,"A canopy of colorful, decorated paper lanterns hangs over a group of people.",0,0,0,0,0,,2024-08-11T16:14:11.244423
RELIG,KOR,https://newsroom.korea.net/upload/content/editImage/20230518141629471_CI7J7IAU.jpg,2024-07-02T12:55:17.382620,Two people stand in front of a table adorned with objects and a floral screen.,0,0,0,0,0,,2024-08-11T16:14:11.244423
RELIG,KOR,https://res.heraldm.com/content/image/2020/12/17/20201217000145_0.jpg,2024-07-02T12:55:17.382620,People in colorful clothing hold glowing crescent-shaped objects.,0,0,0,0,0,,2024-08-11T16:14:11.244423
RELIG,KOR,https://res.heraldm.com/content/image/2022/05/27/20220527000155_0.jpg,2024-07-02T12:55:17.382620,A group of people in red robes are performing a ceremony in front of a traditional building.,0,0,0,0,0,,2024-08-11T16:14:11.244423
RELIG,KOR,https://assets.isu.pub/document-structure/230109220303-65bba908ffdd37d533a79e12cda4fa53/v1/f21a3ab435a2441f4177361a6e4ef6af.jpeg,2024-07-02T12:55:17.382620,People are performing a traditional dance in a courtyard.,0,0,0,0,0,,2024-08-11T16:14:11.244423
RELIG,KOR,https://www.thoughtco.com/thmb/qB0QGPXkkDKyhz7dKQdDic8Ckh0=/1500x0/filters:no_upscale():max_bytes(150000):strip_icc()/KoreanFolkDanceMultidashbitsviaGetty-56a042f83df78cafdaa0b919.jpg,2024-07-02T12:55:17.382620,A group of people in ornate clothing and large feathered fans are performing in front of a building.,0,0,0,0,0,,2024-08-11T16:14:11.244423
RELIG,KOR,https://img.youtube.com/vi/A-wywPUMX0M/0.jpg,2024-07-02T12:55:17.382620,Two children are holding a colorful paper flower.,0,0,0,0,0,,2024-08-11T16:14:11.244423
RELIG,KOR,https://www.90daykorean.com/wp-content/uploads/2019/06/bigstock-Seoul-South-Korea-June-378364846-1024x683.jpg,2024-07-02T12:55:17.382620,"Three people are playing musical instruments in colorful, traditional attire.",0,0,0,0,0,,2024-08-11T16:14:11.244423
RELIG,KOR,https://encrypted-tbn0.gstatic.com/images?q=tbn:ANd9GcShXWgBzgODkOOaXocaxFvaKIYRbtNkcpRUNg&s,2024-07-02T12:55:17.382620,"Many colorful, round objects are strung together in rows above a group of people gathered in a courtyard.",0,0,0,0,0,,2024-08-11T16:14:11.244423
RELIG,KOR,https://www.kocis.go.kr/CONTENTS/menu0242/lang002/listImage/1669336637154.jpg,2024-07-02T12:55:17.382620,"People are gathered in a courtyard with various foods, decorations, and people in traditional clothing.",0,0,0,0,0,,2024-08-11T16:14:11.244423
RELIG,KOR,https://images.squarespace-cdn.com/content/v1/581ff5eef5e231b25f9c12db/1543537226281-UQ53N0995B7O78KDOOWK/image-asset.jpeg,2024-07-02T12:55:17.382620,Two people wearing masks and elaborate costumes are performing in front of a large crowd.,0,0,0,0,0,,2024-08-11T16:14:11.244423
RELIG,KOR,https://upload.wikimedia.org/wikipedia/commons/b/b1/Middle_Class_in_Joseon.jpg,2024-07-02T12:55:17.382620,A group of people in long robes are gathered around a table.,0,0,0,0,0,,2024-08-11T16:14:11.244423
RELIG,KOR,https://cdn.ubitto.com/mcontent/uploads/2021/07/Blog-Thumbnail-1.png,2024-07-02T12:55:17.382620,A person wearing a red hat and colorful clothing holds two dolls with painted faces.,0,0,0,0,0,,2024-08-11T16:14:11.244423
RELIG,KOR,https://thesun.my/binrepository/portugal-vatican-pope-religion-wyd-093811_3361639_20230806192622.jpg,2024-07-02T12:55:17.382620,A group of people are holding flags and cheering.,0,0,0,0,0,,2024-08-11T16:14:11.244423
RELIG,KOR,https://washingtondc.korean-culture.org/upload/content/editImage/Religion_Korean_Life_01.jpg,2024-07-02T12:55:17.382620,A brick building with a tall tower and a paved courtyard.,0,0,0,0,0,,2024-08-11T16:14:11.244423
RELIG,KOR,https://www.buddhistdoor.net/upload/file/20210104/26629/4bce694b2c763d7c7c15d6dd119d6e49_715__2.jpg,2024-07-02T12:55:17.382620,Two people in robes pour liquid onto a large display of flowers and greenery.,0,0,0,0,0,,2024-08-11T16:14:11.244423
RELIG,KOR,https://preview.redd.it/daily-post-about-south-korea-3-did-you-know-that-christians-v0-kaj8b8ufc6ub1.jpg?width=640&crop=smart&auto=webp&s=4b9b22f53687d0470f011d6472b3ba3f0af8c6a9,2024-07-02T12:55:17.382620,A man in a white robe addresses a large crowd gathered in front of several tall buildings.,0,0,0,0,0,,2024-08-11T16:14:11.244423
RELIG,KOR,https://api.time.com/wp-content/uploads/2024/03/360_christmasnkorea_1216.jpg,2024-07-02T12:55:17.382620,A group of people wearing similar clothing and head coverings sing while looking at books.,0,0,0,0,0,,2024-08-11T16:14:11.244423
RELIG,KOR,https://kccuk.org.uk/media/images/Religion_4.width-840.jpg,2024-07-02T12:55:17.382620,"A large room with arched ceilings, rows of seats, and many pillars.",0,0,0,0,0,,2024-08-11T16:14:11.244423
RELIG,KOR,https://i0.wp.com/hallyuism.com/wp-content/uploads/2023/12/image-31.png?resize=966%2C626&ssl=1,2024-07-02T12:55:17.382620,A building with a doorway and stairs has many colorful paper lanterns hanging from the ceiling above.,0,0,0,0,0,,2024-08-11T16:14:11.244423
RELIG,KOR,https://encrypted-tbn0.gstatic.com/images?q=tbn:ANd9GcQq4IAblW6YYJLgXtaZvoBHFe6Hega0wFK_UA&s,2024-07-02T12:55:17.382620,Three statues of seated figures are illuminated in front of a building at night.,0,0,0,0,0,,2024-08-11T16:14:11.244423
RELIG,KOR,https://encrypted-tbn0.gstatic.com/images?q=tbn:ANd9GcQPdR3GS8jDLNUM4McZYRjaH4m8XF1ZUa57Xg&s,2024-07-02T12:55:17.382620,"A procession of illuminated, fantastical figures moves through a city street at night.",0,0,0,0,0,,2024-08-11T16:14:11.244423
RELIG,KOR,https://ich.unesco.org/img/photo/thumb/13184-BIG.jpg,2024-07-02T12:55:17.382620,A crowd of people are holding illuminated paper lanterns.,0,0,0,0,0,,2024-08-11T16:14:11.244423
RELIG,KOR,https://washingtondc.korean-culture.org/upload/content/editImage/Religion_Korean_Life_04.jpg,2024-07-02T12:55:17.382620,A white building with a tall tower on one side and a smaller dome on the other.,0,0,0,0,0,,2024-08-11T16:14:11.244423
RELIG,KOR,https://media.npr.org/assets/img/2021/03/09/3493498-kuhn-313_slide-6ee16695b02b35aedc44e4c09457fbb7ea0ba094.jpg?s=1100&c=50&f=jpeg,2024-07-02T12:55:17.382620,A structure with a roof and colorful lanterns is surrounded by people and rocks.,0,0,0,0,0,,2024-08-11T16:14:11.244423
RELIG,KOR,https://asiasociety.org/sites/default/files/styles/1200w/public/F/fish.jpg,2024-07-02T12:55:17.382620,A plate of fried food with different shapes and textures.,0,0,0,0,0,,2024-08-11T16:14:11.244423
RELIG,KOR,https://www.90daykorean.com/wp-content/uploads/2016/05/bigstock-Seoul-May-Participants-257023855-1024x652.jpg,2024-07-02T12:55:17.382620,People in colorful clothing and holding lanterns are walking on a wet street.,0,0,0,0,0,,2024-08-11T16:14:11.244423
RELIG,KOR,https://www.color-meanings.com/wp-content/uploads/traditional-korean-wedding-gowns.jpeg,2024-07-02T12:55:17.382620,"Two people in long dresses stand near a pond with a building in the background, surrounded by trees with colorful leaves.",0,0,0,0,0,,2024-08-11T16:14:11.244423
RELIG,KOR,https://overseas.mofa.go.kr/upload/se2/fe595c51-8bc6-4383-88d9-5604e1435635.jpg,2024-07-02T12:55:17.382620,A person wearing a white and colorful robe performs a dance in front of a wall decorated with pictures.,0,0,0,0,0,,2024-08-11T16:14:11.244423
RELIG,KOR,https://encrypted-tbn0.gstatic.com/images?q=tbn:ANd9GcSiqgwN9jXboL94L8onTPN2aDvjmDiV1idM4Q&s,2024-07-02T13:03:06.284914,"A group of eight men in different attire stand together, some holding hands, while two people photograph them.",0,0,0,0,0,,2024-08-11T16:14:11.244423
RELIG,KOR,https://encrypted-tbn0.gstatic.com/images?q=tbn:ANd9GcQX94plypxTowA2GNeqsYEF7qoJSQ87DkGk8w&s,2024-07-02T13:03:06.284914,A group of people walk past a large display of colorful lanterns hanging in a courtyard.,0,0,0,0,0,,2024-08-11T16:14:11.244423
RELIG,KOR,https://encrypted-tbn0.gstatic.com/images?q=tbn:ANd9GcTjE81YF29JcDFwZTk76ISPWZXRgJx9MdiIPw&s,2024-07-02T13:03:06.284914,"A group of people are gathered around a table, with a woman in a long white robe and a headscarf interacting with a child.",0,0,0,0,0,,2024-08-11T16:14:11.244423
RELIG,KOR,https://encrypted-tbn0.gstatic.com/images?q=tbn:ANd9GcQbitjeBrjBs8_ccR61zSdyGTRrCuIUkAZcGA&s,2024-07-02T13:03:06.284914,A group of men in formal attire stand in front of a large backdrop and place their hands on a round table.,0,0,0,0,0,,2024-08-11T16:14:11.244423
RELIG,KOR,https://encrypted-tbn0.gstatic.com/images?q=tbn:ANd9GcShk10bK0b3YDj--ibIP7vTfxyQXlETtkC_WQ&s,2024-07-02T13:03:06.284914,"A large crowd of people gather in a street lined with lights, with a structure in the background.",0,0,0,0,0,,2024-08-11T16:14:11.244423
RELIG,KOR,https://encrypted-tbn0.gstatic.com/images?q=tbn:ANd9GcRqbOid5TgLc4cg6iXDDpKYPXxZGVjOh9F-Kg&s,2024-07-02T13:03:06.284914,A large group of people pose for a photo in front of a traditional structure.,0,0,0,0,0,,2024-08-11T16:14:11.244423
RELIG,KOR,https://encrypted-tbn0.gstatic.com/images?q=tbn:ANd9GcSdyOg7BZyB_dzy3CBcwiplOXZMAUvqo0KYAw&s,2024-07-02T13:03:06.284914,"A group of people are gathered in front of a building with a large structure on top, surrounded by a large lawn and trees.",0,0,0,0,0,,2024-08-11T16:14:11.244423
RELIG,KOR,https://encrypted-tbn0.gstatic.com/images?q=tbn:ANd9GcQClBp_Mc-aOrmuzEk3uTchB1S5-VsigUYcUw&s,2024-07-02T13:03:06.284914,"A large group of people are seated and watching a performance, with one person standing and raising their arms above their head.",0,0,0,0,0,,2024-08-11T16:14:11.244423
RELIG,KOR,https://encrypted-tbn0.gstatic.com/images?q=tbn:ANd9GcQKL2Yi-uQgMdn5xEpK4neKIQ9vHN54VU8lGw&s,2024-07-02T13:03:06.284914,"A group of people are gathered in a city street, some wearing similar white clothing.",0,0,0,0,0,,2024-08-11T16:14:11.244423
RELIG,KOR,https://encrypted-tbn0.gstatic.com/images?q=tbn:ANd9GcTF2dbWn79XX-THHf08tZNCOnNqaD3C6uWyIw&s,2024-07-02T13:03:06.284914,A group of people in various attire are standing in front of a display of posters.,0,0,0,0,0,,2024-08-11T16:14:11.244423
RELIG,KOR,https://encrypted-tbn0.gstatic.com/images?q=tbn:ANd9GcR9En4ru16MAQvUJ7VBpoQeli6b1dvRiVp_dA&s,2024-07-02T13:03:06.284914,A procession of illuminated figures is moving down a street lined with spectators.,0,0,0,0,0,,2024-08-11T16:14:11.244423
RELIG,KOR,https://lh3.googleusercontent.com/proxy/KL2kupbLMmxjMm-IAs58M_joCzLcGo3DnVBtUlUF5UDgB8p1LNNHYfqtszyYDUNU4DWc7ViLlUSIstfBve8eYAqV0NgjaxYrlkrTJZeoqaCa2hgavHwAb0zBwFd0rr4KXcgI56Q9g4hLM1Qx1I9KEvVmrX-msL49evbxPA,2024-07-02T13:03:06.284914,"A large group of people, including many children, stand in front of a blank wall.",0,0,0,0,0,,2024-08-11T16:14:11.244423
RELIG,KOR,https://img.hankyung.com/photo/201610/AA.12674310.1.jpg,2024-07-02T13:03:06.284914,A large group of people are covered in white substance and laughing.,0,0,0,0,0,,2024-08-11T16:14:11.244423
TOOLS,KOR,https://ling-app.com/wp-content/uploads/2021/11/10-Useful-Korean-Kitchen-Utensils-For-Beginners-9-1.jpg,2024-07-02T13:09:08.171611,"A bowl of soup with various vegetables and white squares in it, placed on a wood surface.",0,0,0,0,0,,2024-08-11T16:14:18.633861
TOOLS,KOR,https://s.alicdn.com/@sc04/kf/H9708c553ae7e495dbc68698c5f37c5d7S.jpg_300x300.jpg,2024-07-02T13:09:08.171611,A collection of various tools for preparing and serving food are arranged in a semi-circle.,0,0,0,0,0,,2024-08-11T16:14:18.633861
TOOLS,KOR,https://ling-app.com/wp-content/uploads/2021/11/10-Useful-Korean-Kitchen-Utensils-For-Beginners-14-1.jpg,2024-07-02T13:09:08.171611,"Metal tongs are holding pieces of meat over a hot, round surface.",0,0,0,0,0,,2024-08-11T16:14:18.633861
TOOLS,KOR,https://image.made-in-china.com/2f0j00yWtopzFUvakf/Wholesale-Korean-Unique-Sustainable-Baking-Tool-Accessories-Wooden-Handle-Kitchen-Stuff-Non-Stick-Silicone-Kitchen-Utensil-Set.webp,2024-07-02T13:09:08.171611,Several sets of utensils are organized in containers next to a group of utensils spread out on a surface.,0,0,0,0,0,,2024-08-11T16:14:18.633861
TOOLS,KOR,https://ling-app.com/wp-content/uploads/2021/11/10-Useful-Korean-Kitchen-Utensils-For-Beginners-6-1.jpg,2024-07-02T13:09:08.171611,A black pot sits on a wooden surface surrounded by various vegetables and kitchen utensils.,0,0,0,0,0,,2024-08-11T16:14:18.633861
TOOLS,KOR,https://i.etsystatic.com/13285936/r/il/8a6a56/3264662235/il_570xN.3264662235_d2xw.jpg,2024-07-02T13:09:08.171611,"Four long, thin utensils lie on a wooden surface.",0,0,0,0,0,,2024-08-11T16:14:18.633861
TOOLS,KOR,https://i0.wp.com/korean-products.com/wp-content/uploads/2014/08/1408c06.jpg?ssl=1,2024-07-02T13:09:08.171611,There are five pots of different colors on a table in front of a kitchen counter.,0,0,0,0,0,,2024-08-11T16:14:18.633861
TOOLS,KOR,"https://m.media-amazon.com/images/I/51yTeBY+swL._AC_UF894,1000_QL80_.jpg",2024-07-02T13:09:08.171611,Eight pairs of scissors with curved blades and red handles are arranged in three rows.,0,0,0,0,0,,2024-08-11T16:14:18.633861
TOOLS,KOR,https://img.kwcdn.com/product/Fancyalgo/VirtualModelMatting/b12b8954269d44ea3334ee74b4a47fe8.jpg?imageMogr2/auto-orient%7CimageView2/2/w/800/q/70/format/webp,2024-07-02T13:09:08.171611,A set of kitchen utensils with wooden handles.,0,0,0,0,0,,2024-08-11T16:14:18.633861
TOOLS,KOR,https://i.ebayimg.com/images/g/wEAAAOSw66hjsM-p/s-l1600.jpg,2024-07-02T13:09:08.171611,Three metal cooking utensils with long handles.,0,0,0,0,0,,2024-08-11T16:14:18.633861
TOOLS,KOR,https://s.alicdn.com/@sc04/kf/H6a965197263045769c76eb1b4cfa6da92.jpg_720x720q50.jpg,2024-07-02T13:09:08.171611,Four different-sized utensils with rounded edges are lined up.,0,0,0,0,0,,2024-08-11T16:14:18.633861
TOOLS,KOR,https://lh6.googleusercontent.com/proxy/Qku756C-39MDJSfwhqshraZgQDK6odfq_ZSdqQmKuul_sLDp5v6_H49SgYbHBfbhrtbSi8b5WLC3IMUwWBrG_xu5Dz-rkMg,2024-07-02T13:09:08.171611,Several round metal objects are lying on a textured surface.,0,0,0,0,0,,2024-08-11T16:14:18.633861
TOOLS,KOR,https://m.media-amazon.com/images/I/614iuXH7yhL.jpg,2024-07-02T13:09:08.171611,"Five long, thin, brown utensils are lined up against a white background.",0,0,0,0,0,,2024-08-11T16:14:18.633861
TOOLS,KOR,https://ae01.alicdn.com/kf/Se2b2a7e411b740279f242c89a0bf6a88m.jpg_640x640Q90.jpg_.webp,2024-07-02T13:09:08.171611,A collection of kitchen utensils organized in a metal stand.,0,0,0,0,0,,2024-08-11T16:14:18.633861
TOOLS,KOR,https://ling-app.com/wp-content/uploads/2021/11/10-Useful-Korean-Kitchen-Utensils-For-Beginners-4-1.jpg,2024-07-02T13:09:08.171611,A white appliance with a grey band sits on a brown surface.,0,0,0,0,0,,2024-08-11T16:14:18.633861
TOOLS,KOR,https://cdnb.artstation.com/p/assets/images/images/033/692/333/large/lilian-martins-utensilios-coreanos-hdri-4k.jpg?1610328157,2024-07-02T13:09:08.171611,A collection of various cooking and eating utensils is laid out on a surface.,0,0,0,0,0,,2024-08-11T16:14:18.633861
TOOLS,KOR,https://www.allrecipes.com/thmb/l42ngRpf1FyhcSaIYspsZV-j5_M=/1500x0/filters:no_upscale():max_bytes(150000):strip_icc()/best-woks-a1ad26f508fa4f99ab246c2cbe6341b1.png,2024-07-02T13:09:08.171611,"A black, round cooking utensil with a handle is pictured against a colorful background.",0,0,0,0,0,,2024-08-11T16:14:18.633861
