category_code,country_code,url,created_at,caption,category_score,country_score,stereotype_score,offensiveness_score,contributors_cnt,contributors,updated_at
CITIES,KOR,https://encrypted-tbn0.gstatic.com/images?q=tbn:ANd9GcToQHKLsp4sefC-UQ_qRE5z50-5xtZiHpyKbA&s,2024-07-02T11:12:19.080188,"A large city with tall buildings, a winding waterway, and green spaces.",0,0,0,0,0,,2024-08-11T16:12:57.640514
CITIES,KOR,https://img.freepik.com/free-photo/beautiful-architecture-building-cityscape-seoul-city_74190-3218.jpg,2024-07-02T11:12:19.080188,A cityscape with a large tower in the distance viewed from a hill.,0,0,0,0,0,,2024-08-11T16:12:57.640514
CITIES,KOR,https://media.npr.org/assets/img/2015/10/01/img_0607-1--edit_wide-b63e584f75803d0faafdcd61d76855c59e5a557d.jpg?s=1400&c=100&f=jpeg,2024-07-02T11:12:19.080188,A view from a tall building overlooking a city with a large body of water and a lot of greenery.,0,0,0,0,0,,2024-08-11T16:12:57.640514
CITIES,KOR,https://media.istockphoto.com/id/621371796/photo/sunset-at-seoul-city-skyline-south-korea.webp?b=1&s=170667a&w=0&k=20&c=l2BmK4AsCJEKZ58NkcFLdtkC8v0zCTnV943goxKiiYQ=,2024-07-02T11:12:19.080188,A large city with a tall tower is illuminated by the setting sun.,0,0,0,0,0,,2024-08-11T16:12:57.640514
CITIES,KOR,https://englishinchester.wordpress.com/wp-content/uploads/2015/11/seoul-south-korea-wide-2.jpg?w=300,2024-07-02T11:12:19.080188,A densely populated urban area with many illuminated buildings and a river flowing through it.,0,0,0,0,0,,2024-08-11T16:12:57.640514
CITIES,KOR,https://t3.ftcdn.net/jpg/05/21/53/90/360_F_521539008_hTNMfIpgu7nLi0ska9zDfzQxXi9L7nVa.jpg,2024-07-02T11:12:19.080188,"A river flows through a city park, with people sitting on the banks and a bridge above the water.",0,0,0,0,0,,2024-08-11T16:12:57.640514
CITIES,KOR,https://static.euronews.com/articles/stories/06/21/75/20/1200x675_cmsv2_039a1e8f-8b55-5e82-b767-9edc847675b2-6217520.jpg,2024-07-02T11:12:19.080188,A cityscape at night with bridges lit up across a body of water.,0,0,0,0,0,,2024-08-11T16:12:57.640514
CITIES,KOR,https://encrypted-tbn0.gstatic.com/images?q=tbn:ANd9GcRrJNYlE3sF-XD2ISHEhqL7CKEufigpz7z6Kg&s,2024-07-02T11:12:19.080188,"A city is illuminated at night, with many buildings and lights visible.",0,0,0,0,0,,2024-08-11T16:12:57.640514
CITIES,KOR,https://cdnph.upi.com/sv/ph/og/i/3081543563629/2018/1/15435638748706/v1.5/South-Korea-launches-project-to-study-North-Korean-cities.jpg,2024-07-02T11:12:19.080188,A large city with a tall pyramid-shaped building in the center.,0,0,0,0,0,,2024-08-11T16:12:57.640514
CITIES,KOR,https://www.inquiriesjournal.com/imgs/1200x1200/crop/article-images/uid-67/65a984.jpg,2024-07-02T11:12:19.080188,A model of a city with many small lights.,0,0,0,0,0,,2024-08-11T16:12:57.640514
CITIES,KOR,https://img.freepik.com/premium-photo/south-korea-cityscape_328191-1578.jpg,2024-07-02T11:22:03.024093,A bridge crosses a body of water in front of a city at night.,0,0,0,0,0,,2024-08-11T16:12:57.640514
CITIES,KOR,https://cdn.crowdpic.net/detail-thumb/thumb_d_27ECB154258F715B71E656ECDD1C5D26.jpg,2024-07-02T11:22:03.024093,A large city with many bridges over a river lit up at night.,0,0,0,0,0,,2024-08-11T16:12:57.640514
CITIES,KOR,https://img.freepik.com/free-photo/south-korea-skyline-seoul-cityscape-south-korea_335224-420.jpg,2024-07-02T11:22:03.024093,"A nighttime cityscape with a river, bridge, and a tall tower in the distance.",0,0,0,0,0,,2024-08-11T16:12:57.640514
CITIES,KOR,https://img.freepik.com/premium-photo/aerial-view-cityscape-seoul-south-korea_571748-1536.jpg,2024-07-02T11:22:03.024093,An aerial view of a densely populated city with a very tall building in the distance.,0,0,0,0,0,,2024-08-11T16:12:57.640514
CITIES,KOR,https://herb-api.hankookilbo.com/api/attaches/image/group/32c2878c-37a0-4c6c-b25f-619aa859aade,2024-07-02T11:22:03.024093,A dense collection of buildings lit up at night.,0,0,0,0,0,,2024-08-11T16:12:57.640514
CITIES,KOR,https://i.pinimg.com/236x/fa/7c/41/fa7c411e92635e20018e5ef1ebce85fd.jpg,2024-07-02T11:22:03.024093,"A large city with tall buildings sits by a river, with a mountain and a tall tower in the background.",0,0,0,0,0,,2024-08-11T16:12:57.640514
CITIES,KOR,https://img.freepik.com/free-photo/beautiful-architecture-building-cityscape-in-seoul-city_74190-3218.jpg,2024-07-02T11:22:03.024093,An aerial view of a city with a tower in the distance.,0,0,0,0,0,,2024-08-11T16:12:57.640514
CITIES,KOR,https://encrypted-tbn0.gstatic.com/images?q=tbn:ANd9GcRC9BAJEOr7P4PtyHUqggr72SDIaaZEjiG0yg&s,2024-07-02T11:22:03.024093,A group of tall buildings stand closely together.,0,0,0,0,0,,2024-08-11T16:12:57.640514
CITIES,KOR,https://img.khan.co.kr/news/2007/10/25/7j2622a.jpg,2024-07-02T11:22:03.024093,"A large city is situated between a mountain range and a flat, open area.",0,0,0,0,0,,2024-08-11T16:12:57.640514
CITIES,KOR,https://encrypted-tbn0.gstatic.com/images?q=tbn:ANd9GcTApmZ_nnVvMbe18Hy3ZB4IbHTajxZmouR8-Q&s,2024-07-02T11:22:03.024093,A dense urban area with a tall tower on a hill is bathed in the light of a setting sun.,0,0,0,0,0,,2024-08-11T16:12:57.640514
CITIES,KOR,https://cdn.pixabay.com/photo/2020/01/06/14/42/seoul-4745489_1280.jpg,2024-07-02T11:22:03.024093,A large body of water with a city skyline in the distance and a bridge in the foreground.,0,0,0,0,0,,2024-08-11T16:12:57.640514
CITIES,KOR,https://cdn.pixabay.com/photo/2019/04/29/07/34/cityscape-4165367_1280.jpg,2024-07-02T11:22:03.024093,A densely populated city with tall buildings illuminated at night.,0,0,0,0,0,,2024-08-11T16:12:57.640514
CITIES,KOR,https://image.fmkorea.com/files/attach/new3/20231005/486616/3712873049/6253783318/0cfbf2c3ebcbea0a1ff4d6a44c9e2c6f.jpeg,2024-07-02T11:22:03.024093,"A city with a tall tower on a hill, surrounded by water and many buildings.",0,0,0,0,0,,2024-08-11T16:12:57.640514
CITIES,KOR,https://cdn.crowdpic.net/detail-thumb/thumb_d_8D017D7E7B797BCC4817768FFF7269B5.jpg,2024-07-02T11:22:03.024093,A large city with many buildings and trees surrounding it.,0,0,0,0,0,,2024-08-11T16:12:57.640514
CITIES,KOR,https://encrypted-tbn0.gstatic.com/images?q=tbn:ANd9GcSpAIhKmNknKzwGFeUyI7odHK7LVOur8gunzg&s,2024-07-02T11:22:03.024093,A tall tower stands in the middle of a city at sunset.,0,0,0,0,0,,2024-08-11T16:12:57.640514
CITIES,KOR,https://encrypted-tbn0.gstatic.com/images?q=tbn:ANd9GcSEbjiiOFANmjQ8MqQDbf05XXVHOVWwoqIefw&s,2024-07-02T11:22:03.024093,"A large, green park with a large building in the center sits surrounded by a densely populated urban area.",0,0,0,0,0,,2024-08-11T16:12:57.640514
CITIES,KOR,https://www.korea.kr/newsWeb/resources/attaches/2021.05/03/PYH2019122503680005400.jpg,2024-07-02T11:22:03.024093,A tall building rises above a city skyline of similar buildings.,0,0,0,0,0,,2024-08-11T16:12:57.640514
CITIES,KOR,https://menu.moneys.co.kr/moneyweek/thumb/2024/06/09/06/2024060916040454983_1.jpg/dims/optimize/,2024-07-02T11:22:03.024093,An aerial view of a large city with many buildings and a body of water in the foreground.,0,0,0,0,0,,2024-08-11T16:12:57.640514
CITIES,KOR,https://i.pinimg.com/550x/f9/9e/8b/f99e8b5b9f0f41ce603b8e46a28c551a.jpg,2024-07-02T11:22:03.024093,A road with many vehicles going through a city with tall buildings at night.,0,0,0,0,0,,2024-08-11T16:12:57.640514
CITIES,KOR,https://lh4.googleusercontent.com/proxy/Rrf0PoASQck6qGjQw8nvF9C3x1Sbn-bpgx11QfX3i9cB0fDFMlwth0g8_VFXzTUefpx4AB2XRSR-toU9OxnKc1rLCjvyqsc-1K9J3lRslKGRbO7Fls8WRa1sjDc0mMN3ea3WvLrqfg,2024-07-02T11:22:03.024093,A panoramic view of a city skyline at dusk.,0,0,0,0,0,,2024-08-11T16:12:57.640514
CITIES,KOR,https://image.fmkorea.com/files/attach/new/20200808/486263/2332535079/3026502050/99b983892094b5c6d2fc3736e15da7d1.jpg,2024-07-02T11:22:03.024093,A city with many tall buildings is situated on a river with a bridge crossing it.,0,0,0,0,0,,2024-08-11T16:12:57.640514
CITIES,KOR,https://encrypted-tbn0.gstatic.com/images?q=tbn:ANd9GcT1A8pLeR3nYXbmP17qo3SqPSNjfBZq3kOirw&s,2024-07-02T11:22:03.024093,A large green park with a winding path and a small pond sits in front of a densely populated urban area.,0,0,0,0,0,,2024-08-11T16:12:57.640514
CITIES,KOR,https://korea.stanford.edu/sites/g/files/sbiybj20371/files/styles/card_1900x950/public/media/image/180831-0004_0.jpg?h=707772c7&itok=4RWog0EL,2024-07-02T11:22:03.024093,A complex of tall buildings and modern structures are surrounded by greenery.,0,0,0,0,0,,2024-08-11T16:12:57.640514
CITIES,KOR,https://encrypted-tbn0.gstatic.com/images?q=tbn:ANd9GcQTWoBM_22fwnwK34H4r9Astq-aRCZ_RtVkYg&s,2024-07-02T11:22:03.024093,"A river has flooded, partially submerging a lush green area with trees and vegetation in front of a cityscape.",0,0,0,0,0,,2024-08-11T16:12:57.640514
CITIES,KOR,https://mono.aks.ac.kr/s/media/b0/b05d1de8-1bda-4fc8-9dc8-6a6a8f7501b8.jpg?preset=page,2024-07-02T11:22:03.024093,A sprawling city with a large industrial area in the distance is seen from a higher vantage point.,0,0,0,0,0,,2024-08-11T16:12:57.640514
CITIES,KOR,https://img.freepik.com/premium-photo/cityscape-without-cars-empty-road-busan-south-korea-vacation-trip-highway-with-nature-scenery-with-drive-holiday-journey-recreation-cityscape-europe-no-transport_250132-2264.jpg,2024-07-02T11:22:03.024093,A street lined with multi-colored buildings and trees.,0,0,0,0,0,,2024-08-11T16:12:57.640514
CITIES,KOR,https://newsimg-hams.hankookilbo.com/2021/11/09/c38bf0ee-7193-473e-b2b4-0626efa788f7.jpg,2024-07-02T11:22:03.024093,An aerial view of a large city with many buildings and a body of water in the center.,0,0,0,0,0,,2024-08-11T16:12:57.640514
CITIES,KOR,https://dimg.donga.com/ugc/CDB/WEEKLY/Article/63/c0/be/4e/63c0be4e1b2bd2738276.jpg,2024-07-02T11:22:03.024093,"A large group of tall buildings are clustered together in a city, surrounded by green spaces and water.",0,0,0,0,0,,2024-08-11T16:12:57.640514
CITIES,KOR,https://encrypted-tbn0.gstatic.com/images?q=tbn:ANd9GcQj-4rxgQ1KIaXNKNudZIS_efDmYL4hrjwR3w&s,2024-07-02T11:22:03.024093,An aerial view of a densely populated urban area with many tall buildings.,0,0,0,0,0,,2024-08-11T16:12:57.640514
CITIES,KOR,https://image.utoimage.com/preview/cp872655/2017/11/201711020979_500.jpg,2024-07-02T11:22:03.024093,A vast urban area with many buildings is seen from above on a clear day.,0,0,0,0,0,,2024-08-11T16:12:57.640514
CLOTH,KOR,https://i.etsystatic.com/21254815/r/il/570326/3141538721/il_570xN.3141538721_22ca.jpg,2024-07-02T11:34:33.077875,"A mannequin is wearing a long, pleated garment with a sash and decorative tassel.",0,0,0,0,0,,2024-08-11T16:13:08.665650
CLOTH,KOR,https://i.etsystatic.com/21254815/r/il/3ddaf5/2226478417/il_570xN.2226478417_s6om.jpg,2024-07-02T11:34:33.077875,"A person wearing a long, patterned, dark blue garment with a white shirt underneath is standing in front of a white background.",0,0,0,0,0,,2024-08-11T16:13:08.665650
CLOTH,KOR,https://i.pinimg.com/564x/ae/45/92/ae4592a24663e92f416afa80b96ecc47.jpg,2024-07-02T11:34:33.077875,A man and a woman are wearing formal garments.,0,0,0,0,0,,2024-08-11T16:13:08.665650
CLOTH,KOR,https://i.ebayimg.com/images/g/gUEAAOSwMrZjRn~y/s-l1200.jpg,2024-07-02T11:34:33.077875,"A woman is wearing a long, flowing dress with a lighter colored top and a pink bottom.",0,0,0,0,0,,2024-08-11T16:13:08.665650
CLOTH,KOR,https://ae01.alicdn.com/kf/S9d6e0894c1604fea98dc9e209512453fD/Kids-Hanbok-Traditional-Korean-Costume-Korean-Hanbok-Costume-for-Boys-Children-Ethnic-Asian-Clothes-Retro-Dance.jpg,2024-07-02T11:34:33.077875,A young person is sitting on a stool wearing a long red garment.,0,0,0,0,0,,2024-08-11T16:13:08.665650
CLOTH,KOR,https://media.gq-magazine.co.uk/photos/5d13916808038fd116c515fc/16:9/w_2560%2Cc_limit/Korea-comp-GQ-04Apr16_b.jpg,2024-07-02T11:34:33.077875,Five young men are wearing different types of clothing while walking in a line.,0,0,0,0,0,,2024-08-11T16:13:08.665650
CLOTH,KOR,https://lh4.googleusercontent.com/proxy/qA3kCdW2fQn3Goyb4Gafr01MO-j4wXP4u6B61IqtnyyZVK72sXrDeAhb57PSk4EuGWlOlOBnWXUwzEDY4-KbNw,2024-07-02T11:34:33.077875,"A person in a long, flowing garment stands against a dark background.",0,0,0,0,0,,2024-08-11T16:13:08.665650
CLOTH,KOR,https://m.media-amazon.com/images/I/715PMZ5UqML._AC_UY1000_.jpg,2024-07-02T11:34:33.077875,A person wearing a light grey vest and matching pants stands on a paved surface.,0,0,0,0,0,,2024-08-11T16:13:08.665650
CLOTH,KOR,https://i.ebayimg.com/images/g/LygAAOSw3NhkSNym/s-l1200.webp,2024-07-02T11:34:33.077875,"A young woman wears a long, white and pink dress with a floral pattern.",0,0,0,0,0,,2024-08-11T16:13:08.665650
CLOTH,KOR,https://assets.vogue.com/photos/58918af6ce34fb453af7b868/master/w_1600%2Cc_limit/07-kpop-streetwear-sjyp.jpg,2024-07-02T11:34:33.077875,A person is wearing a yellow sweater and a long blue skirt with a slit in the front.,0,0,0,0,0,,2024-08-11T16:13:08.665650
CLOTH,KOR,https://fashionista.com/.image/ar_1:1%2Cc_fill%2Ccs_srgb%2Cfl_progressive%2Cq_auto:good%2Cw_1200/MTk0MjgyMzY5NDMwMDcwOTYx/buzzy_korean_brands-2.jpg,2024-07-02T11:34:33.077875,A collage of five people wearing various clothing items.,0,0,0,0,0,,2024-08-11T16:13:08.665650
CLOTH,KOR,https://qph.cf2.quoracdn.net/main-qimg-a9385754fef481b66f2281fda55124fa-lq,2024-07-02T11:34:33.077875,A person with long brown hair is wearing a brown coat with a belt and holding a brown bag.,0,0,0,0,0,,2024-08-11T16:13:08.665650
CLOTH,KOR,https://koreanstyle-shop.com/cdn/shop/products/Hanbok-Women-Korean-Traditional-Dress-3_1200x1200.jpg?v=1639755900,2024-07-02T11:34:33.077875,"A woman is wearing a long, flowing garment with a long sash tied around her waist.",0,0,0,0,0,,2024-08-11T16:13:08.665650
CLOTH,KOR,https://i.ebayimg.com/images/g/qcUAAOSw6DtYU5wq/s-l1200.jpg,2024-07-02T11:34:33.077875,"Two men are wearing long, flowing garments with wide sashes and hats.",0,0,0,0,0,,2024-08-11T16:13:08.665650
CLOTH,KOR,https://i.etsystatic.com/21254815/r/il/00de26/2912555221/il_570xN.2912555221_eorp.jpg,2024-07-02T11:34:33.077875,A man and a woman are wearing traditional clothing.,0,0,0,0,0,,2024-08-11T16:13:08.665650
CLOTH,KOR,https://i.pinimg.com/474x/87/ea/e1/87eae143d37d52134819145270dd04c8.jpg,2024-07-02T11:34:33.077875,A man and a woman are dressed in elaborate and flowing garments.,0,0,0,0,0,,2024-08-11T16:13:08.665650
CLOTH,KOR,https://m.media-amazon.com/images/I/41es7s1+FdL._AC_UY1000_.jpg,2024-07-02T11:34:33.077875,"A person is wearing a long, flowing dress with a light blue top and a pink bottom.",0,0,0,0,0,,2024-08-11T16:13:08.665650
CLOTH,KOR,https://media.vogue.co.uk/photos/5d54c17112e31a0008486619/2:3/w_2560%2Cc_limit/original,2024-07-02T11:34:33.077875,"A person with long hair is wearing a long yellow coat, checkered pants, and black shoes, walking forward on a gray surface.",0,0,0,0,0,,2024-08-11T16:13:08.665650
CLOTH,KOR,https://i0.wp.com/www.fashionchingu.com/wp-content/uploads/2022/01/alex-finch-seoul-fashion-week.jpg,2024-07-02T11:34:33.077875,"Four men are standing in a row, wearing dark clothing and boots.",0,0,0,0,0,,2024-08-11T16:13:08.665650
CLOTH,KOR,"https://hips.hearstapps.com/hmg-prod/images/korean-fashion-brands-1596477210.jpg?crop=0.6666666666666666xw:1xh;center,top&resize=1200:*",2024-07-02T11:34:33.077875,"A collage of five photos, each featuring a person wearing different clothes.",0,0,0,0,0,,2024-08-11T16:13:08.665650
CLOTH,KOR,https://m.media-amazon.com/images/I/71rXXu2CZdL._AC_UY1000_.jpg,2024-07-02T11:34:33.077875,Seven people are wearing similar long-sleeved shirts and pants with some variations in color.,0,0,0,0,0,,2024-08-11T16:13:08.665650
CLOTH,KOR,https://m.media-amazon.com/images/I/612akp6R6DL._AC_UY1000_.jpg,2024-07-02T11:34:33.077875,"A woman is wearing a long, flowing, embroidered dress.",0,0,0,0,0,,2024-08-11T16:13:08.665650
CLOTH,KOR,https://assets.vogue.com/photos/6065976232d2528b5cd01b4b/master/w_2560%2Cc_limit/00_story.jpg,2024-07-02T11:34:33.077875,Five people are standing in a row wearing different styles of clothing.,0,0,0,0,0,,2024-08-11T16:13:08.665650
CLOTH,KOR,https://upload.wikimedia.org/wikipedia/commons/thumb/e/e3/Hanbok_%28female_and_male%29.jpg/220px-Hanbok_%28female_and_male%29.jpg,2024-07-02T11:42:15.711148,"Two people are standing in front of a plain background, wearing long, flowing garments.",0,0,0,0,0,,2024-08-11T16:13:08.665650
CLOTH,KOR,https://encrypted-tbn0.gstatic.com/images?q=tbn:ANd9GcSlPquKS2q6eJmif2z1depr5c1Iy7qt4nX0gA&s,2024-07-02T11:42:15.711148,"A long, flowing garment with a wide, loose skirt and a long, tight-fitting top is displayed on a mannequin.",0,0,0,0,0,,2024-08-11T16:13:08.665650
CLOTH,KOR,https://encrypted-tbn0.gstatic.com/images?q=tbn:ANd9GcTKW9M8L3emHlcXYoqijWuTokS1fnbztXZrBQ&s,2024-07-02T11:42:15.711148,"Six mannequins are arranged in two rows, each wearing different garments with elaborate headdresses.",0,0,0,0,0,,2024-08-11T16:13:08.665650
CLOTH,KOR,https://i.pinimg.com/236x/27/0b/36/270b36c46c235d2ff0db713bf079412e.jpg,2024-07-02T11:42:15.711148,"A long, loose-fitting garment with long sleeves and a wide collar is worn over a shorter, red garment with decorative trim.",0,0,0,0,0,,2024-08-11T16:13:08.665650
CLOTH,KOR,https://encrypted-tbn0.gstatic.com/images?q=tbn:ANd9GcQyUesSkJxrRu0TD8EKY6FtUqu8Ndhsb52N6Q&s,2024-07-02T11:42:15.711148,"A man and a woman are wearing traditional, flowing garments.",0,0,0,0,0,,2024-08-11T16:13:08.665650
CLOTH,KOR,https://encrypted-tbn0.gstatic.com/images?q=tbn:ANd9GcSXsGqI8vEQxf9-rMolXg-ij4HkeWc3DC1dTg&s,2024-07-02T11:42:15.711148,"A person wearing a long, belted garment stands in front of a window.",0,0,0,0,0,,2024-08-11T16:13:08.665650
CLOTH,KOR,https://i.pinimg.com/236x/70/17/08/701708e4f5ddeaa87f6ac2ad209a8fad.jpg,2024-07-02T11:42:15.711148,"The image shows a person wearing a long, loose-fitting garment with a gathered skirt.",0,0,0,0,0,,2024-08-11T16:13:08.665650
CLOTH,KOR,https://img1.daumcdn.net/thumb/R800x0/?scode=mtistory2&fname=https%3A%2F%2Ft1.daumcdn.net%2Fcfile%2Ftistory%2F99E610505EB8DE8231,2024-07-02T11:42:15.711148,Two garments with long sleeves and full skirts hang on wooden hangers.,0,0,0,0,0,,2024-08-11T16:13:08.665650
CLOTH,KOR,https://images3.kolonmall.com/upload/olomagazine/opinion__6__detail__4__2.jpg,2024-07-02T11:42:15.711148,A woman is wearing a long-sleeved grey sweater over a pink quilted vest.,0,0,0,0,0,,2024-08-11T16:13:08.665650
CLOTH,KOR,https://www.jungle.co.kr/image/40fddc9e44248e45b6dd175b,2024-07-02T11:42:15.711148,"A person is wearing a long, flowing garment and sitting on a bench.",0,0,0,0,0,,2024-08-11T16:13:08.665650
CLOTH,KOR,https://images3.kolonmall.com/upload/olomagazine/opinion__6__detail__4__1.jpg,2024-07-02T11:42:15.711148,A person with brown hair is standing in front of a white wall wearing a white jacket and gray pants.,0,0,0,0,0,,2024-08-11T16:13:08.665650
DANCE,KOR,https://disco.teak.fi/asia/wp-content/uploads/2017/10/kor37.jpg,2024-07-02T11:51:16.720768,"Many people in colorful clothing hold fans in front of them, forming a circle.",0,0,0,0,0,,2024-08-11T16:13:33.210941
DANCE,KOR,https://mjkpa.com/wp-content/uploads/2016/10/img_5163.png?w=590&h=590&crop=1,2024-07-02T11:51:16.720768,A group of people are holding brightly colored fans and performing in a coordinated dance.,0,0,0,0,0,,2024-08-11T16:13:33.210941
DANCE,KOR,https://thereser.org/wp-content/uploads/2022/09/Beauty-of-Korea.jpg,2024-07-02T11:51:16.720768,"A group of people in colorful clothing hold large, decorated fans while performing a dance routine.",0,0,0,0,0,,2024-08-11T16:13:33.210941
DANCE,KOR,https://i.ytimg.com/vi/yqBnNzdbPGI/hqdefault.jpg,2024-07-02T11:51:16.720768,A group of people wearing colorful clothing and large fans are performing a dance in a large space.,0,0,0,0,0,,2024-08-11T16:13:33.210941
DANCE,KOR,https://static01.nyt.com/images/2023/07/16/multimedia/16Korea-One-Dance-02-phzw/16Korea-One-Dance-02-phzw-mediumSquareAt3X.jpg,2024-07-02T11:51:16.720768,A group of individuals in similar attire are leaping in unison in front of a backdrop of vertical pillars.,0,0,0,0,0,,2024-08-11T16:13:33.210941
DANCE,KOR,https://www.korea.net/upload/content/image/1548748314538.jpg,2024-07-02T11:51:16.720768,"A group of people are performing on a stage, wearing colourful and elaborate costumes, some with masks, others holding white fabric.",0,0,0,0,0,,2024-08-11T16:13:33.210941
DANCE,KOR,https://cdn.shopify.com/s/files/1/0563/3723/6133/files/7be632467c9129c3e896dcd4f5ecbbf7.jpg?v=1645423060,2024-07-02T11:51:16.720768,A group of people are performing with decorative fans.,0,0,0,0,0,,2024-08-11T16:13:33.210941
DANCE,KOR,https://i.pinimg.com/originals/f2/79/a3/f279a3d86e6a604fc9bf49d06a4df065.jpg,2024-07-02T11:51:16.720768,Three women in long flowing robes are dancing while playing drums.,0,0,0,0,0,,2024-08-11T16:13:33.210941
DANCE,KOR,https://images.squarespace-cdn.com/content/v1/581ff5eef5e231b25f9c12db/1484696115862-RRRXT9N18S2PEMVIS4M4/image-asset.jpeg,2024-07-02T11:51:16.720768,"A group of people in white and red clothing are holding large, decorated fans.",0,0,0,0,0,,2024-08-11T16:13:33.210941
DANCE,KOR,https://tile.loc.gov/storage-services/service/gdc/gdcwebcasts/14/07/23/af/c1/20/0/140723afc1200/140723afc1200_1016.0_thumb.jpg,2024-07-02T11:51:16.720768,People in colorful outfits are playing drums and other musical instruments.,0,0,0,0,0,,2024-08-11T16:13:33.210941
DANCE,KOR,https://images.squarespace-cdn.com/content/v1/581ff5eef5e231b25f9c12db/1535594389653-ZGGD6B616QL85ZZ1AYEH/92y+yeonhee+Hwal.jpg,2024-07-02T11:51:16.720768,"Four people are performing on stage, one with a large drum.",0,0,0,0,0,,2024-08-11T16:13:33.210941
DANCE,KOR,https://www.allarts.org/wp-content/uploads/2023/07/Act1-2.close-2_HwangPiljoo_.jpg,2024-07-02T11:51:16.720768,A group of people in orange clothing and black hats perform a synchronized dance holding long sticks.,0,0,0,0,0,,2024-08-11T16:13:33.210941
DANCE,KOR,https://manoa.hawaii.edu/koreanstudies/wp-content/uploads/2019/02/maskdance.png,2024-07-02T11:51:16.720768,A person wearing a mask and a long robe is playing a drum and moving their body in a dance-like pose.,0,0,0,0,0,,2024-08-11T16:13:33.210941
DANCE,KOR,https://italia.korean-culture.org/CONTENTS/editImage/2022/11/26/20221126005205613798.jpg,2024-07-02T11:51:16.720768,"A group of people are posed in front of a dark background, some are sitting and some are standing.",0,0,0,0,0,,2024-08-11T16:13:33.210941
DANCE,KOR,https://www.allarts.org/wp-content/uploads/2023/07/Act4-1-close-2-HwangPiljoo.jpg,2024-07-02T11:51:16.720768,A group of performers in long white and dark red garments are dancing in a synchronized manner.,0,0,0,0,0,,2024-08-11T16:13:33.210941
DANCE,KOR,https://media.hswstatic.com/eyJidWNrZXQiOiJjb250ZW50Lmhzd3N0YXRpYy5jb20iLCJrZXkiOiJnaWZcL2JsYWNrcGluay5qcGciLCJlZGl0cyI6eyJyZXNpemUiOnsid2lkdGgiOjgyOH19fQ==,2024-07-02T11:51:16.720768,A group of people are dancing in front of a purple and black background.,0,0,0,0,0,,2024-08-11T16:13:33.210941
DANCE,KOR,https://img.koreatimes.co.kr/upload/newsV2/images/202109/b94bfa3ff51440539150713f53cbc37c.jpg/dims/resize/740/optimize,2024-07-02T11:51:16.720768,"Five individuals are performing a dance routine, each holding and manipulating a long, flowing red ribbon.",0,0,0,0,0,,2024-08-11T16:13:33.210941
DANCE,KOR,https://cdn.shopify.com/s/files/1/0563/3723/6133/files/2_c5faedc0-6ac9-49c7-aec1-875b6e2f0d80.jpg?v=1645423063,2024-07-02T11:51:16.720768,Three people in white and purple clothing are playing drums and dancing.,0,0,0,0,0,,2024-08-11T16:13:33.210941
DANCE,KOR,https://www.antiquealive.com/Blogs/images/arts/minwha/Minhwa-Korean-folk-painting-tiger-magpie.jpg,2024-07-02T11:51:16.720768,"Two animals are painted on a tan background. One is a spotted feline, the other a striped feline.",0,0,0,0,0,,2024-08-11T16:13:33.210941
DANCE,KOR,https://encrypted-tbn0.gstatic.com/images?q=tbn:ANd9GcSvr5MGIDmjxjFbduX6M9JABXlIfwWp6xeqKA&s,2024-07-02T11:51:16.720768,"Six people are lying on a floor, and six chairs are arranged around them.",0,0,0,0,0,,2024-08-11T16:13:33.210941
DANCE,KOR,https://soribeat.org/wp-content/uploads/slider/cache/c475499eb951b16dbef6a871753f3eb5/bg1.jpg,2024-07-02T11:51:16.720768,"Four people are sitting on a stage in front of blue patterned fabric, each playing a musical instrument.",0,0,0,0,0,,2024-08-11T16:13:33.210941
DANCE,KOR,https://abbiandheradventures.wordpress.com/wp-content/uploads/2014/10/ggg.jpg,2024-07-02T11:51:16.720768,"A group of people dressed in long, flowing robes perform a dance on a stage.",0,0,0,0,0,,2024-08-11T16:13:33.210941
DANCE,KOR,https://media.wbur.org/wp/2024/03/5_PSY-performs-Gangnam-Style-400x409.jpg,2024-07-02T11:51:16.720768,A group of people are posing for a photo in front of a light display.,0,0,0,0,0,,2024-08-11T16:13:33.210941
DANCE,KOR,https://media.al.com/montgomery/photo/11506011-large.jpg,2024-07-02T11:51:16.720768,A group of women in colorful clothing are performing a dance with large fans.,0,0,0,0,0,,2024-08-11T16:13:33.210941
DANCE,KOR,https://news.illinoisstate.edu/files/2014/03/ISUPAC2.jpg,2024-07-02T11:51:16.720768,A large building with mostly glass walls.,0,0,0,0,0,,2024-08-11T16:13:33.210941
DANCE,KOR,https://www.ocregister.com/wp-content/uploads/2017/09/1001-ocr-l-vasoulofkorea-02_24579624.jpg?w=620,2024-07-02T11:51:16.720768,A group of people are performing with large decorated fans.,0,0,0,0,0,,2024-08-11T16:13:33.210941
DANCE,KOR,https://encrypted-tbn0.gstatic.com/images?q=tbn:ANd9GcRHEHzqcnD273Ax1TgD1P4xVt_y34zy4TAEGA&s,2024-07-02T11:51:16.720768,A group of people are watching a large screen with moving figures.,0,0,0,0,0,,2024-08-11T16:13:33.210941
DANCE,KOR,https://kccuk.org.uk/media/images/BY_01_hanfilm.1ebcb70e.fill-1200x630.jpg,2024-07-02T11:51:16.720768,Two people wearing pink outfits are leaping through the air.,0,0,0,0,0,,2024-08-11T16:13:33.210941
DANCE,KOR,https://soribeat.org/wp-content/uploads/2020/06/Chansoo-Lee-scaled-1024x683.jpg,2024-07-02T11:51:16.720768,A person in a colorful costume dances on a stage holding a small drum in one hand.,0,0,0,0,0,,2024-08-11T16:13:33.210941
